18:24:50.708882 IP ip-91-197-13-37.gadu-gadu.pl.8074 > migajek.us.to.41839: Flags [P.], seq 3530724829:3530724855, ack 465067648, win 548, length 26
18:24:50.708924 IP migajek.us.to.41839 > ip-91-197-13-37.gadu-gadu.pl.8074: Flags [.], ack 26, win 308, length 0
18:24:50.710080 IP migajek.us.to.55717 > 192.168.1.254.domain: 61742+ PTR? 37.13.197.91.in-addr.arpa. (43)
18:24:50.712124 IP 192.168.1.254.domain > migajek.us.to.55717: 61742 1/2/2 (153)
18:24:50.715328 IP migajek.us.to.59499 > 192.168.1.254.domain: 35578+ PTR? 254.1.168.192.in-addr.arpa. (44)
18:24:50.717355 IP 192.168.1.254.domain > migajek.us.to.59499: 35578 NXDomain* 0/1/0 (114)
18:24:50.760994 IP migajek.us.to.56900 > 192.168.1.254.domain: 53727+ AAAA? api.gadu-gadu.pl. (34)
18:24:50.763150 IP 192.168.1.254.domain > migajek.us.to.56900: 53727 0/1/0 (79)
18:24:50.763318 IP migajek.us.to.50781 > 192.168.1.254.domain: 56945+ AAAA? api.gadu-gadu.pl. (34)
18:24:50.765397 IP 192.168.1.254.domain > migajek.us.to.50781: 56945 0/1/0 (79)
18:24:50.765659 IP migajek.us.to.49600 > 192.168.1.254.domain: 6569+ A? api.gadu-gadu.pl. (34)
18:24:50.767531 IP 192.168.1.254.domain > migajek.us.to.49600: 6569 2/2/2 A[|domain]
18:24:50.768985 IP migajek.us.to.40725 > ip-91-197-13-247.gadu-gadu.pl.www: Flags [S], seq 885201243, win 5840, options [mss 1460,sackOK,TS val 70687348 ecr 0,nop,wscale 6], length 0
18:24:50.786295 IP ip-91-197-13-247.gadu-gadu.pl.www > migajek.us.to.40725: Flags [S.], seq 1124796972, ack 885201244, win 5840, options [mss 1460,nop,nop,sackOK,nop,wscale 4], length 0
18:24:50.786348 IP migajek.us.to.40725 > ip-91-197-13-247.gadu-gadu.pl.www: Flags [.], ack 1, win 92, length 0
18:24:50.805447 IP migajek.us.to.40725 > ip-91-197-13-247.gadu-gadu.pl.www: Flags [P.], seq 1:167, ack 1, win 92, length 166
18:24:50.821670 IP ip-91-197-13-247.gadu-gadu.pl.www > migajek.us.to.40725: Flags [.], ack 167, win 432, length 0
18:24:50.827807 IP migajek.us.to.mdns > 224.0.0.251.mdns: 0 PTR (QM)? 254.1.168.192.in-addr.arpa. (44)
18:24:50.854012 IP ip-91-197-13-247.gadu-gadu.pl.www > migajek.us.to.40725: Flags [P.], seq 1:743, ack 167, win 432, length 742
18:24:50.854033 IP migajek.us.to.40725 > ip-91-197-13-247.gadu-gadu.pl.www: Flags [.], ack 743, win 115, length 0
18:24:50.855582 IP ip-91-197-13-247.gadu-gadu.pl.www > migajek.us.to.40725: Flags [F.], seq 743, ack 167, win 432, length 0
18:24:50.855892 IP migajek.us.to.40725 > ip-91-197-13-247.gadu-gadu.pl.www: Flags [F.], seq 167, ack 744, win 115, length 0
18:24:50.874325 IP ip-91-197-13-247.gadu-gadu.pl.www > migajek.us.to.40725: Flags [.], ack 168, win 432, length 0
18:24:51.835506 IP migajek.us.to.mdns > 224.0.0.251.mdns: 0 PTR (QM)? 254.1.168.192.in-addr.arpa. (44)
18:24:53.837970 IP migajek.us.to.mdns > 224.0.0.251.mdns: 0 PTR (QM)? 254.1.168.192.in-addr.arpa. (44)
18:24:55.703102 ARP, Request who-has migajek.us.to tell 192.168.1.254, length 46
18:24:55.703121 ARP, Reply migajek.us.to is-at 00:19:66:79:f9:86 (oui Unknown), length 28
18:24:55.730027 IP migajek.us.to.42091 > 192.168.1.254.domain: 13166+ PTR? 247.13.197.91.in-addr.arpa. (44)
18:24:55.732065 IP 192.168.1.254.domain > migajek.us.to.42091: 13166 1/2/2 (155)
18:24:55.732463 IP migajek.us.to.32943 > 192.168.1.254.domain: 47426+ PTR? 251.0.0.224.in-addr.arpa. (42)
18:24:55.734530 IP 192.168.1.254.domain > migajek.us.to.32943: 47426 NXDomain* 0/1/0 (100)
18:24:55.835161 IP migajek.us.to.mdns > 224.0.0.251.mdns: 0 PTR (QM)? 251.0.0.224.in-addr.arpa. (42)
18:24:56.836596 IP migajek.us.to.mdns > 224.0.0.251.mdns: 0 PTR (QM)? 251.0.0.224.in-addr.arpa. (42)
18:24:58.838137 IP migajek.us.to.mdns > 224.0.0.251.mdns: 0 PTR (QM)? 251.0.0.224.in-addr.arpa. (42)
18:25:11.803562 IP ip-91-197-13-37.gadu-gadu.pl.8074 > migajek.us.to.41839: Flags [P.], seq 26:52, ack 1, win 548, length 26
18:25:11.803602 IP migajek.us.to.41839 > ip-91-197-13-37.gadu-gadu.pl.8074: Flags [.], ack 52, win 308, length 0
18:25:11.878026 IP migajek.us.to.47624 > 192.168.1.254.domain: 39280+ AAAA? api.gadu-gadu.pl. (34)
18:25:11.896541 IP 192.168.1.254.domain > migajek.us.to.47624: 39280 0/1/0 (79)
18:25:11.903058 IP migajek.us.to.57350 > 192.168.1.254.domain: 7427+ AAAA? api.gadu-gadu.pl. (34)
18:25:11.904961 IP 192.168.1.254.domain > migajek.us.to.57350: 7427 0/1/0 (79)
18:25:11.910990 IP migajek.us.to.58409 > 192.168.1.254.domain: 4449+ A? api.gadu-gadu.pl. (34)
18:25:11.912826 IP 192.168.1.254.domain > migajek.us.to.58409: 4449 2/2/2 A[|domain]
18:25:11.920840 IP ip-91-197-13-37.gadu-gadu.pl.8074 > migajek.us.to.41839: Flags [P.], seq 52:106, ack 1, win 548, length 54
18:25:11.920885 IP migajek.us.to.41839 > ip-91-197-13-37.gadu-gadu.pl.8074: Flags [.], ack 106, win 308, length 0
18:25:11.996342 IP migajek.us.to.40726 > ip-91-197-13-247.gadu-gadu.pl.www: Flags [S], seq 1206465285, win 5840, options [mss 1460,sackOK,TS val 70692655 ecr 0,nop,wscale 6], length 0
18:25:11.999077 IP migajek.us.to.56771 > 192.168.1.254.domain: 19544+ AAAA? api.gadu-gadu.pl. (34)
18:25:12.000964 IP 192.168.1.254.domain > migajek.us.to.56771: 19544 0/1/0 (79)
18:25:12.008322 IP migajek.us.to.59429 > 192.168.1.254.domain: 869+ AAAA? api.gadu-gadu.pl. (34)
18:25:12.010207 IP 192.168.1.254.domain > migajek.us.to.59429: 869 0/1/0 (79)
18:25:12.011499 IP ip-91-197-13-247.gadu-gadu.pl.www > migajek.us.to.40726: Flags [S.], seq 1147187001, ack 1206465286, win 5840, options [mss 1460,nop,nop,sackOK,nop,wscale 4], length 0
18:25:12.011540 IP migajek.us.to.40726 > ip-91-197-13-247.gadu-gadu.pl.www: Flags [.], ack 1, win 92, length 0
18:25:12.023142 IP migajek.us.to.52849 > 192.168.1.254.domain: 22775+ A? api.gadu-gadu.pl. (34)
18:25:12.024996 IP 192.168.1.254.domain > migajek.us.to.52849: 22775 2/2/2 A[|domain]
18:25:12.133479 IP migajek.us.to.40726 > ip-91-197-13-247.gadu-gadu.pl.www: Flags [P.], seq 1:167, ack 1, win 92, length 166
18:25:12.133790 IP migajek.us.to.40727 > ip-91-197-13-247.gadu-gadu.pl.www: Flags [S], seq 1204248392, win 5840, options [mss 1460,sackOK,TS val 70692689 ecr 0,nop,wscale 6], length 0
18:25:12.150012 IP ip-91-197-13-247.gadu-gadu.pl.www > migajek.us.to.40726: Flags [.], ack 167, win 432, length 0
18:25:12.150065 IP ip-91-197-13-247.gadu-gadu.pl.www > migajek.us.to.40727: Flags [S.], seq 1153301706, ack 1204248393, win 5840, options [mss 1460,nop,nop,sackOK,nop,wscale 4], length 0
18:25:12.150092 IP migajek.us.to.40727 > ip-91-197-13-247.gadu-gadu.pl.www: Flags [.], ack 1, win 92, length 0
18:25:12.155216 IP migajek.us.to.40727 > ip-91-197-13-247.gadu-gadu.pl.www: Flags [P.], seq 1:167, ack 1, win 92, length 166
18:25:12.171720 IP ip-91-197-13-247.gadu-gadu.pl.www > migajek.us.to.40727: Flags [.], ack 167, win 432, length 0
18:25:12.180691 IP ip-91-197-13-247.gadu-gadu.pl.www > migajek.us.to.40726: Flags [P.], seq 1:693, ack 167, win 432, length 692
18:25:12.180734 IP migajek.us.to.40726 > ip-91-197-13-247.gadu-gadu.pl.www: Flags [.], ack 693, win 113, length 0
18:25:12.194779 IP ip-91-197-13-247.gadu-gadu.pl.www > migajek.us.to.40726: Flags [F.], seq 693, ack 167, win 432, length 0
18:25:12.195489 IP migajek.us.to.40726 > ip-91-197-13-247.gadu-gadu.pl.www: Flags [F.], seq 167, ack 694, win 113, length 0
18:25:12.198011 IP ip-91-197-13-247.gadu-gadu.pl.www > migajek.us.to.40727: Flags [P.], seq 1:743, ack 167, win 432, length 742
18:25:12.198062 IP migajek.us.to.40727 > ip-91-197-13-247.gadu-gadu.pl.www: Flags [.], ack 743, win 115, length 0
18:25:12.200595 IP ip-91-197-13-247.gadu-gadu.pl.www > migajek.us.to.40727: Flags [F.], seq 743, ack 167, win 432, length 0
18:25:12.203335 IP migajek.us.to.40727 > ip-91-197-13-247.gadu-gadu.pl.www: Flags [F.], seq 167, ack 744, win 115, length 0
18:25:12.211225 IP ip-91-197-13-247.gadu-gadu.pl.www > migajek.us.to.40726: Flags [.], ack 168, win 432, length 0
18:25:12.220300 IP ip-91-197-13-247.gadu-gadu.pl.www > migajek.us.to.40727: Flags [.], ack 168, win 432, length 0
18:25:13.270010 IP migajek.us.to.36449 > 192.168.1.254.domain: 51784+ AAAA? wp.pl. (23)
18:25:13.274810 IP 192.168.1.254.domain > migajek.us.to.36449: 51784 0/1/0 (79)
18:25:13.279134 IP migajek.us.to.50635 > 192.168.1.254.domain: 35952+ AAAA? wp.pl. (23)
18:25:13.280969 IP 192.168.1.254.domain > migajek.us.to.50635: 35952 0/1/0 (79)
18:25:13.281140 IP migajek.us.to.38199 > 192.168.1.254.domain: 3403+ A? wp.pl. (23)
18:25:13.282570 IP 192.168.1.254.domain > migajek.us.to.38199: 3403 1/3/3 A 212.77.100.101 (150)
18:25:13.282951 IP migajek.us.to.34590 > www.wp.pl.www: Flags [S], seq 1222855932, win 5840, options [mss 1460,sackOK,TS val 70692977 ecr 0,nop,wscale 6], length 0
18:25:13.283311 IP migajek.us.to.59221 > 192.168.1.254.domain: 22830+ PTR? 101.100.77.212.in-addr.arpa. (45)
18:25:13.290075 IP www.wp.pl.www > migajek.us.to.34590: Flags [S.], seq 506881756, ack 1222855933, win 4380, options [mss 1460,nop,wscale 0,sackOK,eol], length 0
18:25:13.290144 IP migajek.us.to.34590 > www.wp.pl.www: Flags [.], ack 1, win 92, length 0
18:25:13.290665 IP migajek.us.to.34590 > www.wp.pl.www: Flags [P.], seq 1:946, ack 1, win 92, length 945
18:25:13.291989 IP 192.168.1.254.domain > migajek.us.to.59221: 22830 1/2/2 (136)
18:25:13.304268 IP www.wp.pl.www > migajek.us.to.34590: Flags [P.], seq 1:404, ack 946, win 5325, length 403
18:25:13.304324 IP migajek.us.to.34590 > www.wp.pl.www: Flags [.], ack 404, win 108, length 0
18:25:13.304961 IP www.wp.pl.www > migajek.us.to.34590: Flags [F.], seq 404, ack 946, win 5325, length 0
18:25:13.310672 IP migajek.us.to.34590 > www.wp.pl.www: Flags [F.], seq 946, ack 405, win 108, length 0
18:25:13.316835 IP www.wp.pl.www > migajek.us.to.34590: Flags [.], ack 947, win 5325, length 0
18:25:13.399079 IP migajek.us.to.43254 > 192.168.1.254.domain: 25207+ AAAA? www.wp.pl. (27)
18:25:13.403800 IP 192.168.1.254.domain > migajek.us.to.43254: 25207 0/1/0 (83)
18:25:13.407272 IP migajek.us.to.53984 > 192.168.1.254.domain: 55896+ AAAA? www.wp.pl. (27)
18:25:13.409149 IP 192.168.1.254.domain > migajek.us.to.53984: 55896 0/1/0 (83)
18:25:13.409232 IP migajek.us.to.35323 > 192.168.1.254.domain: 59919+ A? www.wp.pl. (27)
18:25:13.410669 IP 192.168.1.254.domain > migajek.us.to.35323: 59919 1/3/3 A 212.77.100.101 (154)
18:25:13.410885 IP migajek.us.to.34591 > www.wp.pl.www: Flags [S], seq 1237562676, win 5840, options [mss 1460,sackOK,TS val 70693009 ecr 0,nop,wscale 6], length 0
18:25:13.420007 IP www.wp.pl.www > migajek.us.to.34591: Flags [S.], seq 2774891800, ack 1237562677, win 4380, options [mss 1460,nop,wscale 0,sackOK,eol], length 0
18:25:13.420050 IP migajek.us.to.34591 > www.wp.pl.www: Flags [.], ack 1, win 92, length 0
18:25:13.420305 IP migajek.us.to.34591 > www.wp.pl.www: Flags [.], seq 1:1461, ack 1, win 92, length 1460
18:25:13.420315 IP migajek.us.to.34591 > www.wp.pl.www: Flags [P.], seq 1461:1849, ack 1, win 92, length 388
18:25:13.432428 IP www.wp.pl.www > migajek.us.to.34591: Flags [.], ack 1461, win 5840, length 0
18:25:13.451662 IP www.wp.pl.www > migajek.us.to.34591: Flags [P.], seq 1:1461, ack 1849, win 6228, length 1460
18:25:13.451710 IP migajek.us.to.34591 > www.wp.pl.www: Flags [.], ack 1461, win 137, length 0
18:25:13.453271 IP www.wp.pl.www > migajek.us.to.34591: Flags [P.], seq 1461:2921, ack 1849, win 6228, length 1460
18:25:13.453307 IP migajek.us.to.34591 > www.wp.pl.www: Flags [.], ack 2921, win 183, length 0
18:25:13.454135 IP www.wp.pl.www > migajek.us.to.34591: Flags [P.], seq 2921:4381, ack 1849, win 6228, length 1460
18:25:13.454155 IP migajek.us.to.34591 > www.wp.pl.www: Flags [.], ack 4381, win 229, length 0
18:25:13.462404 IP www.wp.pl.www > migajek.us.to.34591: Flags [.], seq 4381:5841, ack 1849, win 6228, length 1460
18:25:13.462440 IP migajek.us.to.34591 > www.wp.pl.www: Flags [.], ack 5841, win 274, length 0
18:25:13.463407 IP www.wp.pl.www > migajek.us.to.34591: Flags [.], seq 5841:7301, ack 1849, win 6228, length 1460
18:25:13.463415 IP migajek.us.to.34591 > www.wp.pl.www: Flags [.], ack 7301, win 320, length 0
18:25:13.464618 IP www.wp.pl.www > migajek.us.to.34591: Flags [.], seq 7301:8761, ack 1849, win 6228, length 1460
18:25:13.464631 IP migajek.us.to.34591 > www.wp.pl.www: Flags [.], ack 8761, win 365, length 0
18:25:13.465629 IP www.wp.pl.www > migajek.us.to.34591: Flags [.], seq 8761:10221, ack 1849, win 6228, length 1460
18:25:13.465639 IP migajek.us.to.34591 > www.wp.pl.www: Flags [.], ack 10221, win 411, length 0
18:25:13.468720 IP www.wp.pl.www > migajek.us.to.34591: Flags [.], seq 10221:11681, ack 1849, win 6228, length 1460
18:25:13.468758 IP migajek.us.to.34591 > www.wp.pl.www: Flags [.], ack 11681, win 457, length 0
18:25:13.468920 IP www.wp.pl.www > migajek.us.to.34591: Flags [.], seq 11681:13141, ack 1849, win 6228, length 1460
18:25:13.468928 IP migajek.us.to.34591 > www.wp.pl.www: Flags [.], ack 13141, win 502, length 0
18:25:13.472593 IP www.wp.pl.www > migajek.us.to.34591: Flags [.], seq 13141:14601, ack 1849, win 6228, length 1460
18:25:13.472632 IP migajek.us.to.34591 > www.wp.pl.www: Flags [.], ack 14601, win 548, length 0
18:25:13.474228 IP www.wp.pl.www > migajek.us.to.34591: Flags [.], seq 14601:16061, ack 1849, win 6228, length 1460
18:25:13.474260 IP migajek.us.to.34591 > www.wp.pl.www: Flags [.], ack 16061, win 594, length 0
18:25:13.475183 IP www.wp.pl.www > migajek.us.to.34591: Flags [.], seq 16061:17521, ack 1849, win 6228, length 1460
18:25:13.475210 IP migajek.us.to.34591 > www.wp.pl.www: Flags [.], ack 17521, win 639, length 0
18:25:13.476478 IP www.wp.pl.www > migajek.us.to.34591: Flags [.], seq 17521:18981, ack 1849, win 6228, length 1460
18:25:13.476502 IP migajek.us.to.34591 > www.wp.pl.www: Flags [.], ack 18981, win 685, length 0
18:25:13.477777 IP www.wp.pl.www > migajek.us.to.34591: Flags [.], seq 18981:20441, ack 1849, win 6228, length 1460
18:25:13.477811 IP migajek.us.to.34591 > www.wp.pl.www: Flags [.], ack 20441, win 730, length 0
18:25:13.478515 IP www.wp.pl.www > migajek.us.to.34591: Flags [.], seq 20441:21901, ack 1849, win 6228, length 1460
18:25:13.478539 IP migajek.us.to.34591 > www.wp.pl.www: Flags [.], ack 21901, win 776, length 0
18:25:13.479407 IP www.wp.pl.www > migajek.us.to.34591: Flags [.], seq 21901:23361, ack 1849, win 6228, length 1460
18:25:13.479442 IP migajek.us.to.34591 > www.wp.pl.www: Flags [.], ack 23361, win 822, length 0
18:25:13.480270 IP www.wp.pl.www > migajek.us.to.34591: Flags [.], seq 23361:24821, ack 1849, win 6228, length 1460
18:25:13.480287 IP migajek.us.to.34591 > www.wp.pl.www: Flags [.], ack 24821, win 867, length 0
18:25:13.481412 IP www.wp.pl.www > migajek.us.to.34591: Flags [.], seq 24821:26281, ack 1849, win 6228, length 1460
18:25:13.481455 IP migajek.us.to.34591 > www.wp.pl.www: Flags [.], ack 26281, win 872, length 0
18:25:13.482286 IP www.wp.pl.www > migajek.us.to.34591: Flags [.], seq 26281:27741, ack 1849, win 6228, length 1460
18:25:13.482311 IP migajek.us.to.34591 > www.wp.pl.www: Flags [.], ack 27741, win 850, length 0
18:25:13.483484 IP www.wp.pl.www > migajek.us.to.34591: Flags [.], seq 27741:29201, ack 1849, win 6228, length 1460
18:25:13.483518 IP migajek.us.to.34591 > www.wp.pl.www: Flags [.], ack 29201, win 959, length 0
18:25:13.484374 IP www.wp.pl.www > migajek.us.to.34591: Flags [.], seq 29201:30661, ack 1849, win 6228, length 1460
18:25:13.484397 IP migajek.us.to.34591 > www.wp.pl.www: Flags [.], ack 30661, win 981, length 0
18:25:13.485758 IP www.wp.pl.www > migajek.us.to.34591: Flags [.], seq 30661:32121, ack 1849, win 6228, length 1460
18:25:13.486785 IP www.wp.pl.www > migajek.us.to.34591: Flags [.], seq 32121:33581, ack 1849, win 6228, length 1460
18:25:13.488088 IP www.wp.pl.www > migajek.us.to.34591: Flags [.], seq 33581:35041, ack 1849, win 6228, length 1460
18:25:13.488345 IP www.wp.pl.www > migajek.us.to.34591: Flags [.], seq 35041:36501, ack 1849, win 6228, length 1460
18:25:13.489430 IP www.wp.pl.www > migajek.us.to.34591: Flags [.], seq 36501:37961, ack 1849, win 6228, length 1460
18:25:13.490324 IP www.wp.pl.www > migajek.us.to.34591: Flags [.], seq 40881:42341, ack 1849, win 6228, length 1460
18:25:13.490356 IP migajek.us.to.34591 > www.wp.pl.www: Flags [.], ack 37961, win 867, options [nop,nop,sack 1 {40881:42341}], length 0
18:25:13.491365 IP www.wp.pl.www > migajek.us.to.34591: Flags [.], seq 37961:39421, ack 1849, win 6228, length 1460
18:25:13.491398 IP migajek.us.to.34591 > www.wp.pl.www: Flags [.], ack 39421, win 981, options [nop,nop,sack 1 {40881:42341}], length 0
18:25:13.492256 IP www.wp.pl.www > migajek.us.to.34591: Flags [.], seq 39421:40881, ack 1849, win 6228, length 1460
18:25:13.492278 IP migajek.us.to.34591 > www.wp.pl.www: Flags [.], ack 42341, win 959, length 0
18:25:13.493537 IP www.wp.pl.www > migajek.us.to.34591: Flags [.], seq 42341:43801, ack 1849, win 6228, length 1460
18:25:13.493567 IP migajek.us.to.34591 > www.wp.pl.www: Flags [.], ack 43801, win 937, length 0
18:25:13.493583 IP www.wp.pl.www > migajek.us.to.34591: Flags [P.], seq 43801:44480, ack 1849, win 6228, length 679
18:25:13.493589 IP migajek.us.to.34591 > www.wp.pl.www: Flags [.], ack 44480, win 927, length 0
18:25:13.572061 IP migajek.us.to.51213 > 192.168.1.254.domain: 374+ AAAA? wp.hit.gemius.pl. (34)
18:25:13.580134 IP 192.168.1.254.domain > migajek.us.to.51213: 374 0/1/0 (86)
18:25:13.580635 IP migajek.us.to.55744 > 192.168.1.254.domain: 28409+ AAAA? wp.hit.gemius.pl. (34)
18:25:13.582501 IP 192.168.1.254.domain > migajek.us.to.55744: 28409 0/1/0 (86)
18:25:13.586843 IP migajek.us.to.47878 > 192.168.1.254.domain: 48001+ A? wp.hit.gemius.pl. (34)
18:25:13.588278 IP 192.168.1.254.domain > migajek.us.to.47878: 48001 1/2/0 A[|domain]
18:25:13.595132 IP migajek.us.to.58065 > wp.hit.gemius.pl.www: Flags [S], seq 1239684200, win 5840, options [mss 1460,sackOK,TS val 70693055 ecr 0,nop,wscale 6], length 0
18:25:13.595380 IP migajek.us.to.49972 > 192.168.1.254.domain: 29082+ PTR? 100.101.77.212.in-addr.arpa. (45)
18:25:13.605736 IP wp.hit.gemius.pl.www > migajek.us.to.58065: Flags [S.], seq 1902386150, ack 1239684201, win 65535, options [mss 1460,nop,wscale 3,sackOK,TS val 3245104019 ecr 70693055], length 0
18:25:13.605807 IP migajek.us.to.58065 > wp.hit.gemius.pl.www: Flags [.], ack 1, win 92, options [nop,nop,TS val 70693057 ecr 3245104019], length 0
18:25:13.605886 IP migajek.us.to.58065 > wp.hit.gemius.pl.www: Flags [P.], seq 1:668, ack 1, win 92, options [nop,nop,TS val 70693057 ecr 3245104019], length 667
18:25:13.607501 IP 192.168.1.254.domain > migajek.us.to.49972: 29082 1/2/2 (146)
18:25:13.615459 IP migajek.us.to.60876 > 192.168.1.254.domain: 60814+ AAAA? dot.wp.pl. (27)
18:25:13.618023 IP wp.hit.gemius.pl.www > migajek.us.to.58065: Flags [F.], seq 597, ack 668, win 8326, options [nop,nop,TS val 3245104030 ecr 70693057], length 0
18:25:13.618061 IP migajek.us.to.58065 > wp.hit.gemius.pl.www: Flags [.], ack 1, win 92, options [nop,nop,TS val 70693060 ecr 3245104019,nop,nop,sack 1 {597:598}], length 0
18:25:13.619679 IP wp.hit.gemius.pl.www > migajek.us.to.58065: Flags [P.], seq 1:597, ack 668, win 8326, options [nop,nop,TS val 3245104030 ecr 70693057], length 596
18:25:13.619694 IP migajek.us.to.58065 > wp.hit.gemius.pl.www: Flags [.], ack 598, win 110, options [nop,nop,TS val 70693061 ecr 3245104030], length 0
18:25:13.622950 IP migajek.us.to.58065 > wp.hit.gemius.pl.www: Flags [F.], seq 668, ack 598, win 110, options [nop,nop,TS val 70693062 ecr 3245104030], length 0
18:25:13.627384 IP 192.168.1.254.domain > migajek.us.to.60876: 60814 0/1/0 (83)
18:25:13.629319 IP wp.hit.gemius.pl.www > migajek.us.to.58065: Flags [.], ack 669, win 8325, options [nop,nop,TS val 3245104043 ecr 70693062], length 0
18:25:13.631654 IP migajek.us.to.44822 > 192.168.1.254.domain: 17220+ AAAA? dot.wp.pl. (27)
18:25:13.633644 IP 192.168.1.254.domain > migajek.us.to.44822: 17220 0/1/0 (83)
18:25:13.639502 IP migajek.us.to.59972 > 192.168.1.254.domain: 50725+ A? dot.wp.pl. (27)
18:25:13.639729 IP migajek.us.to.47732 > 192.168.1.254.domain: 53787+ AAAA? rek.www.wp.pl. (31)
18:25:13.641520 IP 192.168.1.254.domain > migajek.us.to.59972: 50725 1/3/3 A 212.77.100.82 (154)
18:25:13.641844 IP migajek.us.to.40625 > dot.wp.pl.www: Flags [S], seq 1240719711, win 5840, options [mss 1460,sackOK,TS val 70693066 ecr 0,nop,wscale 6], length 0
18:25:13.642176 IP migajek.us.to.39628 > 192.168.1.254.domain: 44111+ PTR? 82.100.77.212.in-addr.arpa. (44)
18:25:13.647632 IP 192.168.1.254.domain > migajek.us.to.47732: 53787 0/1/0 (87)
18:25:13.650366 IP dot.wp.pl.www > migajek.us.to.40625: Flags [S.], seq 3358949349, ack 1240719712, win 4380, options [mss 1460], length 0
18:25:13.650428 IP migajek.us.to.40625 > dot.wp.pl.www: Flags [.], ack 1, win 5840, length 0
18:25:13.652666 IP 192.168.1.254.domain > migajek.us.to.39628: 44111 1/2/2 (135)
18:25:13.653280 IP migajek.us.to.40625 > dot.wp.pl.www: Flags [P.], seq 1:1019, ack 1, win 5840, length 1018
18:25:13.653557 IP migajek.us.to.43164 > 192.168.1.254.domain: 54947+ AAAA? rek.www.wp.pl. (31)
18:25:13.655593 IP 192.168.1.254.domain > migajek.us.to.43164: 54947 0/1/0 (87)
18:25:13.664855 IP migajek.us.to.36505 > 192.168.1.254.domain: 47148+ A? rek.www.wp.pl. (31)
18:25:13.666320 IP 192.168.1.254.domain > migajek.us.to.36505: 47148 1/3/3 A 212.77.100.128 (158)
18:25:13.671174 IP migajek.us.to.34610 > rek.www.wp.pl.www: Flags [S], seq 1228419030, win 5840, options [mss 1460,sackOK,TS val 70693074 ecr 0,nop,wscale 6], length 0
18:25:13.671240 IP migajek.us.to.34611 > rek.www.wp.pl.www: Flags [S], seq 1234379540, win 5840, options [mss 1460,sackOK,TS val 70693074 ecr 0,nop,wscale 6], length 0
18:25:13.671436 IP migajek.us.to.37066 > 192.168.1.254.domain: 17060+ PTR? 128.100.77.212.in-addr.arpa. (45)
18:25:13.673948 IP dot.wp.pl.www > migajek.us.to.40625: Flags [.], seq 1:1461, ack 1019, win 14508, length 1460
18:25:13.673992 IP migajek.us.to.40625 > dot.wp.pl.www: Flags [.], ack 1461, win 8760, length 0
18:25:13.673996 IP dot.wp.pl.www > migajek.us.to.40625: Flags [P.], seq 1461:1562, ack 1019, win 14508, length 101
18:25:13.674002 IP migajek.us.to.40625 > dot.wp.pl.www: Flags [.], ack 1562, win 8760, length 0
18:25:13.682048 IP rek.www.wp.pl.www > migajek.us.to.34610: Flags [S.], seq 1789866431, ack 1228419031, win 5792, options [mss 1460,sackOK,TS val 712768208 ecr 70693074,nop,wscale 2], length 0
18:25:13.682110 IP migajek.us.to.34610 > rek.www.wp.pl.www: Flags [.], ack 1, win 92, options [nop,nop,TS val 70693076 ecr 712768208], length 0
18:25:13.682117 IP rek.www.wp.pl.www > migajek.us.to.34611: Flags [S.], seq 772847755, ack 1234379541, win 5792, options [mss 1460,sackOK,TS val 3004356299 ecr 70693074,nop,wscale 2], length 0
18:25:13.682129 IP migajek.us.to.34611 > rek.www.wp.pl.www: Flags [.], ack 1, win 92, options [nop,nop,TS val 70693076 ecr 3004356299], length 0
18:25:13.683799 IP 192.168.1.254.domain > migajek.us.to.37066: 17060 1/2/2 (140)
18:25:13.686018 IP migajek.us.to.34611 > rek.www.wp.pl.www: Flags [.], seq 1:1449, ack 1, win 92, options [nop,nop,TS val 70693077 ecr 3004356299], length 1448
18:25:13.686030 IP migajek.us.to.34611 > rek.www.wp.pl.www: Flags [P.], seq 1449:1910, ack 1, win 92, options [nop,nop,TS val 70693077 ecr 3004356299], length 461
18:25:13.686041 IP migajek.us.to.34610 > rek.www.wp.pl.www: Flags [.], seq 1:1449, ack 1, win 92, options [nop,nop,TS val 70693077 ecr 712768208], length 1448
18:25:13.686046 IP migajek.us.to.34610 > rek.www.wp.pl.www: Flags [P.], seq 1449:1807, ack 1, win 92, options [nop,nop,TS val 70693077 ecr 712768208], length 358
18:25:13.698902 IP rek.www.wp.pl.www > migajek.us.to.34611: Flags [.], ack 1910, win 2896, options [nop,nop,TS val 3004356319 ecr 70693077], length 0
18:25:13.705444 IP rek.www.wp.pl.www > migajek.us.to.34611: Flags [.], ack 1449, win 2172, options [nop,nop,TS val 3004356317 ecr 70693077], length 0
18:25:13.705486 IP migajek.us.to.34611 > rek.www.wp.pl.www: Flags [.], ack 1, win 92, options [nop,nop,TS val 70693082 ecr 3004356319], length 0
18:25:13.705932 IP rek.www.wp.pl.www > migajek.us.to.34610: Flags [.], ack 1449, win 2172, options [nop,nop,TS val 712768230 ecr 70693077], length 0
18:25:13.706721 IP rek.www.wp.pl.www > migajek.us.to.34610: Flags [.], ack 1807, win 2896, options [nop,nop,TS val 712768231 ecr 70693077], length 0
18:25:13.710210 IP rek.www.wp.pl.www > migajek.us.to.34610: Flags [P.], seq 1:453, ack 1807, win 2896, options [nop,nop,TS val 712768235 ecr 70693077], length 452
18:25:13.710246 IP migajek.us.to.34610 > rek.www.wp.pl.www: Flags [.], ack 453, win 108, options [nop,nop,TS val 70693083 ecr 712768235], length 0
18:25:13.741392 IP rek.www.wp.pl.www > migajek.us.to.34611: Flags [.], seq 1:1449, ack 1910, win 2896, options [nop,nop,TS val 3004356356 ecr 70693082], length 1448
18:25:13.741437 IP migajek.us.to.34611 > rek.www.wp.pl.www: Flags [.], ack 1449, win 137, options [nop,nop,TS val 70693091 ecr 3004356356], length 0
18:25:13.742447 IP rek.www.wp.pl.www > migajek.us.to.34611: Flags [.], seq 1449:2897, ack 1910, win 2896, options [nop,nop,TS val 3004356356 ecr 70693082], length 1448
18:25:13.742468 IP migajek.us.to.34611 > rek.www.wp.pl.www: Flags [.], ack 2897, win 182, options [nop,nop,TS val 70693091 ecr 3004356356], length 0
18:25:13.752754 IP rek.www.wp.pl.www > migajek.us.to.34611: Flags [P.], seq 2897:4345, ack 1910, win 2896, options [nop,nop,TS val 3004356369 ecr 70693091], length 1448
18:25:13.752790 IP migajek.us.to.34611 > rek.www.wp.pl.www: Flags [.], ack 4345, win 227, options [nop,nop,TS val 70693094 ecr 3004356369], length 0
18:25:13.753775 IP rek.www.wp.pl.www > migajek.us.to.34611: Flags [.], seq 4345:5793, ack 1910, win 2896, options [nop,nop,TS val 3004356369 ecr 70693091], length 1448
18:25:13.753793 IP migajek.us.to.34611 > rek.www.wp.pl.www: Flags [.], ack 5793, win 273, options [nop,nop,TS val 70693094 ecr 3004356369], length 0
18:25:13.755844 IP rek.www.wp.pl.www > migajek.us.to.34611: Flags [.], seq 5793:7241, ack 1910, win 2896, options [nop,nop,TS val 3004356369 ecr 70693091], length 1448
18:25:13.755873 IP migajek.us.to.34611 > rek.www.wp.pl.www: Flags [.], ack 7241, win 318, options [nop,nop,TS val 70693095 ecr 3004356369], length 0
18:25:13.755880 IP rek.www.wp.pl.www > migajek.us.to.34611: Flags [P.], seq 7241:7587, ack 1910, win 2896, options [nop,nop,TS val 3004356369 ecr 70693091], length 346
18:25:13.755886 IP migajek.us.to.34611 > rek.www.wp.pl.www: Flags [.], ack 7587, win 363, options [nop,nop,TS val 70693095 ecr 3004356369], length 0
18:25:13.797162 IP migajek.us.to.34591 > www.wp.pl.www: Flags [.], seq 1849:3309, ack 44480, win 1002, length 1460
18:25:13.797182 IP migajek.us.to.34591 > www.wp.pl.www: Flags [P.], seq 3309:3731, ack 44480, win 1002, length 422
18:25:13.803221 IP migajek.us.to.34596 > www.wp.pl.www: Flags [S], seq 1232941882, win 5840, options [mss 1460,sackOK,TS val 70693107 ecr 0,nop,wscale 6], length 0
18:25:13.809616 IP www.wp.pl.www > migajek.us.to.34591: Flags [.], ack 3309, win 7688, length 0
18:25:13.810687 IP www.wp.pl.www > migajek.us.to.34591: Flags [P.], seq 44480:44761, ack 3731, win 8110, length 281
18:25:13.810766 IP migajek.us.to.34591 > www.wp.pl.www: Flags [.], ack 44761, win 1002, length 0
18:25:13.810771 IP www.wp.pl.www > migajek.us.to.34596: Flags [S.], seq 2953779384, ack 1232941883, win 4380, options [mss 1460,nop,wscale 0,sackOK,eol], length 0
18:25:13.810788 IP migajek.us.to.34596 > www.wp.pl.www: Flags [.], ack 1, win 92, length 0
18:25:13.811178 IP migajek.us.to.34596 > www.wp.pl.www: Flags [.], seq 1:1461, ack 1, win 92, length 1460
18:25:13.811189 IP migajek.us.to.34596 > www.wp.pl.www: Flags [P.], seq 1461:1877, ack 1, win 92, length 416
18:25:13.814890 IP migajek.us.to.34591 > www.wp.pl.www: Flags [.], seq 3731:5191, ack 44761, win 1002, length 1460
18:25:13.814910 IP migajek.us.to.34591 > www.wp.pl.www: Flags [P.], seq 5191:5611, ack 44761, win 1002, length 420
18:25:13.824761 IP www.wp.pl.www > migajek.us.to.34596: Flags [.], ack 1461, win 5840, length 0
18:25:13.826133 IP www.wp.pl.www > migajek.us.to.34596: Flags [P.], seq 1:282, ack 1877, win 6256, length 281
18:25:13.826179 IP migajek.us.to.34596 > www.wp.pl.www: Flags [.], ack 282, win 108, length 0
18:25:13.832235 IP www.wp.pl.www > migajek.us.to.34591: Flags [P.], seq 44761:45043, ack 5611, win 9990, length 282
18:25:13.834587 IP www.wp.pl.www > migajek.us.to.34591: Flags [.], ack 5611, win 9990, length 0
18:25:13.851433 IP migajek.us.to.34596 > www.wp.pl.www: Flags [.], seq 1877:3337, ack 282, win 108, length 1460
18:25:13.851452 IP migajek.us.to.34596 > www.wp.pl.www: Flags [P.], seq 3337:3751, ack 282, win 108, length 414
18:25:13.855622 IP migajek.us.to.34591 > www.wp.pl.www: Flags [.], seq 5611:7071, ack 45043, win 1002, length 1460
18:25:13.855643 IP migajek.us.to.34591 > www.wp.pl.www: Flags [P.], seq 7071:7432, ack 45043, win 1002, length 361
18:25:13.863654 IP migajek.us.to.34597 > www.wp.pl.www: Flags [S], seq 1246751068, win 5840, options [mss 1460,sackOK,TS val 70693122 ecr 0,nop,wscale 6], length 0
18:25:13.864817 IP www.wp.pl.www > migajek.us.to.34596: Flags [P.], seq 282:564, ack 3751, win 8130, length 282
18:25:13.864854 IP www.wp.pl.www > migajek.us.to.34596: Flags [.], ack 3751, win 8130, length 0
18:25:13.866521 IP www.wp.pl.www > migajek.us.to.34591: Flags [.], ack 7071, win 11450, length 0
18:25:13.871744 IP www.wp.pl.www > migajek.us.to.34591: Flags [.], seq 45043:46503, ack 7432, win 11811, length 1460
18:25:13.872804 IP www.wp.pl.www > migajek.us.to.34591: Flags [.], seq 46503:47963, ack 7432, win 11811, length 1460
18:25:13.873990 IP www.wp.pl.www > migajek.us.to.34591: Flags [.], seq 47963:49423, ack 7432, win 11811, length 1460
18:25:13.874178 IP www.wp.pl.www > migajek.us.to.34591: Flags [P.], seq 49423:50627, ack 7432, win 11811, length 1204
18:25:13.874583 IP www.wp.pl.www > migajek.us.to.34597: Flags [S.], seq 2924026194, ack 1246751069, win 4380, options [mss 1460,nop,wscale 0,sackOK,eol], length 0
18:25:13.874615 IP migajek.us.to.34597 > www.wp.pl.www: Flags [.], ack 1, win 92, length 0
18:25:13.876224 IP migajek.us.to.34591 > www.wp.pl.www: Flags [.], ack 50627, win 981, length 0
18:25:13.876408 IP migajek.us.to.34597 > www.wp.pl.www: Flags [.], seq 1:1461, ack 1, win 92, length 1460
18:25:13.876418 IP migajek.us.to.34597 > www.wp.pl.www: Flags [P.], seq 1461:1822, ack 1, win 92, length 361
18:25:13.880367 IP migajek.us.to.34596 > www.wp.pl.www: Flags [.], seq 3751:5211, ack 564, win 125, length 1460
18:25:13.880387 IP migajek.us.to.34596 > www.wp.pl.www: Flags [P.], seq 5211:5622, ack 564, win 125, length 411
18:25:13.884337 IP migajek.us.to.34591 > www.wp.pl.www: Flags [.], seq 7432:8892, ack 50627, win 1002, length 1460
18:25:13.884359 IP migajek.us.to.34591 > www.wp.pl.www: Flags [P.], seq 8892:9253, ack 50627, win 1002, length 361
18:25:13.892410 IP www.wp.pl.www > migajek.us.to.34597: Flags [.], ack 1461, win 5840, length 0
18:25:13.898830 IP www.wp.pl.www > migajek.us.to.34597: Flags [.], seq 1:1461, ack 1822, win 6201, length 1460
18:25:13.898881 IP migajek.us.to.34597 > www.wp.pl.www: Flags [.], ack 1461, win 137, length 0
18:25:13.898893 IP www.wp.pl.www > migajek.us.to.34597: Flags [P.], seq 2921:3825, ack 1822, win 6201, length 904
18:25:13.898904 IP migajek.us.to.34597 > www.wp.pl.www: Flags [.], ack 1461, win 137, options [nop,nop,sack 1 {2921:3825}], length 0
18:25:13.900274 IP www.wp.pl.www > migajek.us.to.34597: Flags [.], seq 1461:2921, ack 1822, win 6201, length 1460
18:25:13.900311 IP migajek.us.to.34597 > www.wp.pl.www: Flags [.], ack 3825, win 183, length 0
18:25:13.900316 IP www.wp.pl.www > migajek.us.to.34596: Flags [.], ack 5211, win 9590, length 0
18:25:13.900331 IP www.wp.pl.www > migajek.us.to.34596: Flags [P.], seq 564:847, ack 5622, win 10001, length 283
18:25:13.901456 IP www.wp.pl.www > migajek.us.to.34591: Flags [.], ack 8892, win 13271, length 0
18:25:13.904799 IP www.wp.pl.www > migajek.us.to.34591: Flags [.], seq 50627:52087, ack 9253, win 13632, length 1460
18:25:13.906382 IP www.wp.pl.www > migajek.us.to.34591: Flags [.], seq 52087:53547, ack 9253, win 13632, length 1460
18:25:13.907012 IP www.wp.pl.www > migajek.us.to.34591: Flags [.], seq 53547:55007, ack 9253, win 13632, length 1460
18:25:13.907060 IP www.wp.pl.www > migajek.us.to.34591: Flags [P.], seq 55007:55559, ack 9253, win 13632, length 552
18:25:13.908469 IP migajek.us.to.34591 > www.wp.pl.www: Flags [.], ack 55559, win 981, length 0
18:25:13.936790 IP migajek.us.to.34597 > www.wp.pl.www: Flags [.], seq 1822:3282, ack 3825, win 183, length 1460
18:25:13.936808 IP migajek.us.to.34597 > www.wp.pl.www: Flags [P.], seq 3282:3696, ack 3825, win 183, length 414
18:25:13.938793 IP migajek.us.to.34596 > www.wp.pl.www: Flags [.], ack 847, win 142, length 0
18:25:13.948994 IP www.wp.pl.www > migajek.us.to.34597: Flags [.], ack 3696, win 8075, length 0
18:25:13.949596 IP www.wp.pl.www > migajek.us.to.34597: Flags [P.], seq 3825:4106, ack 3696, win 8075, length 281
18:25:13.986798 IP migajek.us.to.34597 > www.wp.pl.www: Flags [.], ack 4106, win 229, length 0
18:25:14.017746 IP migajek.us.to.34596 > www.wp.pl.www: Flags [.], seq 5622:7082, ack 847, win 142, length 1460
18:25:14.017762 IP migajek.us.to.34596 > www.wp.pl.www: Flags [P.], seq 7082:7527, ack 847, win 142, length 445
18:25:14.033064 IP migajek.us.to.34591 > www.wp.pl.www: Flags [.], seq 9253:10713, ack 55559, win 1002, length 1460
18:25:14.033083 IP migajek.us.to.34591 > www.wp.pl.www: Flags [P.], seq 10713:11074, ack 55559, win 1002, length 361
18:25:14.034180 IP www.wp.pl.www > migajek.us.to.34596: Flags [.], ack 7527, win 11906, length 0
18:25:14.043801 IP www.wp.pl.www > migajek.us.to.34596: Flags [P.], seq 847:2307, ack 7527, win 11906, length 1460
18:25:14.043846 IP migajek.us.to.34596 > www.wp.pl.www: Flags [.], ack 2307, win 188, length 0
18:25:14.043855 IP www.wp.pl.www > migajek.us.to.34596: Flags [P.], seq 2307:2515, ack 7527, win 11906, length 208
18:25:14.043860 IP migajek.us.to.34596 > www.wp.pl.www: Flags [.], ack 2515, win 233, length 0
18:25:14.050165 IP www.wp.pl.www > migajek.us.to.34591: Flags [.], ack 10713, win 15092, length 0
18:25:14.052534 IP www.wp.pl.www > migajek.us.to.34591: Flags [.], seq 55559:57019, ack 11074, win 15453, length 1460
18:25:14.053362 IP www.wp.pl.www > migajek.us.to.34591: Flags [.], seq 57019:58479, ack 11074, win 15453, length 1460
18:25:14.053387 IP migajek.us.to.34591 > www.wp.pl.www: Flags [.], ack 58479, win 1002, length 0
18:25:14.056421 IP www.wp.pl.www > migajek.us.to.34591: Flags [.], seq 58479:59939, ack 11074, win 15453, length 1460
18:25:14.056696 IP www.wp.pl.www > migajek.us.to.34591: Flags [.], seq 59939:61399, ack 11074, win 15453, length 1460
18:25:14.056818 IP www.wp.pl.www > migajek.us.to.34591: Flags [.], seq 61399:62859, ack 11074, win 15453, length 1460
18:25:14.058680 IP www.wp.pl.www > migajek.us.to.34591: Flags [.], seq 62859:64319, ack 11074, win 15453, length 1460
18:25:14.059020 IP www.wp.pl.www > migajek.us.to.34591: Flags [.], seq 64319:65779, ack 11074, win 15453, length 1460
18:25:14.059450 IP migajek.us.to.34591 > www.wp.pl.www: Flags [.], ack 65779, win 916, length 0
18:25:14.061106 IP www.wp.pl.www > migajek.us.to.34591: Flags [.], seq 65779:67239, ack 11074, win 15453, length 1460
18:25:14.062468 IP www.wp.pl.www > migajek.us.to.34591: Flags [.], seq 67239:68699, ack 11074, win 15453, length 1460
18:25:14.062508 IP migajek.us.to.34591 > www.wp.pl.www: Flags [.], ack 68699, win 1002, length 0
18:25:14.067159 IP www.wp.pl.www > migajek.us.to.34591: Flags [.], seq 68699:70159, ack 11074, win 15453, length 1460
18:25:14.068700 IP www.wp.pl.www > migajek.us.to.34591: Flags [.], seq 70159:71619, ack 11074, win 15453, length 1460
18:25:14.068732 IP migajek.us.to.34591 > www.wp.pl.www: Flags [.], ack 71619, win 1002, length 0
18:25:14.069847 IP www.wp.pl.www > migajek.us.to.34591: Flags [.], seq 71619:73079, ack 11074, win 15453, length 1460
18:25:14.073419 IP www.wp.pl.www > migajek.us.to.34591: Flags [.], seq 73079:74539, ack 11074, win 15453, length 1460
18:25:14.073452 IP migajek.us.to.34591 > www.wp.pl.www: Flags [.], ack 74539, win 1002, length 0
18:25:14.074607 IP www.wp.pl.www > migajek.us.to.34591: Flags [.], seq 74539:75999, ack 11074, win 15453, length 1460
18:25:14.077126 IP www.wp.pl.www > migajek.us.to.34591: Flags [.], seq 75999:77459, ack 11074, win 15453, length 1460
18:25:14.077160 IP migajek.us.to.34591 > www.wp.pl.www: Flags [.], ack 77459, win 1002, length 0
18:25:14.081249 IP www.wp.pl.www > migajek.us.to.34591: Flags [.], seq 77459:78919, ack 11074, win 15453, length 1460
18:25:14.081449 IP www.wp.pl.www > migajek.us.to.34591: Flags [.], seq 78919:80379, ack 11074, win 15453, length 1460
18:25:14.081467 IP migajek.us.to.34591 > www.wp.pl.www: Flags [.], ack 80379, win 1002, length 0
18:25:14.082900 IP www.wp.pl.www > migajek.us.to.34591: Flags [.], seq 80379:81839, ack 11074, win 15453, length 1460
18:25:14.083907 IP www.wp.pl.www > migajek.us.to.34591: Flags [.], seq 81839:83299, ack 11074, win 15453, length 1460
18:25:14.084929 IP www.wp.pl.www > migajek.us.to.34591: Flags [.], seq 83299:84759, ack 11074, win 15453, length 1460
18:25:14.085125 IP migajek.us.to.34591 > www.wp.pl.www: Flags [.], ack 84759, win 959, length 0
18:25:14.088525 IP www.wp.pl.www > migajek.us.to.34591: Flags [.], seq 84759:86219, ack 11074, win 15453, length 1460
18:25:14.088803 IP www.wp.pl.www > migajek.us.to.34591: Flags [.], seq 86219:87679, ack 11074, win 15453, length 1460
18:25:14.088821 IP migajek.us.to.34591 > www.wp.pl.www: Flags [.], ack 87679, win 981, length 0
18:25:14.088922 IP www.wp.pl.www > migajek.us.to.34591: Flags [.], seq 87679:89139, ack 11074, win 15453, length 1460
18:25:14.090571 IP www.wp.pl.www > migajek.us.to.34591: Flags [.], seq 89139:90599, ack 11074, win 15453, length 1460
18:25:14.090860 IP www.wp.pl.www > migajek.us.to.34591: Flags [.], seq 90599:92059, ack 11074, win 15453, length 1460
18:25:14.091072 IP www.wp.pl.www > migajek.us.to.34591: Flags [.], seq 92059:93519, ack 11074, win 15453, length 1460
18:25:14.092154 IP www.wp.pl.www > migajek.us.to.34591: Flags [.], seq 93519:94979, ack 11074, win 15453, length 1460
18:25:14.092921 IP www.wp.pl.www > migajek.us.to.34591: Flags [.], seq 94979:96439, ack 11074, win 15453, length 1460
18:25:14.093159 IP migajek.us.to.34591 > www.wp.pl.www: Flags [.], ack 96439, win 894, length 0
18:25:14.096641 IP www.wp.pl.www > migajek.us.to.34591: Flags [.], seq 97899:99359, ack 11074, win 15453, length 1460
18:25:14.096682 IP migajek.us.to.34591 > www.wp.pl.www: Flags [.], ack 96439, win 1002, options [nop,nop,sack 1 {97899:99359}], length 0
18:25:14.096908 IP www.wp.pl.www > migajek.us.to.34591: Flags [.], seq 96439:97899, ack 11074, win 15453, length 1460
18:25:14.096923 IP migajek.us.to.34591 > www.wp.pl.www: Flags [.], ack 99359, win 981, length 0
18:25:14.097032 IP www.wp.pl.www > migajek.us.to.34591: Flags [.], seq 99359:100819, ack 11074, win 15453, length 1460
18:25:14.097039 IP migajek.us.to.34591 > www.wp.pl.www: Flags [.], ack 100819, win 959, length 0
18:25:14.098957 IP www.wp.pl.www > migajek.us.to.34591: Flags [.], seq 100819:102279, ack 11074, win 15453, length 1460
18:25:14.098991 IP migajek.us.to.34591 > www.wp.pl.www: Flags [.], ack 102279, win 937, length 0
18:25:14.099225 IP www.wp.pl.www > migajek.us.to.34591: Flags [.], seq 102279:103739, ack 11074, win 15453, length 1460
18:25:14.099235 IP migajek.us.to.34591 > www.wp.pl.www: Flags [.], ack 103739, win 916, length 0
18:25:14.099307 IP www.wp.pl.www > migajek.us.to.34591: Flags [P.], seq 103739:104690, ack 11074, win 15453, length 951
18:25:14.099314 IP migajek.us.to.34591 > www.wp.pl.www: Flags [.], ack 104690, win 902, length 0
18:25:14.113846 IP migajek.us.to.34597 > www.wp.pl.www: Flags [.], seq 3696:5156, ack 4106, win 229, length 1460
18:25:14.113867 IP migajek.us.to.34597 > www.wp.pl.www: Flags [P.], seq 5156:5570, ack 4106, win 229, length 414
18:25:14.133571 IP www.wp.pl.www > migajek.us.to.34597: Flags [.], ack 5570, win 9949, length 0
