17:37:11.764017 IP 192.168.1.100.42657 > 192.168.1.254.53: 46960+ AAAA? szybowce.gda.pl. (33)
17:37:11.829122 IP 192.168.1.254.53 > 192.168.1.100.42657: 46960 0/1/0 (85)
17:37:11.829362 IP 192.168.1.100.52209 > 192.168.1.254.53: 62384+ AAAA? szybowce.gda.pl. (33)
17:37:11.831166 IP 192.168.1.254.53 > 192.168.1.100.52209: 62384 0/1/0 (85)
17:37:11.832857 IP 192.168.1.100.60179 > 192.168.1.254.53: 24172+ A? szybowce.gda.pl. (33)
17:37:11.890741 IP 192.168.1.254.53 > 192.168.1.100.60179: 24172 1/2/0 A[|domain]
17:37:11.891140 IP 192.168.1.100.41315 > 93.157.100.49.80: Flags [S], seq 2827309025, win 5840, options [mss 1460,sackOK,TS val 113172629 ecr 0,nop,wscale 6], length 0
17:37:11.913106 IP 93.157.100.49.80 > 192.168.1.100.41315: Flags [S.], seq 1743465372, ack 2827309026, win 5792, options [mss 1460,sackOK,TS val 1144212560 ecr 113172629,nop,wscale 7], length 0
17:37:11.913176 IP 192.168.1.100.41315 > 93.157.100.49.80: Flags [.], ack 1, win 92, options [nop,nop,TS val 113172634 ecr 1144212560], length 0
17:37:11.913343 IP 192.168.1.100.41315 > 93.157.100.49.80: Flags [P.], seq 1:510, ack 1, win 92, options [nop,nop,TS val 113172634 ecr 1144212560], length 509
17:37:11.949715 IP 93.157.100.49.80 > 192.168.1.100.41315: Flags [.], ack 510, win 54, options [nop,nop,TS val 1144212565 ecr 113172634], length 0
17:37:12.040675 IP 93.157.100.49.80 > 192.168.1.100.41315: Flags [.], seq 1:1449, ack 510, win 54, options [nop,nop,TS val 1144212590 ecr 113172634], length 1448
17:37:12.040716 IP 192.168.1.100.41315 > 93.157.100.49.80: Flags [.], ack 1449, win 137, options [nop,nop,TS val 113172666 ecr 1144212590], length 0
17:37:12.041582 IP 93.157.100.49.80 > 192.168.1.100.41315: Flags [.], seq 1449:2897, ack 510, win 54, options [nop,nop,TS val 1144212590 ecr 113172634], length 1448
17:37:12.041605 IP 192.168.1.100.41315 > 93.157.100.49.80: Flags [.], ack 2897, win 182, options [nop,nop,TS val 113172666 ecr 1144212590], length 0
17:37:12.064554 IP 93.157.100.49.80 > 192.168.1.100.41315: Flags [.], seq 5793:7241, ack 510, win 54, options [nop,nop,TS val 1144212597 ecr 113172666], length 1448
17:37:12.064606 IP 192.168.1.100.41315 > 93.157.100.49.80: Flags [.], ack 2897, win 182, options [nop,nop,TS val 113172672 ecr 1144212590,nop,nop,sack 1 {5793:7241}], length 0
17:37:12.068237 IP 93.157.100.49.80 > 192.168.1.100.41315: Flags [.], seq 2897:4345, ack 510, win 54, options [nop,nop,TS val 1144212597 ecr 113172666], length 1448
17:37:12.068291 IP 192.168.1.100.41315 > 93.157.100.49.80: Flags [.], ack 4345, win 227, options [nop,nop,TS val 113172673 ecr 1144212597,nop,nop,sack 1 {5793:7241}], length 0
17:37:12.068437 IP 93.157.100.49.80 > 192.168.1.100.41315: Flags [P.], seq 4345:5793, ack 510, win 54, options [nop,nop,TS val 1144212597 ecr 113172666], length 1448
17:37:12.068453 IP 192.168.1.100.41315 > 93.157.100.49.80: Flags [.], ack 7241, win 273, options [nop,nop,TS val 113172673 ecr 1144212597], length 0
17:37:12.070810 IP 93.157.100.49.80 > 192.168.1.100.41315: Flags [.], seq 7241:8689, ack 510, win 54, options [nop,nop,TS val 1144212597 ecr 113172666], length 1448
17:37:12.070847 IP 192.168.1.100.41315 > 93.157.100.49.80: Flags [.], ack 8689, win 318, options [nop,nop,TS val 113172674 ecr 1144212597], length 0
17:37:12.096126 IP 93.157.100.49.80 > 192.168.1.100.41315: Flags [P.], seq 10137:11585, ack 510, win 54, options [nop,nop,TS val 1144212604 ecr 113172673], length 1448
17:37:12.096175 IP 192.168.1.100.41315 > 93.157.100.49.80: Flags [.], ack 8689, win 318, options [nop,nop,TS val 113172680 ecr 1144212597,nop,nop,sack 1 {10137:11585}], length 0
17:37:12.097246 IP 93.157.100.49.80 > 192.168.1.100.41315: Flags [.], seq 8689:10137, ack 510, win 54, options [nop,nop,TS val 1144212602 ecr 113172672], length 1448
17:37:12.097281 IP 192.168.1.100.41315 > 93.157.100.49.80: Flags [.], ack 11585, win 363, options [nop,nop,TS val 113172680 ecr 1144212602], length 0
17:37:12.101428 IP 192.168.1.100.41316 > 93.157.100.49.80: Flags [S], seq 2831322459, win 5840, options [mss 1460,sackOK,TS val 113172681 ecr 0,nop,wscale 6], length 0
17:37:12.101524 IP 93.157.100.49.80 > 192.168.1.100.41315: Flags [P.], seq 13033:14481, ack 510, win 54, options [nop,nop,TS val 1144212604 ecr 113172673], length 1448
17:37:12.101552 IP 192.168.1.100.41315 > 93.157.100.49.80: Flags [.], ack 11585, win 363, options [nop,nop,TS val 113172681 ecr 1144212602,nop,nop,sack 1 {13033:14481}], length 0
17:37:12.102917 IP 93.157.100.49.80 > 192.168.1.100.41315: Flags [.], seq 11585:13033, ack 510, win 54, options [nop,nop,TS val 1144212604 ecr 113172673], length 1448
17:37:12.102990 IP 192.168.1.100.41315 > 93.157.100.49.80: Flags [.], ack 14481, win 408, options [nop,nop,TS val 113172682 ecr 1144212604], length 0
17:37:12.103016 IP 93.157.100.49.80 > 192.168.1.100.41315: Flags [.], seq 14481:15929, ack 510, win 54, options [nop,nop,TS val 1144212604 ecr 113172674], length 1448
17:37:12.103027 IP 192.168.1.100.41315 > 93.157.100.49.80: Flags [.], ack 15929, win 454, options [nop,nop,TS val 113172682 ecr 1144212604], length 0
17:37:12.104991 IP 93.157.100.49.80 > 192.168.1.100.41315: Flags [.], seq 15929:17377, ack 510, win 54, options [nop,nop,TS val 1144212604 ecr 113172674], length 1448
17:37:12.105016 IP 192.168.1.100.41315 > 93.157.100.49.80: Flags [.], ack 17377, win 499, options [nop,nop,TS val 113172682 ecr 1144212604], length 0
17:37:12.127682 IP 93.157.100.49.80 > 192.168.1.100.41315: Flags [.], seq 17377:18825, ack 510, win 54, options [nop,nop,TS val 1144212610 ecr 113172680], length 1448
17:37:12.127728 IP 192.168.1.100.41315 > 93.157.100.49.80: Flags [.], ack 18825, win 544, options [nop,nop,TS val 113172688 ecr 1144212610], length 0
17:37:12.128813 IP 93.157.100.49.80 > 192.168.1.100.41315: Flags [.], seq 20273:21721, ack 510, win 54, options [nop,nop,TS val 1144212611 ecr 113172680], length 1448
17:37:12.128855 IP 192.168.1.100.41315 > 93.157.100.49.80: Flags [.], ack 18825, win 544, options [nop,nop,TS val 113172688 ecr 1144212610,nop,nop,sack 1 {20273:21721}], length 0
17:37:12.131053 IP 93.157.100.49.80 > 192.168.1.100.41315: Flags [.], seq 23169:24617, ack 510, win 54, options [nop,nop,TS val 1144212612 ecr 113172682], length 1448
17:37:12.131081 IP 192.168.1.100.41315 > 93.157.100.49.80: Flags [.], ack 18825, win 544, options [nop,nop,TS val 113172689 ecr 1144212610,nop,nop,sack 2 {23169:24617}{20273:21721}], length 0
17:37:12.131270 IP 93.157.100.49.80 > 192.168.1.100.41315: Flags [.], seq 24617:26065, ack 510, win 54, options [nop,nop,TS val 1144212612 ecr 113172682], length 1448
17:37:12.131284 IP 192.168.1.100.41315 > 93.157.100.49.80: Flags [.], ack 18825, win 544, options [nop,nop,TS val 113172689 ecr 1144212610,nop,nop,sack 2 {23169:26065}{20273:21721}], length 0
17:37:12.132136 IP 93.157.100.49.80 > 192.168.1.100.41315: Flags [.], seq 26065:27513, ack 510, win 54, options [nop,nop,TS val 1144212612 ecr 113172682], length 1448
17:37:12.132168 IP 192.168.1.100.41315 > 93.157.100.49.80: Flags [.], ack 18825, win 544, options [nop,nop,TS val 113172689 ecr 1144212610,nop,nop,sack 2 {23169:27513}{20273:21721}], length 0
17:37:12.133741 IP 93.157.100.49.80 > 192.168.1.100.41315: Flags [.], seq 27513:28961, ack 510, win 54, options [nop,nop,TS val 1144212612 ecr 113172682], length 1448
17:37:12.133789 IP 192.168.1.100.41315 > 93.157.100.49.80: Flags [.], ack 18825, win 544, options [nop,nop,TS val 113172689 ecr 1144212610,nop,nop,sack 2 {23169:28961}{20273:21721}], length 0
17:37:12.134215 IP 93.157.100.49.80 > 192.168.1.100.41315: Flags [.], seq 18825:20273, ack 510, win 54, options [nop,nop,TS val 1144212611 ecr 113172680], length 1448
17:37:12.134236 IP 192.168.1.100.41315 > 93.157.100.49.80: Flags [.], ack 21721, win 589, options [nop,nop,TS val 113172689 ecr 1144212611,nop,nop,sack 1 {23169:28961}], length 0
17:37:12.135283 IP 93.157.100.49.80 > 192.168.1.100.41315: Flags [.], seq 21721:23169, ack 510, win 54, options [nop,nop,TS val 1144212612 ecr 113172681], length 1448
17:37:12.135324 IP 192.168.1.100.41315 > 93.157.100.49.80: Flags [.], ack 28961, win 635, options [nop,nop,TS val 113172690 ecr 1144212612], length 0
17:37:12.135330 IP 93.157.100.49.80 > 192.168.1.100.41316: Flags [S.], seq 1736618103, ack 2831322460, win 5792, options [mss 1460,sackOK,TS val 1144212612 ecr 113172681,nop,wscale 7], length 0
17:37:12.135355 IP 192.168.1.100.41316 > 93.157.100.49.80: Flags [.], ack 1, win 92, options [nop,nop,TS val 113172690 ecr 1144212612], length 0
17:37:12.141655 IP 93.157.100.49.80 > 192.168.1.100.41315: Flags [P.], seq 28961:29269, ack 510, win 54, options [nop,nop,TS val 1144212613 ecr 113172682], length 308
17:37:12.141708 IP 192.168.1.100.41315 > 93.157.100.49.80: Flags [.], ack 29269, win 680, options [nop,nop,TS val 113172691 ecr 1144212613], length 0
17:37:12.146322 IP 192.168.1.100.41316 > 93.157.100.49.80: Flags [P.], seq 1:564, ack 1, win 92, options [nop,nop,TS val 113172692 ecr 1144212612], length 563
17:37:12.162052 IP 93.157.100.49.80 > 192.168.1.100.41315: Flags [.], seq 21721:23169, ack 510, win 54, options [nop,nop,TS val 1144212620 ecr 113172689], length 1448
17:37:12.162096 IP 192.168.1.100.41315 > 93.157.100.49.80: Flags [.], ack 29269, win 680, options [nop,nop,TS val 113172696 ecr 1144212613,nop,nop,sack 1 {21721:23169}], length 0
17:37:12.165704 IP 93.157.100.49.80 > 192.168.1.100.41315: Flags [.], seq 18825:20273, ack 510, win 54, options [nop,nop,TS val 1144212620 ecr 113172689], length 1448
17:37:12.165743 IP 192.168.1.100.41315 > 93.157.100.49.80: Flags [.], ack 29269, win 680, options [nop,nop,TS val 113172697 ecr 1144212613,nop,nop,sack 1 {18825:20273}], length 0
17:37:12.178653 IP 93.157.100.49.80 > 192.168.1.100.41316: Flags [.], ack 564, win 55, options [nop,nop,TS val 1144212624 ecr 113172692], length 0
17:37:12.186211 IP 93.157.100.49.80 > 192.168.1.100.41316: Flags [.], seq 1:1449, ack 564, win 55, options [nop,nop,TS val 1144212627 ecr 113172692], length 1448
17:37:12.186319 IP 192.168.1.100.41316 > 93.157.100.49.80: Flags [.], ack 1449, win 137, options [nop,nop,TS val 113172702 ecr 1144212627], length 0
17:37:12.186995 IP 93.157.100.49.80 > 192.168.1.100.41316: Flags [.], seq 1449:2897, ack 564, win 55, options [nop,nop,TS val 1144212627 ecr 113172692], length 1448
17:37:12.187016 IP 192.168.1.100.41316 > 93.157.100.49.80: Flags [.], ack 2897, win 182, options [nop,nop,TS val 113172703 ecr 1144212627], length 0
17:37:12.215700 IP 93.157.100.49.80 > 192.168.1.100.41316: Flags [.], seq 5793:7241, ack 564, win 55, options [nop,nop,TS val 1144212633 ecr 113172703], length 1448
17:37:12.215772 IP 192.168.1.100.41316 > 93.157.100.49.80: Flags [.], ack 2897, win 182, options [nop,nop,TS val 113172710 ecr 1144212627,nop,nop,sack 1 {5793:7241}], length 0
17:37:12.219280 IP 93.157.100.49.80 > 192.168.1.100.41316: Flags [.], seq 2897:4345, ack 564, win 55, options [nop,nop,TS val 1144212633 ecr 113172702], length 1448
17:37:12.219329 IP 192.168.1.100.41316 > 93.157.100.49.80: Flags [.], ack 4345, win 227, options [nop,nop,TS val 113172711 ecr 1144212633,nop,nop,sack 1 {5793:7241}], length 0
17:37:12.220356 IP 93.157.100.49.80 > 192.168.1.100.41316: Flags [P.], seq 4345:5793, ack 564, win 55, options [nop,nop,TS val 1144212633 ecr 113172702], length 1448
17:37:12.220382 IP 192.168.1.100.41316 > 93.157.100.49.80: Flags [.], ack 7241, win 273, options [nop,nop,TS val 113172711 ecr 1144212633], length 0
17:37:12.221586 IP 93.157.100.49.80 > 192.168.1.100.41316: Flags [.], seq 7241:8689, ack 564, win 55, options [nop,nop,TS val 1144212633 ecr 113172703], length 1448
17:37:12.221611 IP 192.168.1.100.41316 > 93.157.100.49.80: Flags [.], ack 8689, win 318, options [nop,nop,TS val 113172711 ecr 1144212633], length 0
17:37:12.254335 IP 93.157.100.49.80 > 192.168.1.100.41316: Flags [.], seq 8689:10137, ack 564, win 55, options [nop,nop,TS val 1144212641 ecr 113172710], length 1448
17:37:12.254379 IP 192.168.1.100.41316 > 93.157.100.49.80: Flags [.], ack 10137, win 363, options [nop,nop,TS val 113172719 ecr 1144212641], length 0
17:37:12.264017 IP 93.157.100.49.80 > 192.168.1.100.41316: Flags [P.], seq 10137:11585, ack 564, win 55, options [nop,nop,TS val 1144212642 ecr 113172711], length 1448
17:37:12.264073 IP 192.168.1.100.41316 > 93.157.100.49.80: Flags [.], ack 11585, win 408, options [nop,nop,TS val 113172722 ecr 1144212642], length 0
17:37:12.272895 IP 93.157.100.49.80 > 192.168.1.100.41316: Flags [.], seq 11585:13033, ack 564, win 55, options [nop,nop,TS val 1144212642 ecr 113172711], length 1448
17:37:12.272930 IP 192.168.1.100.41316 > 93.157.100.49.80: Flags [.], ack 13033, win 454, options [nop,nop,TS val 113172724 ecr 1144212642], length 0
17:37:12.282731 IP 93.157.100.49.80 > 192.168.1.100.41316: Flags [P.], seq 13033:14481, ack 564, win 55, options [nop,nop,TS val 1144212642 ecr 113172711], length 1448
17:37:12.282766 IP 192.168.1.100.41316 > 93.157.100.49.80: Flags [.], ack 14481, win 499, options [nop,nop,TS val 113172726 ecr 1144212642], length 0
17:37:12.291031 IP 93.157.100.49.80 > 192.168.1.100.41316: Flags [.], seq 14481:15929, ack 564, win 55, options [nop,nop,TS val 1144212642 ecr 113172711], length 1448
17:37:12.291061 IP 192.168.1.100.41316 > 93.157.100.49.80: Flags [.], ack 15929, win 544, options [nop,nop,TS val 113172729 ecr 1144212642], length 0
17:37:12.297002 IP 93.157.100.49.80 > 192.168.1.100.41316: Flags [.], seq 15929:17377, ack 564, win 55, options [nop,nop,TS val 1144212651 ecr 113172719], length 1448
17:37:12.297039 IP 192.168.1.100.41316 > 93.157.100.49.80: Flags [.], ack 17377, win 589, options [nop,nop,TS val 113172730 ecr 1144212651], length 0
17:37:12.312844 IP 93.157.100.49.80 > 192.168.1.100.41316: Flags [.], seq 17377:18825, ack 564, win 55, options [nop,nop,TS val 1144212651 ecr 113172719], length 1448
17:37:12.312878 IP 192.168.1.100.41316 > 93.157.100.49.80: Flags [.], ack 18825, win 635, options [nop,nop,TS val 113172734 ecr 1144212651], length 0
17:37:12.324678 IP 93.157.100.49.80 > 192.168.1.100.41316: Flags [.], seq 18825:20273, ack 564, win 55, options [nop,nop,TS val 1144212651 ecr 113172719], length 1448
17:37:12.324713 IP 192.168.1.100.41316 > 93.157.100.49.80: Flags [.], ack 20273, win 680, options [nop,nop,TS val 113172737 ecr 1144212651], length 0
17:37:12.604730 IP 93.157.100.49.80 > 192.168.1.100.41316: Flags [P.], seq 20273:21404, ack 564, win 55, options [nop,nop,TS val 1144212733 ecr 113172737], length 1131
17:37:12.604778 IP 192.168.1.100.41316 > 93.157.100.49.80: Flags [.], ack 21404, win 725, options [nop,nop,TS val 113172807 ecr 1144212733], length 0
17:37:14.118313 IP 93.157.100.49.80 > 192.168.1.100.41315: Flags [F.], seq 29269, ack 510, win 54, options [nop,nop,TS val 1144213112 ecr 113172697], length 0
17:37:14.154781 IP 192.168.1.100.41315 > 93.157.100.49.80: Flags [.], ack 29270, win 680, options [nop,nop,TS val 113173195 ecr 1144213112], length 0
17:37:14.245021 IP 93.157.100.49.80 > 192.168.1.100.41316: Flags [F.], seq 21404, ack 564, win 55, options [nop,nop,TS val 1144213143 ecr 113172807], length 0
17:37:14.282778 IP 192.168.1.100.41316 > 93.157.100.49.80: Flags [.], ack 21405, win 725, options [nop,nop,TS val 113173227 ecr 1144213143], length 0
17:37:15.392622 IP 91.197.13.71.8074 > 192.168.1.100.36897: Flags [P.], seq 3069068509:3069068583, ack 3697058355, win 548, length 74
17:37:15.392662 IP 192.168.1.100.36897 > 91.197.13.71.8074: Flags [.], ack 74, win 445, length 0
17:37:15.479803 IP 192.168.1.100.46389 > 192.168.1.254.53: 59714+ AAAA? api.gadu-gadu.pl. (34)
17:37:15.481528 IP 192.168.1.254.53 > 192.168.1.100.46389: 59714 0/1/0 (79)
17:37:15.485151 IP 192.168.1.100.33454 > 192.168.1.254.53: 27071+ AAAA? api.gadu-gadu.pl. (34)
17:37:15.486967 IP 192.168.1.254.53 > 192.168.1.100.33454: 27071 0/1/0 (79)
17:37:15.496694 IP 192.168.1.100.49930 > 192.168.1.254.53: 46560+ A? api.gadu-gadu.pl. (34)
17:37:15.498191 IP 192.168.1.254.53 > 192.168.1.100.49930: 46560 2/2/0 A[|domain]
17:37:15.549255 IP 192.168.1.100.43026 > 91.197.13.248.80: Flags [S], seq 2884009118, win 5840, options [mss 1460,sackOK,TS val 113173543 ecr 0,nop,wscale 6], length 0
17:37:15.567112 IP 91.197.13.248.80 > 192.168.1.100.43026: Flags [S.], seq 920897339, ack 2884009119, win 5840, options [mss 1460,nop,nop,sackOK,nop,wscale 4], length 0
17:37:15.567167 IP 192.168.1.100.43026 > 91.197.13.248.80: Flags [.], ack 1, win 92, length 0
17:37:15.568592 IP 192.168.1.100.43026 > 91.197.13.248.80: Flags [P.], seq 1:167, ack 1, win 92, length 166
17:37:15.587449 IP 91.197.13.248.80 > 192.168.1.100.43026: Flags [.], ack 167, win 432, length 0
17:37:15.623404 IP 91.197.13.248.80 > 192.168.1.100.43026: Flags [P.], seq 1:693, ack 167, win 432, length 692
17:37:15.623443 IP 192.168.1.100.43026 > 91.197.13.248.80: Flags [.], ack 693, win 113, length 0
17:37:15.634826 IP 91.197.13.248.80 > 192.168.1.100.43026: Flags [F.], seq 693, ack 167, win 432, length 0
17:37:15.635544 IP 192.168.1.100.43026 > 91.197.13.248.80: Flags [F.], seq 167, ack 694, win 113, length 0
17:37:15.661780 IP 91.197.13.248.80 > 192.168.1.100.43026: Flags [.], ack 168, win 432, length 0
17:37:22.129704 IP 91.197.13.71.8074 > 192.168.1.100.36897: Flags [P.], seq 74:111, ack 1, win 548, length 37
17:37:22.129744 IP 192.168.1.100.36897 > 91.197.13.71.8074: Flags [.], ack 111, win 445, length 0
17:37:22.173804 IP 192.168.1.100.56476 > 192.168.1.254.53: 46522+ AAAA? api.gadu-gadu.pl. (34)
17:37:22.175504 IP 192.168.1.254.53 > 192.168.1.100.56476: 46522 0/1/0 (79)
17:37:22.176610 IP 192.168.1.100.46457 > 192.168.1.254.53: 46435+ AAAA? api.gadu-gadu.pl. (34)
17:37:22.178298 IP 192.168.1.254.53 > 192.168.1.100.46457: 46435 0/1/0 (79)
17:37:22.181936 IP 192.168.1.100.52311 > 192.168.1.254.53: 12774+ A? api.gadu-gadu.pl. (34)
17:37:22.183442 IP 192.168.1.254.53 > 192.168.1.100.52311: 12774 2/2/0 A[|domain]
17:37:22.250713 IP 192.168.1.100.43027 > 91.197.13.248.80: Flags [S], seq 2985672956, win 5840, options [mss 1460,sackOK,TS val 113175218 ecr 0,nop,wscale 6], length 0
17:37:22.275887 IP 91.197.13.248.80 > 192.168.1.100.43027: Flags [S.], seq 934677702, ack 2985672957, win 5840, options [mss 1460,nop,nop,sackOK,nop,wscale 4], length 0
17:37:22.275941 IP 192.168.1.100.43027 > 91.197.13.248.80: Flags [.], ack 1, win 92, length 0
17:37:22.276167 IP 192.168.1.100.43027 > 91.197.13.248.80: Flags [P.], seq 1:167, ack 1, win 92, length 166
17:37:22.309910 IP 91.197.13.248.80 > 192.168.1.100.43027: Flags [.], ack 167, win 432, length 0
17:37:22.346413 IP 91.197.13.248.80 > 192.168.1.100.43027: Flags [P.], seq 1:743, ack 167, win 432, length 742
17:37:22.346452 IP 192.168.1.100.43027 > 91.197.13.248.80: Flags [.], ack 743, win 115, length 0
17:37:22.358149 IP 91.197.13.248.80 > 192.168.1.100.43027: Flags [F.], seq 743, ack 167, win 432, length 0
17:37:22.360017 IP 192.168.1.100.43027 > 91.197.13.248.80: Flags [F.], seq 167, ack 744, win 115, length 0
17:37:22.398171 IP 91.197.13.248.80 > 192.168.1.100.43027: Flags [.], ack 168, win 432, length 0
17:37:24.193586 IP 192.168.1.100.41316 > 93.157.100.49.80: Flags [F.], seq 564, ack 21405, win 725, options [nop,nop,TS val 113175704 ecr 1144213143], length 0
17:37:24.193648 IP 192.168.1.100.41315 > 93.157.100.49.80: Flags [F.], seq 510, ack 29270, win 680, options [nop,nop,TS val 113175704 ecr 1144213112], length 0
17:37:24.227785 IP 93.157.100.49.80 > 192.168.1.100.41316: Flags [.], ack 565, win 55, options [nop,nop,TS val 1144215637 ecr 113175704], length 0
17:37:24.227854 IP 93.157.100.49.80 > 192.168.1.100.41315: Flags [.], ack 511, win 54, options [nop,nop,TS val 1144215637 ecr 113175704], length 0
17:37:25.737319 IP 174.129.241.144.443 > 192.168.1.100.38791: Flags [P.], seq 739926181:739926255, ack 3906138214, win 88, options [nop,nop,TS val 242013916 ecr 113146024], length 74
17:37:25.742922 IP 192.168.1.100.38791 > 174.129.241.144.443: Flags [P.], seq 1:75, ack 74, win 135, options [nop,nop,TS val 113176092 ecr 242013916], length 74
17:37:25.945819 IP 174.129.241.144.443 > 192.168.1.100.38791: Flags [.], ack 75, win 88, options [nop,nop,TS val 242014111 ecr 113176092], length 0
17:37:27.131938 IP 192.168.1.100.36524 > 192.168.1.254.53: 32467+ AAAA? bash.org.pl. (29)
17:37:27.435032 IP 192.168.1.254.53 > 192.168.1.100.36524: 32467 0/1/0 (85)
17:37:27.435360 IP 192.168.1.100.55030 > 192.168.1.254.53: 35301+ AAAA? bash.org.pl. (29)
17:37:27.437694 IP 192.168.1.254.53 > 192.168.1.100.55030: 35301 0/1/0 (85)
17:37:27.437804 IP 192.168.1.100.53234 > 192.168.1.254.53: 29863+ A? bash.org.pl. (29)
17:37:27.464524 IP 192.168.1.254.53 > 192.168.1.100.53234: 29863 1/3/3 A 87.98.235.101 (163)
17:37:27.465781 IP 192.168.1.100.45753 > 87.98.235.101.80: Flags [S], seq 3091317576, win 5840, options [mss 1460,sackOK,TS val 113176522 ecr 0,nop,wscale 6], length 0
17:37:27.528426 IP 87.98.235.101.80 > 192.168.1.100.45753: Flags [S.], seq 2127746297, ack 3091317577, win 5840, options [mss 1460,nop,nop,sackOK,nop,wscale 7], length 0
17:37:27.528494 IP 192.168.1.100.45753 > 87.98.235.101.80: Flags [.], ack 1, win 92, length 0
17:37:27.528700 IP 192.168.1.100.45753 > 87.98.235.101.80: Flags [P.], seq 1:1033, ack 1, win 92, length 1032
17:37:27.597132 IP 87.98.235.101.80 > 192.168.1.100.45753: Flags [.], ack 1033, win 62, length 0
17:37:27.599739 IP 87.98.235.101.80 > 192.168.1.100.45753: Flags [.], seq 1:1461, ack 1033, win 62, length 1460
17:37:27.599762 IP 192.168.1.100.45753 > 87.98.235.101.80: Flags [.], ack 1461, win 137, length 0
17:37:27.610697 IP 87.98.235.101.80 > 192.168.1.100.45753: Flags [.], seq 1461:2921, ack 1033, win 62, length 1460
17:37:27.610772 IP 192.168.1.100.45753 > 87.98.235.101.80: Flags [.], ack 2921, win 183, length 0
17:37:27.623095 IP 87.98.235.101.80 > 192.168.1.100.45753: Flags [.], seq 2921:4381, ack 1033, win 62, length 1460
17:37:27.623142 IP 192.168.1.100.45753 > 87.98.235.101.80: Flags [.], ack 4381, win 229, length 0
17:37:27.658896 IP 87.98.235.101.80 > 192.168.1.100.45753: Flags [.], seq 4381:5841, ack 1033, win 62, length 1460
17:37:27.658943 IP 192.168.1.100.45753 > 87.98.235.101.80: Flags [.], ack 5841, win 274, length 0
17:37:27.660326 IP 87.98.235.101.80 > 192.168.1.100.45753: Flags [P.], seq 5841:7301, ack 1033, win 62, length 1460
17:37:27.660338 IP 192.168.1.100.45753 > 87.98.235.101.80: Flags [.], ack 7301, win 320, length 0
17:37:27.661266 IP 87.98.235.101.80 > 192.168.1.100.45753: Flags [.], seq 7301:8761, ack 1033, win 62, length 1460
17:37:27.661287 IP 192.168.1.100.45753 > 87.98.235.101.80: Flags [.], ack 8761, win 365, length 0
17:37:27.663041 IP 87.98.235.101.80 > 192.168.1.100.45753: Flags [P.], seq 8761:10221, ack 1033, win 62, length 1460
17:37:27.663054 IP 192.168.1.100.45753 > 87.98.235.101.80: Flags [.], ack 10221, win 411, length 0
17:37:27.668238 IP 87.98.235.101.80 > 192.168.1.100.45753: Flags [.], seq 10221:11681, ack 1033, win 62, length 1460
17:37:27.668281 IP 192.168.1.100.45753 > 87.98.235.101.80: Flags [.], ack 11681, win 457, length 0
17:37:27.669533 IP 87.98.235.101.80 > 192.168.1.100.45753: Flags [.], seq 11681:13141, ack 1033, win 62, length 1460
17:37:27.669566 IP 192.168.1.100.45753 > 87.98.235.101.80: Flags [.], ack 13141, win 502, length 0
17:37:27.705193 IP 87.98.235.101.80 > 192.168.1.100.45753: Flags [.], seq 13141:14601, ack 1033, win 62, length 1460
17:37:27.705262 IP 192.168.1.100.45753 > 87.98.235.101.80: Flags [.], ack 14601, win 548, length 0
17:37:27.707920 IP 87.98.235.101.80 > 192.168.1.100.45753: Flags [.], seq 14601:16061, ack 1033, win 62, length 1460
17:37:27.707935 IP 192.168.1.100.45753 > 87.98.235.101.80: Flags [.], ack 16061, win 594, length 0
17:37:27.712311 IP 87.98.235.101.80 > 192.168.1.100.45753: Flags [.], seq 17521:18981, ack 1033, win 62, length 1460
17:37:27.712354 IP 192.168.1.100.45753 > 87.98.235.101.80: Flags [.], ack 16061, win 594, options [nop,nop,sack 1 {17521:18981}], length 0
17:37:27.716643 IP 87.98.235.101.80 > 192.168.1.100.45753: Flags [.], seq 18981:20441, ack 1033, win 62, length 1460
17:37:27.716691 IP 192.168.1.100.45753 > 87.98.235.101.80: Flags [.], ack 16061, win 594, options [nop,nop,sack 1 {17521:20441}], length 0
17:37:27.716784 IP 87.98.235.101.80 > 192.168.1.100.45753: Flags [.], seq 16061:17521, ack 1033, win 62, length 1460
17:37:27.716800 IP 192.168.1.100.45753 > 87.98.235.101.80: Flags [.], ack 20441, win 639, length 0
17:37:27.717966 IP 87.98.235.101.80 > 192.168.1.100.45753: Flags [FP.], seq 20441:21018, ack 1033, win 62, length 577
17:37:27.723775 IP 192.168.1.100.45753 > 87.98.235.101.80: Flags [F.], seq 1033, ack 21019, win 685, length 0
17:37:27.787637 IP 87.98.235.101.80 > 192.168.1.100.45753: Flags [.], ack 1034, win 62, length 0
17:37:27.794845 IP 192.168.1.100.45754 > 87.98.235.101.80: Flags [S], seq 3094672432, win 5840, options [mss 1460,sackOK,TS val 113176605 ecr 0,nop,wscale 6], length 0
17:37:27.802958 IP 192.168.1.100.57658 > 192.168.1.254.53: 15954+ AAAA? static.adtaily.com. (36)
17:37:27.847848 IP 87.98.235.101.80 > 192.168.1.100.45754: Flags [S.], seq 2133887448, ack 3094672433, win 5840, options [mss 1460,nop,nop,sackOK,nop,wscale 7], length 0
17:37:27.847901 IP 192.168.1.100.45754 > 87.98.235.101.80: Flags [.], ack 1, win 92, length 0
17:37:27.850907 IP 192.168.1.100.45754 > 87.98.235.101.80: Flags [P.], seq 1:1026, ack 1, win 92, length 1025
17:37:27.902199 IP 87.98.235.101.80 > 192.168.1.100.45754: Flags [.], ack 1026, win 62, length 0
17:37:27.905198 IP 87.98.235.101.80 > 192.168.1.100.45754: Flags [.], seq 1:1461, ack 1026, win 62, length 1460
17:37:27.905243 IP 192.168.1.100.45754 > 87.98.235.101.80: Flags [.], ack 1461, win 137, length 0
17:37:27.909295 IP 87.98.235.101.80 > 192.168.1.100.45754: Flags [.], seq 2921:4381, ack 1026, win 62, length 1460
17:37:27.909335 IP 192.168.1.100.45754 > 87.98.235.101.80: Flags [.], ack 1461, win 137, options [nop,nop,sack 1 {2921:4381}], length 0
17:37:27.912294 IP 87.98.235.101.80 > 192.168.1.100.45754: Flags [.], seq 1461:2921, ack 1026, win 62, length 1460
17:37:27.912345 IP 192.168.1.100.45754 > 87.98.235.101.80: Flags [.], ack 4381, win 183, length 0
17:37:27.975642 IP 87.98.235.101.80 > 192.168.1.100.45754: Flags [.], seq 5841:7301, ack 1026, win 62, length 1460
17:37:27.975689 IP 192.168.1.100.45754 > 87.98.235.101.80: Flags [.], ack 4381, win 183, options [nop,nop,sack 1 {5841:7301}], length 0
17:37:27.976643 IP 87.98.235.101.80 > 192.168.1.100.45754: Flags [.], seq 4381:5841, ack 1026, win 62, length 1460
17:37:27.976660 IP 192.168.1.100.45754 > 87.98.235.101.80: Flags [.], ack 7301, win 229, length 0
17:37:27.981952 IP 87.98.235.101.80 > 192.168.1.100.45754: Flags [.], seq 7301:8761, ack 1026, win 62, length 1460
17:37:27.981988 IP 192.168.1.100.45754 > 87.98.235.101.80: Flags [.], ack 8761, win 274, length 0
17:37:27.982153 IP 87.98.235.101.80 > 192.168.1.100.45754: Flags [.], seq 8761:10221, ack 1026, win 62, length 1460
17:37:27.982162 IP 192.168.1.100.45754 > 87.98.235.101.80: Flags [.], ack 10221, win 320, length 0
17:37:27.991170 IP 192.168.1.100.33844 > 192.168.1.254.53: 59139+ AAAA? www.adtaily.com. (33)
17:37:28.024738 IP 87.98.235.101.80 > 192.168.1.100.45754: Flags [.], seq 11681:13141, ack 1026, win 62, length 1460
17:37:28.024786 IP 192.168.1.100.45754 > 87.98.235.101.80: Flags [.], ack 10221, win 320, options [nop,nop,sack 1 {11681:13141}], length 0
17:37:28.028349 IP 87.98.235.101.80 > 192.168.1.100.45754: Flags [.], seq 10221:11681, ack 1026, win 62, length 1460
17:37:28.028389 IP 192.168.1.100.45754 > 87.98.235.101.80: Flags [.], ack 13141, win 365, length 0
17:37:28.030131 IP 87.98.235.101.80 > 192.168.1.100.45754: Flags [.], seq 16061:17521, ack 1026, win 62, length 1460
17:37:28.030168 IP 192.168.1.100.45754 > 87.98.235.101.80: Flags [.], ack 13141, win 365, options [nop,nop,sack 1 {16061:17521}], length 0
17:37:28.031015 IP 87.98.235.101.80 > 192.168.1.100.45754: Flags [.], seq 18981:20441, ack 1026, win 62, length 1460
17:37:28.031033 IP 192.168.1.100.45754 > 87.98.235.101.80: Flags [.], ack 13141, win 365, options [nop,nop,sack 2 {18981:20441}{16061:17521}], length 0
17:37:28.031902 IP 87.98.235.101.80 > 192.168.1.100.45754: Flags [.], seq 20441:21901, ack 1026, win 62, length 1460
17:37:28.031933 IP 192.168.1.100.45754 > 87.98.235.101.80: Flags [.], ack 13141, win 365, options [nop,nop,sack 2 {18981:21901}{16061:17521}], length 0
17:37:28.034702 IP 87.98.235.101.80 > 192.168.1.100.45754: Flags [.], seq 13141:14601, ack 1026, win 62, length 1460
17:37:28.034769 IP 192.168.1.100.45754 > 87.98.235.101.80: Flags [.], ack 14601, win 411, options [nop,nop,sack 2 {18981:21901}{16061:17521}], length 0
17:37:28.035765 IP 87.98.235.101.80 > 192.168.1.100.45754: Flags [P.], seq 14601:16061, ack 1026, win 62, length 1460
17:37:28.035797 IP 192.168.1.100.45754 > 87.98.235.101.80: Flags [.], ack 17521, win 457, options [nop,nop,sack 1 {18981:21901}], length 0
17:37:28.037865 IP 87.98.235.101.80 > 192.168.1.100.45754: Flags [.], seq 17521:18981, ack 1026, win 62, length 1460
17:37:28.037896 IP 192.168.1.100.45754 > 87.98.235.101.80: Flags [.], ack 21901, win 502, length 0
17:37:28.077555 IP 87.98.235.101.80 > 192.168.1.100.45754: Flags [.], seq 21901:23361, ack 1026, win 62, length 1460
17:37:28.077592 IP 192.168.1.100.45754 > 87.98.235.101.80: Flags [.], ack 23361, win 548, length 0
17:37:28.082916 IP 87.98.235.101.80 > 192.168.1.100.45754: Flags [.], seq 23361:24821, ack 1026, win 62, length 1460
17:37:28.082955 IP 192.168.1.100.45754 > 87.98.235.101.80: Flags [.], ack 24821, win 594, length 0
17:37:28.088345 IP 87.98.235.101.80 > 192.168.1.100.45754: Flags [.], seq 24821:26281, ack 1026, win 62, length 1460
17:37:28.088383 IP 192.168.1.100.45754 > 87.98.235.101.80: Flags [.], ack 26281, win 639, length 0
17:37:28.089814 IP 87.98.235.101.80 > 192.168.1.100.45754: Flags [.], seq 26281:27741, ack 1026, win 62, length 1460
17:37:28.089838 IP 192.168.1.100.45754 > 87.98.235.101.80: Flags [.], ack 27741, win 685, length 0
17:37:28.091575 IP 192.168.1.254.53 > 192.168.1.100.33844: 59139 0/1/0 (90)
17:37:28.094888 IP 192.168.1.100.52768 > 192.168.1.254.53: 15940+ AAAA? www.adtaily.com. (33)
17:37:28.096854 IP 192.168.1.254.53 > 192.168.1.100.52768: 15940 0/1/0 (90)
17:37:28.099992 IP 87.98.235.101.80 > 192.168.1.100.45754: Flags [.], seq 13141:14601, ack 1026, win 62, length 1460
17:37:28.100029 IP 192.168.1.100.45754 > 87.98.235.101.80: Flags [.], ack 27741, win 685, options [nop,nop,sack 1 {13141:14601}], length 0
17:37:28.104399 IP 192.168.1.100.53163 > 192.168.1.254.53: 24318+ A? www.adtaily.com. (33)
17:37:28.109710 IP 87.98.235.101.80 > 192.168.1.100.45754: Flags [P.], seq 14601:16061, ack 1026, win 62, length 1460
17:37:28.109753 IP 192.168.1.100.45754 > 87.98.235.101.80: Flags [.], ack 27741, win 685, options [nop,nop,sack 1 {14601:16061}], length 0
17:37:28.116567 IP 87.98.235.101.80 > 192.168.1.100.45754: Flags [.], seq 27741:29201, ack 1026, win 62, length 1460
17:37:28.116602 IP 192.168.1.100.45754 > 87.98.235.101.80: Flags [.], ack 29201, win 730, length 0
17:37:28.117623 IP 192.168.1.254.53 > 192.168.1.100.53163: 24318 1/2/2 A[|domain]
17:37:28.117904 IP 192.168.1.100.41334 > 79.125.9.76.80: Flags [S], seq 3091910968, win 5840, options [mss 1460,sackOK,TS val 113176685 ecr 0,nop,wscale 6], length 0
17:37:28.123988 IP 87.98.235.101.80 > 192.168.1.100.45754: Flags [.], seq 29201:30661, ack 1026, win 62, length 1460
17:37:28.124026 IP 192.168.1.100.45754 > 87.98.235.101.80: Flags [.], ack 30661, win 776, length 0
17:37:28.138348 IP 87.98.235.101.80 > 192.168.1.100.45754: Flags [.], seq 30661:32121, ack 1026, win 62, length 1460
17:37:28.138384 IP 192.168.1.100.45754 > 87.98.235.101.80: Flags [.], ack 32121, win 822, length 0
17:37:28.152360 IP 87.98.235.101.80 > 192.168.1.100.45754: Flags [.], seq 32121:33581, ack 1026, win 62, length 1460
17:37:28.152394 IP 192.168.1.100.45754 > 87.98.235.101.80: Flags [.], ack 33581, win 867, length 0
17:37:28.162947 IP 87.98.235.101.80 > 192.168.1.100.45754: Flags [.], seq 33581:35041, ack 1026, win 62, length 1460
17:37:28.162978 IP 192.168.1.100.45754 > 87.98.235.101.80: Flags [.], ack 35041, win 913, length 0
17:37:28.172108 IP 87.98.235.101.80 > 192.168.1.100.45754: Flags [.], seq 35041:36501, ack 1026, win 62, length 1460
17:37:28.172142 IP 192.168.1.100.45754 > 87.98.235.101.80: Flags [.], ack 36501, win 959, length 0
17:37:28.180000 IP 87.98.235.101.80 > 192.168.1.100.45754: Flags [.], seq 36501:37961, ack 1026, win 62, length 1460
17:37:28.180031 IP 192.168.1.100.45754 > 87.98.235.101.80: Flags [.], ack 37961, win 1002, length 0
17:37:28.188352 IP 87.98.235.101.80 > 192.168.1.100.45754: Flags [.], seq 37961:39421, ack 1026, win 62, length 1460
17:37:28.188386 IP 192.168.1.100.45754 > 87.98.235.101.80: Flags [.], ack 39421, win 1002, length 0
17:37:28.195851 IP 87.98.235.101.80 > 192.168.1.100.45754: Flags [.], seq 39421:40881, ack 1026, win 62, length 1460
17:37:28.195890 IP 192.168.1.100.45754 > 87.98.235.101.80: Flags [.], ack 40881, win 1002, length 0
17:37:28.201035 IP 79.125.9.76.80 > 192.168.1.100.41334: Flags [S.], seq 3179553381, ack 3091910969, win 5792, options [mss 1460,sackOK,TS val 214063345 ecr 113176685,nop,wscale 6], length 0
17:37:28.201087 IP 192.168.1.100.41334 > 79.125.9.76.80: Flags [.], ack 1, win 92, options [nop,nop,TS val 113176706 ecr 214063345], length 0
17:37:28.206682 IP 87.98.235.101.80 > 192.168.1.100.45754: Flags [.], seq 40881:42341, ack 1026, win 62, length 1460
17:37:28.206759 IP 192.168.1.100.45754 > 87.98.235.101.80: Flags [.], ack 42341, win 981, length 0
17:37:28.207325 IP 192.168.1.100.41334 > 79.125.9.76.80: Flags [P.], seq 1:478, ack 1, win 92, options [nop,nop,TS val 113176708 ecr 214063345], length 477
17:37:28.213890 IP 87.98.235.101.80 > 192.168.1.100.45754: Flags [.], seq 42341:43801, ack 1026, win 62, length 1460
17:37:28.213929 IP 192.168.1.100.45754 > 87.98.235.101.80: Flags [.], ack 43801, win 1002, length 0
17:37:28.231466 IP 87.98.235.101.80 > 192.168.1.100.45754: Flags [FP.], seq 43801:44002, ack 1026, win 62, length 201
17:37:28.243120 IP 192.168.1.100.45754 > 87.98.235.101.80: Flags [F.], seq 1026, ack 44003, win 1002, length 0
17:37:28.298389 IP 192.168.1.254.53 > 192.168.1.100.57658: 15954 2/1/0 CNAME[|domain]
17:37:28.307081 IP 192.168.1.100.39195 > 192.168.1.254.53: 15012+ A? static.adtaily.com. (36)
17:37:28.317282 IP 79.125.9.76.80 > 192.168.1.100.41334: Flags [.], ack 478, win 108, options [nop,nop,TS val 214063359 ecr 113176708], length 0
17:37:28.416931 IP 192.168.1.254.53 > 192.168.1.100.39195: 15012 3/6/6 CNAME[|domain]
17:37:28.490779 IP 192.168.1.100.45754 > 87.98.235.101.80: Flags [F.], seq 1026, ack 44003, win 1002, length 0
17:37:28.545171 IP 87.98.235.101.80 > 192.168.1.100.45754: Flags [.], ack 1027, win 62, length 0
17:37:28.578022 IP 79.125.9.76.80 > 192.168.1.100.41334: Flags [P.], seq 1:186, ack 478, win 108, options [nop,nop,TS val 214063384 ecr 113176708], length 185
17:37:28.578070 IP 192.168.1.100.41334 > 79.125.9.76.80: Flags [.], ack 186, win 108, options [nop,nop,TS val 113176800 ecr 214063384], length 0
17:37:28.578077 IP 79.125.9.76.80 > 192.168.1.100.41334: Flags [F.], seq 186, ack 478, win 108, options [nop,nop,TS val 214063384 ecr 113176708], length 0
17:37:28.578411 IP 192.168.1.100.41334 > 79.125.9.76.80: Flags [F.], seq 478, ack 187, win 108, options [nop,nop,TS val 113176800 ecr 214063384], length 0
17:37:28.650831 IP 79.125.9.76.80 > 192.168.1.100.41334: Flags [.], ack 479, win 108, options [nop,nop,TS val 214063392 ecr 113176800], length 0
17:37:28.699119 IP 192.168.1.100.51407 > 192.168.1.254.53: 23441+ AAAA? s3.amazonaws.com. (34)
17:37:28.719916 IP 192.168.1.100.36944 > 192.168.1.254.53: 21362+ AAAA? tracker.adtaily.com. (37)
17:37:28.869469 IP 192.168.1.254.53 > 192.168.1.100.51407: 23441 1/1/0 CNAME[|domain]
17:37:28.869632 IP 192.168.1.100.38361 > 192.168.1.254.53: 25649+ A? s3.amazonaws.com. (34)
17:37:28.968603 IP 192.168.1.100.58598 > 74.125.79.101.80: Flags [P.], seq 331976417:331977574, ack 1747185319, win 108, options [nop,nop,TS val 113176898 ecr 1703261574], length 1157
17:37:28.977859 IP 192.168.1.100.34442 > 192.168.1.254.53: 37758+ AAAA? gazeta.hit.gemius.pl. (38)
17:37:28.987151 IP 192.168.1.254.53 > 192.168.1.100.34442: 37758 0/1/0 (90)
17:37:28.987328 IP 192.168.1.100.53322 > 192.168.1.254.53: 51962+ AAAA? gazeta.hit.gemius.pl. (38)
17:37:28.989169 IP 192.168.1.254.53 > 192.168.1.100.53322: 51962 0/1/0 (90)
17:37:28.995013 IP 192.168.1.100.52375 > 192.168.1.254.53: 38361+ A? gazeta.hit.gemius.pl. (38)
17:37:28.995166 IP 192.168.1.100.54109 > 209.85.229.155.80: Flags [P.], seq 334509540:334510560, ack 1466417870, win 227, options [nop,nop,TS val 113176905 ecr 3771899789], length 1020
17:37:29.006667 IP 192.168.1.254.53 > 192.168.1.100.52375: 38361 1/2/2 (129)
17:37:29.007041 IP 192.168.1.100.41966 > 80.252.0.151.80: Flags [S], seq 3102719086, win 5840, options [mss 1460,sackOK,TS val 113176908 ecr 0,nop,wscale 6], length 0
17:37:29.036622 IP 80.252.0.151.80 > 192.168.1.100.41966: Flags [S.], seq 230401783, ack 3102719087, win 65535, options [mss 1460], length 0
17:37:29.036690 IP 192.168.1.100.41966 > 80.252.0.151.80: Flags [.], ack 1, win 5840, length 0
17:37:29.038342 IP 192.168.1.100.41966 > 80.252.0.151.80: Flags [P.], seq 1:1125, ack 1, win 5840, length 1124
17:37:29.042499 IP 74.125.79.101.80 > 192.168.1.100.58598: Flags [P.], seq 1:315, ack 1157, win 157, options [nop,nop,TS val 1703438014 ecr 113176898], length 314
17:37:29.042548 IP 192.168.1.100.58598 > 74.125.79.101.80: Flags [.], ack 315, win 125, options [nop,nop,TS val 113176916 ecr 1703438014], length 0
17:37:29.042553 IP 74.125.79.101.80 > 192.168.1.100.58598: Flags [P.], seq 315:350, ack 1157, win 157, options [nop,nop,TS val 1703438014 ecr 113176898], length 35
17:37:29.042560 IP 192.168.1.100.58598 > 74.125.79.101.80: Flags [.], ack 350, win 125, options [nop,nop,TS val 113176916 ecr 1703438014], length 0
17:37:29.044241 IP 192.168.1.254.53 > 192.168.1.100.38361: 25649 2/4/4 CNAME[|domain]
17:37:29.064687 IP 80.252.0.151.80 > 192.168.1.100.41966: Flags [F.], seq 597, ack 1125, win 65535, length 0
17:37:29.064742 IP 192.168.1.100.41966 > 80.252.0.151.80: Flags [.], ack 1, win 5840, length 0
17:37:29.071282 IP 80.252.0.151.80 > 192.168.1.100.41966: Flags [P.], seq 1:597, ack 1125, win 65535, length 596
17:37:29.071325 IP 192.168.1.100.41966 > 80.252.0.151.80: Flags [.], ack 598, win 6556, length 0
17:37:29.072942 IP 192.168.1.100.41966 > 80.252.0.151.80: Flags [F.], seq 1125, ack 598, win 6556, length 0
17:37:29.074599 IP 209.85.229.155.80 > 192.168.1.100.54109: Flags [.], ack 1020, win 168, options [nop,nop,TS val 3772076101 ecr 113176905], length 0
17:37:29.095275 IP 192.168.1.254.53 > 192.168.1.100.36944: 21362 3/1/0[|domain]
17:37:29.098926 IP 192.168.1.100.34448 > 192.168.1.254.53: 30755+ A? tracker.adtaily.com. (37)
17:37:29.100328 IP 80.252.0.151.80 > 192.168.1.100.41966: Flags [.], ack 1126, win 65534, length 0
17:37:29.135711 IP 192.168.1.100.58598 > 74.125.79.101.80: Flags [P.], seq 1157:1959, ack 350, win 125, options [nop,nop,TS val 113176940 ecr 1703438014], length 802
17:37:29.137699 IP 209.85.229.155.80 > 192.168.1.100.54109: Flags [P.], seq 1419:1966, ack 1020, win 168, options [nop,nop,TS val 3772076180 ecr 113176905], length 547
17:37:29.137736 IP 192.168.1.100.54109 > 209.85.229.155.80: Flags [.], ack 1, win 227, options [nop,nop,TS val 113176940 ecr 3772076101,nop,nop,sack 1 {1419:1966}], length 0
17:37:29.142995 IP 209.85.229.155.80 > 192.168.1.100.54109: Flags [.], seq 1:1419, ack 1020, win 168, options [nop,nop,TS val 3772076180 ecr 113176905], length 1418
17:37:29.143046 IP 192.168.1.100.54109 > 209.85.229.155.80: Flags [.], ack 1966, win 272, options [nop,nop,TS val 113176942 ecr 3772076180], length 0
17:37:29.197804 IP 74.125.79.101.80 > 192.168.1.100.58598: Flags [P.], seq 664:699, ack 1959, win 193, options [nop,nop,TS val 1703438180 ecr 113176940], length 35
