14:48:39.315039 IP 153.19.48.161.138 > 153.19.48.255.138: NBT UDP PACKET(138)
14:48:39.357703 IP6 fe80::20f:eaff:fe33:1738 > ff02::1:ff00:1: ICMP6, neighbor solicitation, who has 2001:4200:1010::1, length 32
14:48:39.358767 IP6 fe80::20f:eaff:fe33:1738 > ff02::1:ff00:13: ICMP6, neighbor solicitation, who has 2001:4f8:0:2::13, length 32
14:48:39.446684 IP6 fe80::20f:eaff:fe33:1738 > ff02::1:ff00:10: ICMP6, neighbor solicitation, who has 2001:13c7:7002:3000::10, length 32
14:48:39.489778 arp who-has 153.19.48.208 tell 153.19.48.254
14:48:39.509509 IP 153.19.48.3.1066 > 255.255.255.255.5200: UDP, length 21
14:48:39.510318 IP 153.19.48.3.1088 > 234.8.7.1.1088: UDP, length 64
14:48:40.010360 IP 153.19.48.3.1088 > 234.8.7.1.1088: UDP, length 64
14:48:40.126745 arp who-has 153.19.53.126 (00:11:85:07:af:00) tell 153.19.53.124
14:48:40.187928 IP 153.19.49.193.137 > 153.19.49.255.137: NBT UDP PACKET(137): QUERY; REQUEST; BROADCAST
14:48:40.358551 IP6 fe80::20f:eaff:fe33:1738 > ff02::1:ff00:13: ICMP6, neighbor solicitation, who has 2001:4f8:0:2::13, length 32
14:48:40.448493 IP 153.19.53.136.32773 > 224.0.0.35.45566: UDP, length 101
14:48:40.510372 IP 153.19.48.3.1088 > 234.8.7.1.1088: UDP, length 64
14:48:40.682651 IP 153.19.49.203.137 > 153.19.49.255.137: NBT UDP PACKET(137): REGISTRATION; REQUEST; BROADCAST
14:48:40.736645 arp who-has 153.19.53.50 tell 153.19.48.254
14:48:40.739887 arp who-has 153.19.50.126 (00:11:85:07:af:00) tell 153.19.50.118
14:48:40.813142 arp who-has 153.19.48.57 tell 153.19.48.254
14:48:40.930260 IP 153.19.49.193.137 > 153.19.49.255.137: NBT UDP PACKET(137): QUERY; REQUEST; BROADCAST
14:48:40.947997 arp who-has 153.19.53.51 tell 153.19.48.254
14:48:40.958965 IP 153.19.50.81.138 > 153.19.50.127.138: NBT UDP PACKET(138)
14:48:40.959027 IP 153.19.50.81.137 > 153.19.50.127.137: NBT UDP PACKET(137): QUERY; REQUEST; BROADCAST
14:48:41.010382 IP 153.19.48.3.1088 > 234.8.7.1.1088: UDP, length 64
14:48:41.358403 IP6 fe80::20f:eaff:fe33:1738 > ff02::1:ff00:13: ICMP6, neighbor solicitation, who has 2001:4f8:0:2::13, length 32
14:48:41.406760 IP6 fe80::20f:eaff:fe33:1738 > ff02::1:ff00:2: ICMP6, neighbor solicitation, who has 2001:42a0:0:a0::2, length 32
14:48:41.419122 arp who-has 153.19.48.68 tell 153.19.48.254
14:48:41.457551 arp who-has 153.19.48.254 (00:11:85:07:af:00) tell 153.19.48.131
14:48:41.510380 IP 153.19.48.3.1088 > 234.8.7.1.1088: UDP, length 64
14:48:41.617407 arp who-has 153.19.48.30 tell 153.19.48.254
14:48:41.680123 IP 153.19.49.193.137 > 153.19.49.255.137: NBT UDP PACKET(137): QUERY; REQUEST; BROADCAST
14:48:41.683041 IP 153.19.49.203.138 > 153.19.49.255.138: NBT UDP PACKET(138)
14:48:41.708884 IP 153.19.50.81.137 > 153.19.50.127.137: NBT UDP PACKET(137): QUERY; REQUEST; BROADCAST
14:48:41.910519 IP 153.19.49.240.138 > 153.19.49.255.138: NBT UDP PACKET(138)
14:48:42.010400 IP 153.19.48.3.1088 > 234.8.7.1.1088: UDP, length 64
14:48:42.134539 arp who-has 153.19.53.37 tell 153.19.48.254
14:48:42.135813 IP 91.197.13.82.8074 > 153.19.53.37.33313: P 3128267093:3128267137(44) ack 443275423 win 700
14:48:42.215117 arp who-has 153.19.53.190 (00:11:85:07:af:00) tell 153.19.53.182
14:48:42.305491 arp who-has 153.19.49.28 tell 153.19.48.254
14:48:42.319811 IP6 fe80::6169:a19e:f835:443.546 > ff02::1:2.547: dhcp6 solicit
14:48:42.406245 IP6 fe80::20f:eaff:fe33:1738 > ff02::1:ff00:2: ICMP6, neighbor solicitation, who has 2001:42a0:0:a0::2, length 32
14:48:42.425784 IP6 fe80::20f:eaff:fe33:1738 > ff02::1:ff02:30: ICMP6, neighbor solicitation, who has 2001:503:a83e::2:30, length 32
14:48:42.458888 IP 153.19.50.81.137 > 153.19.50.127.137: NBT UDP PACKET(137): QUERY; REQUEST; BROADCAST
14:48:42.510372 IP 153.19.48.3.1088 > 234.8.7.1.1088: UDP, length 64
14:48:42.745801 arp who-has 153.19.48.254 (00:11:85:07:af:00) tell 153.19.48.127
14:48:43.009205 arp who-has 153.19.53.125 tell 153.19.48.254
14:48:43.010506 IP 153.19.48.3.1088 > 234.8.7.1.1088: UDP, length 64
14:48:43.075890 IP 153.19.48.243.138 > 153.19.48.255.138: NBT UDP PACKET(138)
14:48:43.217615 arp who-has 153.19.53.202 tell 153.19.48.254
14:48:43.234086 arp who-has 153.19.53.184 tell 153.19.48.254
14:48:43.320350 IP6 fe80::6169:a19e:f835:443.546 > ff02::1:2.547: dhcp6 solicit
14:48:43.324133 arp who-has 153.19.49.239 tell 153.19.48.254
14:48:43.406096 IP6 fe80::20f:eaff:fe33:1738 > ff02::1:ff00:2: ICMP6, neighbor solicitation, who has 2001:42a0:0:a0::2, length 32
14:48:43.425087 IP6 fe80::20f:eaff:fe33:1738 > ff02::1:ff02:30: ICMP6, neighbor solicitation, who has 2001:503:a83e::2:30, length 32
14:48:43.510442 IP 153.19.48.3.1088 > 234.8.7.1.1088: UDP, length 64
14:48:44.010424 IP 153.19.48.3.1088 > 234.8.7.1.1088: UDP, length 64
14:48:44.160054 IP 153.19.53.230.137 > 153.19.53.255.137: NBT UDP PACKET(137): QUERY; REQUEST; BROADCAST
14:48:44.424941 IP6 fe80::20f:eaff:fe33:1738 > ff02::1:ff02:30: ICMP6, neighbor solicitation, who has 2001:503:a83e::2:30, length 32
14:48:44.430340 arp who-has 153.19.49.40 tell 153.19.49.44
14:48:44.438519 arp who-has 153.19.49.45 tell 153.19.49.44
14:48:44.505331 arp who-has 153.19.48.120 tell 153.19.48.254
14:48:44.510399 IP 153.19.48.3.1088 > 234.8.7.1.1088: UDP, length 64
14:48:44.522285 IP 153.19.48.3.1066 > 255.255.255.255.5200: UDP, length 21
14:48:44.909931 IP 153.19.53.230.137 > 153.19.53.255.137: NBT UDP PACKET(137): QUERY; REQUEST; BROADCAST
14:48:44.936668 00:1b:3f:e0:b5:ed > 01:80:c2:00:00:0e, ethertype Unknown (0x88cc), length 171: 
	0x0000:  0207 0400 1b3f e0b5 c004 0307 3139 0602  .....?......19..
	0x0010:  0078 0802 3139 0a0c 6f6b 6f31 3531 2d7a  .x..19..oko151-z
	0x0020:  6f72 7a61 0c56 5072 6f43 7572 7665 204a  orza.VProCurve.J
	0x0030:  3439 3030 4220 5377 6974 6368 2032 3632  4900B.Switch.262
	0x0040:  362c 2072 6576 6973 696f 6e20            6,.revision.
14:48:45.010436 IP 153.19.48.3.1088 > 234.8.7.1.1088: UDP, length 64
14:48:45.178252 arp who-has 153.19.48.92 tell 153.19.48.254
14:48:45.208953 IP 153.19.50.81.138 > 153.19.50.127.138: NBT UDP PACKET(138)
14:48:45.209008 IP 153.19.50.81.137 > 153.19.50.127.137: NBT UDP PACKET(137): QUERY; REQUEST; BROADCAST
14:48:45.214972 arp who-has 153.19.48.168 tell 153.19.48.254
14:48:45.320350 IP6 fe80::6169:a19e:f835:443.546 > ff02::1:2.547: dhcp6 solicit
14:48:45.332858 arp who-has 153.19.49.202 tell 153.19.48.254
14:48:45.510418 IP 153.19.48.3.1088 > 234.8.7.1.1088: UDP, length 64
14:48:45.638232 IP 153.19.53.136.32772 > 224.0.0.35.45566: UDP, length 100
14:48:45.659954 IP 153.19.53.230.137 > 153.19.53.255.137: NBT UDP PACKET(137): QUERY; REQUEST; BROADCAST
14:48:45.766480 arp who-has 153.19.49.9 tell 153.19.48.254
14:48:45.958883 IP 153.19.50.81.137 > 153.19.50.127.137: NBT UDP PACKET(137): QUERY; REQUEST; BROADCAST
14:48:46.010450 IP 153.19.48.3.1088 > 234.8.7.1.1088: UDP, length 64
14:48:46.185756 arp who-has 153.19.49.26 tell 153.19.48.254
14:48:46.510478 IP 153.19.48.3.1088 > 234.8.7.1.1088: UDP, length 64
14:48:46.708896 IP 153.19.50.81.137 > 153.19.50.127.137: NBT UDP PACKET(137): QUERY; REQUEST; BROADCAST
14:48:46.958166 IP 153.19.53.136.32773 > 224.0.0.35.45566: UDP, length 101
14:48:47.010457 IP 153.19.48.3.1088 > 234.8.7.1.1088: UDP, length 64
14:48:47.422271 IP6 fe80::20f:eaff:fe33:1738 > ff02::1:ff02:30: ICMP6, neighbor solicitation, who has 2001:503:231d::2:30, length 32
14:48:47.510472 IP 153.19.48.3.1088 > 234.8.7.1.1088: UDP, length 64
14:48:48.010471 IP 153.19.48.3.1088 > 234.8.7.1.1088: UDP, length 64
14:48:48.421359 IP6 fe80::20f:eaff:fe33:1738 > ff02::1:ff02:30: ICMP6, neighbor solicitation, who has 2001:503:231d::2:30, length 32
14:48:48.510458 IP 153.19.48.3.1088 > 234.8.7.1.1088: UDP, length 64
14:48:48.646316 arp who-has 153.19.49.208 tell 153.19.48.254
14:48:48.696375 arp who-has 153.19.48.161 tell 153.19.48.254
14:48:48.730534 arp who-has 153.19.53.111 tell 153.19.48.254
14:48:49.010595 IP 153.19.48.3.1088 > 234.8.7.1.1088: UDP, length 64
14:48:49.320454 IP6 fe80::6169:a19e:f835:443.546 > ff02::1:2.547: dhcp6 solicit
14:48:49.421193 IP6 fe80::20f:eaff:fe33:1738 > ff02::1:ff02:30: ICMP6, neighbor solicitation, who has 2001:503:231d::2:30, length 32
14:48:49.423235 IP6 fe80::20f:eaff:fe33:1738 > ff02::1:ff02:30: ICMP6, neighbor solicitation, who has 2001:503:a83e::2:30, length 32
14:48:49.459159 IP 153.19.50.81.137 > 153.19.50.127.137: NBT UDP PACKET(137): QUERY; REQUEST; BROADCAST
14:48:49.495533 arp who-has 153.19.48.19 tell 153.19.48.254
14:48:49.510487 IP 153.19.48.3.1088 > 234.8.7.1.1088: UDP, length 64
14:48:49.510538 IP 153.19.48.3.1066 > 255.255.255.255.5200: UDP, length 21
14:48:50.010647 IP 153.19.48.3.1088 > 234.8.7.1.1088: UDP, length 64
14:48:50.209258 IP 153.19.50.81.137 > 153.19.50.127.137: NBT UDP PACKET(137): QUERY; REQUEST; BROADCAST
14:48:50.350722 NBF Packet: Datagram
14:48:50.423041 IP6 fe80::20f:eaff:fe33:1738 > ff02::1:ff02:30: ICMP6, neighbor solicitation, who has 2001:503:a83e::2:30, length 32
14:48:50.510500 IP 153.19.48.3.1088 > 234.8.7.1.1088: UDP, length 64
14:48:50.729706 arp who-has 172.20.0.1 tell 172.20.0.19
14:48:50.958959 IP 153.19.50.81.137 > 153.19.50.127.137: NBT UDP PACKET(137): QUERY; REQUEST; BROADCAST
14:48:51.010545 IP 153.19.48.3.1088 > 234.8.7.1.1088: UDP, length 64
14:48:51.363467 arp who-has 153.19.49.17 tell 153.19.48.254
14:48:51.422891 IP6 fe80::20f:eaff:fe33:1738 > ff02::1:ff02:30: ICMP6, neighbor solicitation, who has 2001:503:a83e::2:30, length 32
14:48:51.510626 IP 153.19.48.3.1088 > 234.8.7.1.1088: UDP, length 64
14:48:51.742525 IP6 fe80::5c5b:6429:b2f2:de81.546 > ff02::1:2.547: dhcp6 solicit
14:48:51.772766 IPX 00000000.00:04:76:eb:a1:94.0455 > 00000000.ff:ff:ff:ff:ff:ff.0455: ipx-netbios 50
14:48:51.777941 IP 153.19.53.136.32772 > 224.0.0.35.45566: UDP, length 100
14:48:52.011834 IP 153.19.48.3.1088 > 234.8.7.1.1088: UDP, length 64
14:48:52.309922 arp who-has 153.19.48.233 tell 153.19.48.65
14:48:52.442219 arp who-has 153.19.50.126 tell 153.19.50.86
14:48:52.449296 IP6 fe80::20f:eaff:fe33:1738 > ff02::1:ff02:30: ICMP6, neighbor solicitation, who has 2001:503:a83e::2:30, length 32
14:48:52.455033 arp who-has 153.19.48.2 tell 153.19.48.254
14:48:52.472462 arp who-has 153.19.48.254 (00:11:85:07:af:00) tell 153.19.48.126
14:48:52.511512 IP 153.19.48.3.1088 > 234.8.7.1.1088: UDP, length 64
14:48:52.579987 arp who-has 153.19.48.1 tell 153.19.48.148
14:48:52.581248 arp who-has 153.19.48.130 tell 153.19.48.148
14:48:52.647764 IPX 00000000.00:04:76:eb:a1:94.0455 > 00000000.ff:ff:ff:ff:ff:ff.0455: ipx-netbios 50
14:48:53.012696 IP 153.19.48.3.1088 > 234.8.7.1.1088: UDP, length 64
14:48:53.113411 IPX 00000000.00:40:af:7d:6f:6a.0452 > 00000000.ff:ff:ff:ff:ff:ff.0452: ipx-sap-resp 0414 'RDP_C20522-W95_PEER_PRINTER[|ipx 64]
14:48:53.313659 IPX 00000000.00:40:af:7d:6f:6a.0452 > 00000000.ff:ff:ff:ff:ff:ff.0452: ipx-sap-resp 0414 'RDP_C20522[|ipx 64]
14:48:53.448588 IP6 fe80::20f:eaff:fe33:1738 > ff02::1:ff02:30: ICMP6, neighbor solicitation, who has 2001:503:a83e::2:30, length 32
14:48:53.512589 IP 153.19.48.3.1088 > 234.8.7.1.1088: UDP, length 64
14:48:53.514032 IPX 00000000.00:40:af:7d:6f:6a.0452 > 00000000.ff:ff:ff:ff:ff:ff.0452: ipx-sap-resp 0414 'RDP_C20522-HTML[|ipx 64]
14:48:53.522761 IPX 00000000.00:04:76:eb:a1:94.0455 > 00000000.ff:ff:ff:ff:ff:ff.0455: ipx-netbios 50
14:48:53.607612 IP6 fe80::20f:eaff:fe33:1738 > ff02::1:ff02:30: ICMP6, neighbor solicitation, who has 2001:503:231d::2:30, length 32
14:48:53.758890 IP 153.19.49.193.138 > 153.19.49.255.138: NBT UDP PACKET(138)
14:48:53.759267 IP 153.19.49.193.137 > 153.19.49.255.137: NBT UDP PACKET(137): QUERY; REQUEST; BROADCAST
14:48:54.012498 IP 153.19.48.3.1088 > 234.8.7.1.1088: UDP, length 64
14:48:54.448443 IP6 fe80::20f:eaff:fe33:1738 > ff02::1:ff02:30: ICMP6, neighbor solicitation, who has 2001:503:a83e::2:30, length 32
14:48:54.507982 IP 153.19.49.193.137 > 153.19.49.255.137: NBT UDP PACKET(137): QUERY; REQUEST; BROADCAST
14:48:54.509869 IP 153.19.48.3.1066 > 255.255.255.255.5200: UDP, length 21
14:48:54.514525 IP 153.19.48.3.1088 > 234.8.7.1.1088: UDP, length 64
14:48:54.607413 IP6 fe80::20f:eaff:fe33:1738 > ff02::1:ff02:30: ICMP6, neighbor solicitation, who has 2001:503:231d::2:30, length 32
14:48:54.923817 arp who-has 192.168.0.153 tell 192.168.0.162
14:48:55.014621 IP 153.19.48.3.1088 > 234.8.7.1.1088: UDP, length 64
14:48:55.257981 IP 153.19.49.193.137 > 153.19.49.255.137: NBT UDP PACKET(137): QUERY; REQUEST; BROADCAST
14:48:55.452035 arp who-has 153.19.48.165 tell 153.19.48.254
14:48:55.514514 IP 153.19.48.3.1088 > 234.8.7.1.1088: UDP, length 64
14:48:55.607264 IP6 fe80::20f:eaff:fe33:1738 > ff02::1:ff02:30: ICMP6, neighbor solicitation, who has 2001:503:231d::2:30, length 32
14:48:55.721780 arp who-has 153.19.48.231 tell 153.19.48.151
14:48:56.014742 IP 153.19.48.3.1088 > 234.8.7.1.1088: UDP, length 64
14:48:56.345173 IP6 fe80::20f:eaff:fe33:1738 > ff02::1:ff02:30: ICMP6, neighbor solicitation, who has 2001:503:a83e::2:30, length 32
14:48:56.420094 arp who-has 153.19.48.254 (00:11:85:07:af:00) tell 153.19.48.131
14:48:56.421470 arp who-has 153.19.49.48 (00:02:d1:05:6f:c2) tell 153.19.49.48
14:48:56.513973 00:40:f4:73:33:73 > ff:ff:ff:ff:ff:ff Null Information, send seq 0, rcv seq 0, Flags [Command], length 46
14:48:56.515551 IP 153.19.48.3.1088 > 234.8.7.1.1088: UDP, length 64
14:48:56.867746 IP 153.19.53.136.32773 > 224.0.0.35.45566: UDP, length 101
14:48:56.937033 arp who-has 153.19.53.187 tell 153.19.48.254
14:48:57.015613 IP 153.19.48.3.1088 > 234.8.7.1.1088: UDP, length 64
14:48:57.177680 arp who-has 153.19.53.190 (00:11:85:07:af:00) tell 153.19.53.182
14:48:57.240023 arp who-has 153.19.53.172 tell 153.19.48.254
14:48:57.240555 IP 203.34.37.16.41435 > 153.19.53.172.53: 13417% [1au] A? ns.kaims.pl. (40)
14:48:57.320594 IP6 fe80::6169:a19e:f835:443.546 > ff02::1:2.547: dhcp6 solicit
14:48:57.345003 IP6 fe80::20f:eaff:fe33:1738 > ff02::1:ff02:30: ICMP6, neighbor solicitation, who has 2001:503:a83e::2:30, length 32
14:48:57.515472 IP 153.19.48.3.1088 > 234.8.7.1.1088: UDP, length 64
14:48:57.707909 arp who-has 153.19.53.62 tell 153.19.53.50
14:48:57.708325 arp who-has 153.19.48.254 (00:11:85:07:af:00) tell 153.19.48.127
14:48:57.859908 IP 153.19.53.154.137 > 153.19.53.191.137: NBT UDP PACKET(137): QUERY; REQUEST; BROADCAST
14:48:58.008218 IP 153.19.49.193.138 > 153.19.49.255.138: NBT UDP PACKET(138)
14:48:58.008599 IP 153.19.49.193.137 > 153.19.49.255.137: NBT UDP PACKET(137): QUERY; REQUEST; BROADCAST
14:48:58.015537 IP 153.19.48.3.1088 > 234.8.7.1.1088: UDP, length 64
14:48:58.344862 IP6 fe80::20f:eaff:fe33:1738 > ff02::1:ff02:30: ICMP6, neighbor solicitation, who has 2001:503:a83e::2:30, length 32
14:48:58.345921 IP6 fe80::20f:eaff:fe33:1738 > ff02::1:ff02:30: ICMP6, neighbor solicitation, who has 2001:503:231d::2:30, length 32
14:48:58.515503 IP 153.19.48.3.1088 > 234.8.7.1.1088: UDP, length 64
14:48:58.605907 IP 153.19.53.154.137 > 153.19.53.191.137: NBT UDP PACKET(137): QUERY; REQUEST; BROADCAST
14:48:58.739439 arp who-has 153.19.50.126 (00:11:85:07:af:00) tell 153.19.50.118
14:48:58.757906 IP 153.19.49.193.137 > 153.19.49.255.137: NBT UDP PACKET(137): QUERY; REQUEST; BROADCAST
14:48:59.015517 IP 153.19.48.3.1088 > 234.8.7.1.1088: UDP, length 64
14:48:59.345707 IP6 fe80::20f:eaff:fe33:1738 > ff02::1:ff02:30: ICMP6, neighbor solicitation, who has 2001:503:231d::2:30, length 32
14:48:59.355906 IP 153.19.53.154.137 > 153.19.53.191.137: NBT UDP PACKET(137): QUERY; REQUEST; BROADCAST
14:48:59.440075 arp who-has 153.19.48.204 tell 153.19.48.254
14:48:59.507888 IP 153.19.49.193.137 > 153.19.49.255.137: NBT UDP PACKET(137): QUERY; REQUEST; BROADCAST
14:48:59.511223 IP 153.19.48.3.1066 > 255.255.255.255.5200: UDP, length 21
14:48:59.515515 IP 153.19.48.3.1088 > 234.8.7.1.1088: UDP, length 64
14:48:59.570149 arp who-has 153.19.48.87 tell 153.19.48.254
14:48:59.936572 arp who-has 153.19.53.187 tell 153.19.48.254
14:49:00.015547 IP 153.19.48.3.1088 > 234.8.7.1.1088: UDP, length 64
14:49:00.107884 arp who-has 153.19.53.190 tell 153.19.53.154
14:49:00.345555 IP6 fe80::20f:eaff:fe33:1738 > ff02::1:ff02:30: ICMP6, neighbor solicitation, who has 2001:503:231d::2:30, length 32
14:49:00.434272 IP 153.19.53.19.631 > 153.19.53.255.631: UDP, length 131
14:49:00.515540 IP 153.19.48.3.1088 > 234.8.7.1.1088: UDP, length 64
14:49:01.015653 IP 153.19.48.3.1088 > 234.8.7.1.1088: UDP, length 64
14:49:01.187647 arp who-has 192.168.0.153 tell 192.168.0.113
14:49:01.289553 IP 153.19.49.193.138 > 153.19.49.255.138: NBT UDP PACKET(138)
14:49:01.417534 IP 153.19.53.136.32772 > 224.0.0.35.45566: UDP, length 100
14:49:01.515583 IP 153.19.48.3.1088 > 234.8.7.1.1088: UDP, length 64
14:49:01.821516 arp who-has 153.19.53.169 tell 153.19.48.254
14:49:01.851622 arp who-has 153.19.53.200 tell 153.19.48.254
14:49:02.015553 IP 153.19.48.3.1088 > 234.8.7.1.1088: UDP, length 64
14:49:02.258173 IP 153.19.49.193.138 > 153.19.49.255.138: NBT UDP PACKET(138)
14:49:02.258547 IP 153.19.49.193.137 > 153.19.49.255.137: NBT UDP PACKET(137): QUERY; REQUEST; BROADCAST
14:49:02.440543 arp who-has 153.19.48.5 tell 153.19.48.254
14:49:02.480095 arp who-has 153.19.49.202 tell 153.19.48.254
14:49:02.515584 IP 153.19.48.3.1088 > 234.8.7.1.1088: UDP, length 64
14:49:02.939048 arp who-has 153.19.53.187 tell 153.19.48.254
14:49:02.974934 IP6 fe80::20f:eaff:fe33:1738 > ff02::1:ff00:1: ICMP6, neighbor solicitation, who has 2001:dc7::1, length 32
14:49:03.007822 IP 153.19.49.193.137 > 153.19.49.255.137: NBT UDP PACKET(137): QUERY; REQUEST; BROADCAST
14:49:03.015628 IP 153.19.48.3.1088 > 234.8.7.1.1088: UDP, length 64
14:49:03.020332 arp who-has 153.19.53.200 tell 153.19.48.254
14:49:03.515593 IP 153.19.48.3.1088 > 234.8.7.1.1088: UDP, length 64
14:49:03.553950 arp who-has 153.19.48.122 tell 153.19.48.254
14:49:03.702083 arp who-has 153.19.48.111 tell 153.19.48.254
14:49:03.757827 IP 153.19.49.193.137 > 153.19.49.255.137: NBT UDP PACKET(137): QUERY; REQUEST; BROADCAST
14:49:03.952350 IP6 fe80::20f:eaff:fe33:1738 > ff02::1:ff02:30: ICMP6, neighbor solicitation, who has 2001:503:a83e::2:30, length 32
14:49:03.974008 IP6 fe80::20f:eaff:fe33:1738 > ff02::1:ff00:1: ICMP6, neighbor solicitation, who has 2001:dc7::1, length 32
14:49:04.015670 IP 153.19.48.3.1088 > 234.8.7.1.1088: UDP, length 64
14:49:04.515596 IP 153.19.48.3.1088 > 234.8.7.1.1088: UDP, length 64
14:49:04.523498 IP 153.19.48.3.1066 > 255.255.255.255.5200: UDP, length 21
14:49:04.951867 IP6 fe80::20f:eaff:fe33:1738 > ff02::1:ff02:30: ICMP6, neighbor solicitation, who has 2001:503:a83e::2:30, length 32
14:49:04.973857 IP6 fe80::20f:eaff:fe33:1738 > ff02::1:ff00:1: ICMP6, neighbor solicitation, who has 2001:dc7::1, length 32
14:49:05.015854 IP 153.19.48.3.1088 > 234.8.7.1.1088: UDP, length 64
14:49:05.117143 arp who-has 153.19.49.44 tell 153.19.48.254
14:49:05.286232 arp who-has 153.19.49.25 tell 153.19.49.35
14:49:05.286300 arp reply 153.19.49.25 is-at 00:03:ba:18:6f:d8
14:49:05.291056 arp who-has 153.19.48.191 tell 153.19.48.254
14:49:05.515599 IP 153.19.48.3.1088 > 234.8.7.1.1088: UDP, length 64
14:49:05.951717 IP6 fe80::20f:eaff:fe33:1738 > ff02::1:ff02:30: ICMP6, neighbor solicitation, who has 2001:503:a83e::2:30, length 32
14:49:05.952767 IP6 fe80::20f:eaff:fe33:1738 > ff02::1:ff02:30: ICMP6, neighbor solicitation, who has 2001:503:231d::2:30, length 32
14:49:06.015613 IP 153.19.48.3.1088 > 234.8.7.1.1088: UDP, length 64
14:49:06.507919 IP 153.19.49.193.138 > 153.19.49.255.138: NBT UDP PACKET(138)
14:49:06.515593 IP 153.19.48.3.1088 > 234.8.7.1.1088: UDP, length 64
14:49:06.523745 arp who-has 153.19.53.62 tell 153.19.53.51
14:49:06.540469 arp who-has 153.19.49.40 tell 153.19.48.254
14:49:06.541975 IP 153.19.50.190.64186 > 153.19.49.40.161:  GetRequest(27)  .1.3.6.1.2.1.25.2.2.0
14:49:06.544996 arp who-has 153.19.49.62 tell 153.19.49.40
14:49:06.585821 arp who-has 153.19.49.254 tell 153.19.49.240
14:49:06.952565 IP6 fe80::20f:eaff:fe33:1738 > ff02::1:ff02:30: ICMP6, neighbor solicitation, who has 2001:503:231d::2:30, length 32
14:49:06.976612 IP6 fe80::20f:eaff:fe33:1738 > ff02::1:ff00:1: ICMP6, neighbor solicitation, who has 2001:dc7:1000::1, length 32
14:49:07.015634 IP 153.19.48.3.1088 > 234.8.7.1.1088: UDP, length 64
14:49:07.337285 IP 153.19.53.136.32773 > 224.0.0.35.45566: UDP, length 101
14:49:07.383508 IP 153.19.49.193.138 > 153.19.49.255.138: NBT UDP PACKET(138)
14:49:07.434986 arp who-has 153.19.48.254 (00:11:85:07:af:00) tell 153.19.48.126
14:49:07.515889 IP 153.19.48.3.1088 > 234.8.7.1.1088: UDP, length 64
14:49:07.523754 IP6 fe80::20f:eaff:fe33:1738 > ff02::1:ff02:30: ICMP6, neighbor solicitation, who has 2001:503:a83e::2:30, length 32
14:49:07.548471 IP 153.19.49.200.138 > 153.19.49.255.138: NBT UDP PACKET(138)
14:49:07.648466 IP 153.19.49.193.138 > 153.19.49.255.138: NBT UDP PACKET(138)
14:49:07.722594 IP 153.19.50.90.138 > 153.19.50.127.138: NBT UDP PACKET(138)
14:49:07.852823 arp who-has 153.19.53.200 tell 153.19.48.254
14:49:07.877152 IP 153.19.53.136.32772 > 224.0.0.35.45566: UDP, length 100
14:49:07.952413 IP6 fe80::20f:eaff:fe33:1738 > ff02::1:ff02:30: ICMP6, neighbor solicitation, who has 2001:503:231d::2:30, length 32
14:49:07.976409 IP6 fe80::20f:eaff:fe33:1738 > ff02::1:ff00:1: ICMP6, neighbor solicitation, who has 2001:dc7:1000::1, length 32
14:49:08.015646 IP 153.19.48.3.1088 > 234.8.7.1.1088: UDP, length 64
14:49:08.033650 arp who-has 153.19.49.203 tell 153.19.49.200
14:49:08.040293 arp who-has 153.19.49.236 tell 153.19.49.200
14:49:08.125219 IP6 fe80::20f:eaff:fe33:1738 > ff02::1:ff53:1: ICMP6, neighbor solicitation, who has 2001:7b8:3:1f:0:2:53:1, length 32
14:49:08.347134 arp who-has 153.19.48.25 (ff:ff:ff:ff:ff:ff) tell 153.19.48.52
14:49:08.466386 arp who-has 153.19.49.203 tell 153.19.49.228
14:49:08.472279 arp who-has 153.19.49.236 tell 153.19.49.228
14:49:08.515648 IP 153.19.48.3.1088 > 234.8.7.1.1088: UDP, length 64
14:49:08.523329 IP6 fe80::20f:eaff:fe33:1738 > ff02::1:ff02:30: ICMP6, neighbor solicitation, who has 2001:503:a83e::2:30, length 32
14:49:08.648444 IP 153.19.49.193.138 > 153.19.49.255.138: NBT UDP PACKET(138)
14:49:08.649006 arp who-has 153.19.49.208 tell 153.19.48.254
14:49:08.651017 arp who-has 153.19.48.213 tell 153.19.48.254
14:49:08.976261 IP6 fe80::20f:eaff:fe33:1738 > ff02::1:ff00:1: ICMP6, neighbor solicitation, who has 2001:dc7:1000::1, length 32
14:49:09.015672 IP 153.19.48.3.1088 > 234.8.7.1.1088: UDP, length 64
14:49:09.108779 IP 153.19.48.72.138 > 153.19.48.255.138: NBT UDP PACKET(138)
14:49:09.108782 IP 153.19.48.72.137 > 153.19.48.255.137: NBT UDP PACKET(137): QUERY; REQUEST; BROADCAST
14:49:09.124238 IP6 fe80::20f:eaff:fe33:1738 > ff02::1:ff53:1: ICMP6, neighbor solicitation, who has 2001:7b8:3:1f:0:2:53:1, length 32
14:49:09.182478 AT 255.0.15.6 > 0.0.6:  at-#6 25
14:49:09.441090 IP 153.19.49.228.137 > 153.19.49.255.137: NBT UDP PACKET(137): QUERY; REQUEST; BROADCAST
14:49:09.442035 arp who-has 153.19.49.228 tell 153.19.49.193
14:49:09.512215 IP 153.19.48.3.1066 > 255.255.255.255.5200: UDP, length 21
14:49:09.515649 IP 153.19.48.3.1088 > 234.8.7.1.1088: UDP, length 64
14:49:09.523178 IP6 fe80::20f:eaff:fe33:1738 > ff02::1:ff02:30: ICMP6, neighbor solicitation, who has 2001:503:a83e::2:30, length 32
14:49:09.524229 IP6 fe80::20f:eaff:fe33:1738 > ff02::1:ff02:30: ICMP6, neighbor solicitation, who has 2001:503:231d::2:30, length 32
14:49:09.648423 IP 153.19.49.193.138 > 153.19.49.255.138: NBT UDP PACKET(138)
14:49:09.766259 arp who-has 153.19.48.158 tell 153.19.48.254
14:49:09.857374 IP 153.19.48.72.137 > 153.19.48.255.137: NBT UDP PACKET(137): QUERY; REQUEST; BROADCAST
14:49:10.015688 IP 153.19.48.3.1088 > 234.8.7.1.1088: UDP, length 64
14:49:10.124091 IP6 fe80::20f:eaff:fe33:1738 > ff02::1:ff53:1: ICMP6, neighbor solicitation, who has 2001:7b8:3:1f:0:2:53:1, length 32
14:49:10.515678 IP 153.19.48.3.1088 > 234.8.7.1.1088: UDP, length 64
14:49:10.524027 IP6 fe80::20f:eaff:fe33:1738 > ff02::1:ff02:30: ICMP6, neighbor solicitation, who has 2001:503:231d::2:30, length 32
14:49:10.607350 IP 153.19.48.72.137 > 153.19.48.255.137: NBT UDP PACKET(137): QUERY; REQUEST; BROADCAST
14:49:10.648419 IP 153.19.49.193.138 > 153.19.49.255.138: NBT UDP PACKET(138)
14:49:10.846688 arp who-has 153.19.49.236 tell 153.19.49.239
14:49:11.015874 IP 153.19.48.3.1088 > 234.8.7.1.1088: UDP, length 64
14:49:11.382647 arp who-has 153.19.48.254 (00:11:85:07:af:00) tell 153.19.48.131
14:49:11.436526 IP6 fe80::20f:eaff:fe33:1738 > ff02::1:ff00:1: ICMP6, neighbor solicitation, who has 2001:500:41::1, length 32
14:49:11.515691 IP 153.19.48.3.1088 > 234.8.7.1.1088: UDP, length 64
14:49:11.523875 IP6 fe80::20f:eaff:fe33:1738 > ff02::1:ff02:30: ICMP6, neighbor solicitation, who has 2001:503:231d::2:30, length 32
14:49:11.648458 IP 153.19.49.193.138 > 153.19.49.255.138: NBT UDP PACKET(138)
14:49:12.015724 IP 153.19.48.3.1088 > 234.8.7.1.1088: UDP, length 64
14:49:12.126847 IP6 fe80::20f:eaff:fe33:1738 > ff02::1:ff53:1: ICMP6, neighbor solicitation, who has 2001:7b8:3:1f:0:2:53:1, length 32
14:49:12.140294 arp who-has 153.19.53.190 (00:11:85:07:af:00) tell 153.19.53.182
14:49:12.418985 arp who-has 192.168.0.162 tell 192.168.0.105
14:49:12.435740 IP6 fe80::20f:eaff:fe33:1738 > ff02::1:ff00:1: ICMP6, neighbor solicitation, who has 2001:500:41::1, length 32
14:49:12.515719 IP 153.19.48.3.1088 > 234.8.7.1.1088: UDP, length 64
14:49:12.670860 arp who-has 153.19.48.254 (00:11:85:07:af:00) tell 153.19.48.127
14:49:13.015732 IP 153.19.48.3.1088 > 234.8.7.1.1088: UDP, length 64
14:49:13.026560 arp who-has 153.19.53.200 tell 153.19.48.254
14:49:13.126640 IP6 fe80::20f:eaff:fe33:1738 > ff02::1:ff53:1: ICMP6, neighbor solicitation, who has 2001:7b8:3:1f:0:2:53:1, length 32
14:49:13.252181 arp who-has 153.19.53.120 tell 153.19.48.254
14:49:13.263799 arp who-has 153.19.48.169 tell 153.19.48.254
14:49:13.320529 IP6 fe80::6169:a19e:f835:443.546 > ff02::1:2.547: dhcp6 solicit
14:49:13.358606 IP 153.19.48.72.138 > 153.19.48.255.138: NBT UDP PACKET(138)
14:49:13.358608 IP 153.19.48.72.137 > 153.19.48.255.137: NBT UDP PACKET(137): QUERY; REQUEST; BROADCAST
14:49:13.435591 IP6 fe80::20f:eaff:fe33:1738 > ff02::1:ff00:1: ICMP6, neighbor solicitation, who has 2001:500:41::1, length 32
14:49:13.436649 IP6 fe80::20f:eaff:fe33:1738 > ff02::1:ff00:1: ICMP6, neighbor solicitation, who has 2001:500:49::1, length 32
14:49:13.515747 IP 153.19.48.3.1088 > 234.8.7.1.1088: UDP, length 64
14:49:14.015779 IP 153.19.48.3.1088 > 234.8.7.1.1088: UDP, length 64
14:49:14.107272 IP 153.19.48.72.137 > 153.19.48.255.137: NBT UDP PACKET(137): QUERY; REQUEST; BROADCAST
14:49:14.126491 IP6 fe80::20f:eaff:fe33:1738 > ff02::1:ff53:1: ICMP6, neighbor solicitation, who has 2001:7b8:3:1f:0:2:53:1, length 32
14:49:14.436440 IP6 fe80::20f:eaff:fe33:1738 > ff02::1:ff00:1: ICMP6, neighbor solicitation, who has 2001:500:49::1, length 32
14:49:14.515145 IP 153.19.48.3.1066 > 255.255.255.255.5200: UDP, length 21
14:49:14.515724 IP 153.19.48.3.1088 > 234.8.7.1.1088: UDP, length 64
14:49:14.615770 arp who-has 153.19.48.106 tell 153.19.48.254
14:49:14.664812 arp who-has 153.19.49.236 tell 153.19.49.233
14:49:14.857252 IP 153.19.48.72.137 > 153.19.48.255.137: NBT UDP PACKET(137): QUERY; REQUEST; BROADCAST
14:49:14.965290 00:1b:3f:e0:b5:ed > 01:80:c2:00:00:0e, ethertype Unknown (0x88cc), length 171: 
	0x0000:  0207 0400 1b3f e0b5 c004 0307 3139 0602  .....?......19..
	0x0010:  0078 0802 3139 0a0c 6f6b 6f31 3531 2d7a  .x..19..oko151-z
	0x0020:  6f72 7a61 0c56 5072 6f43 7572 7665 204a  orza.VProCurve.J
	0x0030:  3439 3030 4220 5377 6974 6368 2032 3632  4900B.Switch.262
	0x0040:  362c 2072 6576 6973 696f 6e20            6,.revision.
14:49:15.015749 IP 153.19.48.3.1088 > 234.8.7.1.1088: UDP, length 64
14:49:15.436296 IP6 fe80::20f:eaff:fe33:1738 > ff02::1:ff00:1: ICMP6, neighbor solicitation, who has 2001:500:49::1, length 32
14:49:15.515762 IP 153.19.48.3.1088 > 234.8.7.1.1088: UDP, length 64
14:49:16.015776 IP 153.19.48.3.1088 > 234.8.7.1.1088: UDP, length 64
14:49:16.128246 IP6 fe80::20f:eaff:fe33:1738 > ff02::1:ff53:1: ICMP6, neighbor solicitation, who has 2001:7b8:3:1f:0:2:53:1, length 32
14:49:16.515758 IP 153.19.48.3.1088 > 234.8.7.1.1088: UDP, length 64
14:49:16.680742 arp who-has 153.19.49.7 tell 153.19.49.35
14:49:16.738978 arp who-has 153.19.50.126 (00:11:85:07:af:00) tell 153.19.50.118
14:49:16.777091 IP 153.19.53.136.32773 > 224.0.0.35.45566: UDP, length 101
14:49:17.015823 IP 153.19.48.3.1088 > 234.8.7.1.1088: UDP, length 64
14:49:17.128042 IP6 fe80::20f:eaff:fe33:1738 > ff02::1:ff53:1: ICMP6, neighbor solicitation, who has 2001:7b8:3:1f:0:2:53:1, length 32
14:49:17.347113 arp who-has 153.19.53.168 tell 153.19.48.254
14:49:17.356856 IP 153.19.53.136.32772 > 224.0.0.35.45566: UDP, length 100
14:49:17.449524 IP 192.168.0.1.67 > 255.255.255.255.68: BOOTP/DHCP, Reply, length 305
14:49:17.515783 IP 153.19.48.3.1088 > 234.8.7.1.1088: UDP, length 64
14:49:17.607649 IP 153.19.48.72.138 > 153.19.48.255.138: NBT UDP PACKET(138)
14:49:17.607651 IP 153.19.48.72.137 > 153.19.48.255.137: NBT UDP PACKET(137): QUERY; REQUEST; BROADCAST
14:49:17.621407 arp who-has 153.19.53.187 tell 153.19.53.170
14:49:18.015807 IP 153.19.48.3.1088 > 234.8.7.1.1088: UDP, length 64
14:49:18.059490 IP 153.19.49.39.58916 > 239.255.255.250.1900: UDP, length 138
14:49:18.068453 arp who-has 153.19.49.39 tell 153.19.48.254
14:49:18.127892 IP6 fe80::20f:eaff:fe33:1738 > ff02::1:ff53:1: ICMP6, neighbor solicitation, who has 2001:7b8:3:1f:0:2:53:1, length 32
14:49:18.178980 IP 153.19.49.39.58916 > 239.255.255.250.1900: UDP, length 138
14:49:18.263717 arp who-has 153.19.53.200 tell 153.19.48.254
14:49:18.357154 IP 153.19.48.72.137 > 153.19.48.255.137: NBT UDP PACKET(137): QUERY; REQUEST; BROADCAST
14:49:18.363180 IP6 fe80::20f:eaff:fe33:1738 > ff02::1:ff00:1: ICMP6, neighbor solicitation, who has 2001:dc7::1, length 32
14:49:18.515831 IP 153.19.48.3.1088 > 234.8.7.1.1088: UDP, length 64
14:49:18.622327 arp who-has 153.19.53.190 tell 153.19.53.132
14:49:18.923733 arp who-has 153.19.48.100 tell 153.19.48.254
14:49:19.015846 IP 153.19.48.3.1088 > 234.8.7.1.1088: UDP, length 64
14:49:19.107142 IP 153.19.48.72.137 > 153.19.48.255.137: NBT UDP PACKET(137): QUERY; REQUEST; BROADCAST
14:49:19.362706 IP6 fe80::20f:eaff:fe33:1738 > ff02::1:ff00:1: ICMP6, neighbor solicitation, who has 2001:dc7::1, length 32
14:49:19.515452 IP 153.19.48.3.1066 > 255.255.255.255.5200: UDP, length 21
14:49:19.515774 IP 153.19.48.3.1088 > 234.8.7.1.1088: UDP, length 64
14:49:19.632423 arp who-has 153.19.49.202 tell 153.19.48.254
14:49:19.968045 arp who-has 153.19.49.25 tell 153.19.49.15
14:49:20.016261 IP 153.19.48.3.1088 > 234.8.7.1.1088: UDP, length 64
14:49:20.129651 IP6 fe80::20f:eaff:fe33:1738 > ff02::1:ff53:1: ICMP6, neighbor solicitation, who has 2001:7b8:3:1f:0:2:53:1, length 32
14:49:20.362554 IP6 fe80::20f:eaff:fe33:1738 > ff02::1:ff00:1: ICMP6, neighbor solicitation, who has 2001:dc7::1, length 32
14:49:20.502866 arp who-has 153.19.53.254 tell 153.19.53.215
14:49:20.515825 IP 153.19.48.3.1088 > 234.8.7.1.1088: UDP, length 64
14:49:21.015847 IP 153.19.48.3.1088 > 234.8.7.1.1088: UDP, length 64
14:49:21.098857 arp who-has 153.19.48.213 (ff:ff:ff:ff:ff:ff) tell 153.19.48.52
14:49:21.129440 IP6 fe80::20f:eaff:fe33:1738 > ff02::1:ff53:1: ICMP6, neighbor solicitation, who has 2001:7b8:3:1f:0:2:53:1, length 32
14:49:21.515860 IP 153.19.48.3.1088 > 234.8.7.1.1088: UDP, length 64
14:49:21.589772 arp who-has 153.19.48.158 tell 153.19.48.213
14:49:21.857178 IP 153.19.48.72.137 > 153.19.48.255.137: NBT UDP PACKET(137): QUERY; REQUEST; BROADCAST
14:49:22.015869 IP 153.19.48.3.1088 > 234.8.7.1.1088: UDP, length 64
14:49:22.021754 arp who-has 153.19.49.48 (00:02:d1:05:6f:c2) tell 153.19.49.48
14:49:22.129292 IP6 fe80::20f:eaff:fe33:1738 > ff02::1:ff53:1: ICMP6, neighbor solicitation, who has 2001:7b8:3:1f:0:2:53:1, length 32
14:49:22.364308 IP6 fe80::20f:eaff:fe33:1738 > ff02::1:ff00:1: ICMP6, neighbor solicitation, who has 2001:dc7:1000::1, length 32
14:49:22.397520 arp who-has 153.19.48.254 (00:11:85:07:af:00) tell 153.19.48.126
14:49:22.415760 IPX 00000000.00:00:74:d4:03:c5.4100 > 00000000.ff:ff:ff:ff:ff:ff.0452: ipx-sap-nearest-req 0004
14:49:22.515889 IP 153.19.48.3.1088 > 234.8.7.1.1088: UDP, length 64
14:49:22.607046 IP 153.19.48.72.137 > 153.19.48.255.137: NBT UDP PACKET(137): QUERY; REQUEST; BROADCAST
14:49:22.834145 IP6 fe80::20f:eaff:fe33:1738 > ff02::1:ff00:1: ICMP6, neighbor solicitation, who has 2001:dc7::1, length 32
14:49:22.929144 IP 153.19.53.230.137 > 153.19.53.255.137: NBT UDP PACKET(137): QUERY; REQUEST; BROADCAST
14:49:23.016002 IP 153.19.48.3.1088 > 234.8.7.1.1088: UDP, length 64
14:49:23.119780 (NOV-ETHII) IPX 00000000.00:00:74:d4:03:c5.4100 > 00000000.ff:ff:ff:ff:ff:ff.0452: ipx-sap-nearest-req 0004
14:49:23.357042 IP 153.19.48.72.137 > 153.19.48.255.137: NBT UDP PACKET(137): QUERY; REQUEST; BROADCAST
14:49:23.364106 IP6 fe80::20f:eaff:fe33:1738 > ff02::1:ff00:1: ICMP6, neighbor solicitation, who has 2001:dc7:1000::1, length 32
14:49:23.515867 IP 153.19.48.3.1088 > 234.8.7.1.1088: UDP, length 64
14:49:23.678072 IP 153.19.53.230.137 > 153.19.53.255.137: NBT UDP PACKET(137): QUERY; REQUEST; BROADCAST
14:49:23.833034 IP6 fe80::20f:eaff:fe33:1738 > ff02::1:ff00:1: ICMP6, neighbor solicitation, who has 2001:dc7::1, length 32
14:49:23.917812 arp who-has 153.19.49.254 tell 153.19.49.239
14:49:24.016740 IP 153.19.48.3.1088 > 234.8.7.1.1088: UDP, length 64
14:49:24.125213 (NOV-ETHII) IPX 00000000.00:00:74:d4:03:c5.4100 > 00000000.ff:ff:ff:ff:ff:ff.0452: ipx-sap-nearest-req 0004
14:49:24.131038 IP6 fe80::20f:eaff:fe33:1738 > ff02::1:ff53:1: ICMP6, neighbor solicitation, who has 2001:7b8:3:1f:0:2:53:1, length 32
14:49:24.363954 IP6 fe80::20f:eaff:fe33:1738 > ff02::1:ff00:1: ICMP6, neighbor solicitation, who has 2001:dc7:1000::1, length 32
14:49:24.428123 IP 153.19.53.230.137 > 153.19.53.255.137: NBT UDP PACKET(137): QUERY; REQUEST; BROADCAST
14:49:24.473477 IP6 fe80::20f:eaff:fe33:1738 > ff02::1:ff02:30: ICMP6, neighbor solicitation, who has 2001:503:a83e::2:30, length 32
14:49:24.511583 IP 153.19.48.3.1066 > 255.255.255.255.5200: UDP, length 21
14:49:24.516878 IP 153.19.48.3.1088 > 234.8.7.1.1088: UDP, length 64
14:49:24.591044 arp who-has 153.19.53.164 tell 153.19.48.254
14:49:24.832882 IP6 fe80::20f:eaff:fe33:1738 > ff02::1:ff00:1: ICMP6, neighbor solicitation, who has 2001:dc7::1, length 32
14:49:25.016871 IP 153.19.48.3.1088 > 234.8.7.1.1088: UDP, length 64
14:49:25.130739 IPX 00000000.00:00:74:d4:03:c5.4100 > 00000000.ff:ff:ff:ff:ff:ff.0452: ipx-sap-nearest-req 0004
14:49:25.130838 IP6 fe80::20f:eaff:fe33:1738 > ff02::1:ff53:1: ICMP6, neighbor solicitation, who has 2001:7b8:3:1f:0:2:53:1, length 32
14:49:25.387684 arp who-has 153.19.48.1 tell 153.19.48.254
14:49:25.446469 IP 153.19.53.136.32773 > 224.0.0.35.45566: UDP, length 101
14:49:25.472786 IP6 fe80::20f:eaff:fe33:1738 > ff02::1:ff02:30: ICMP6, neighbor solicitation, who has 2001:503:a83e::2:30, length 32
14:49:25.516905 IP 153.19.48.3.1088 > 234.8.7.1.1088: UDP, length 64
14:49:25.682918 IP 153.19.48.72.427 > 224.0.1.60.427: UDP, length 44
14:49:25.769869 arp who-has 153.19.48.72 tell 153.19.48.191
14:49:25.791605 arp who-has 153.19.48.52 tell 153.19.48.191
14:49:25.794306 arp who-has 192.168.0.112 tell 192.168.0.1
14:49:25.896667 IP 153.19.53.136.32772 > 224.0.0.35.45566: UDP, length 100
14:49:25.944427 arp who-has 153.19.53.254 tell 153.19.53.180
14:49:26.016935 IP 153.19.48.3.1088 > 234.8.7.1.1088: UDP, length 64
14:49:26.130690 IP6 fe80::20f:eaff:fe33:1738 > ff02::1:ff53:1: ICMP6, neighbor solicitation, who has 2001:7b8:3:1f:0:2:53:1, length 32
14:49:26.136402 IPX 00000000.00:00:74:d4:03:c5.4100 > 00000000.ff:ff:ff:ff:ff:ff.0452: ipx-sap-nearest-req 0004
14:49:26.345181 arp who-has 153.19.48.254 (00:11:85:07:af:00) tell 153.19.48.131
14:49:26.472636 IP6 fe80::20f:eaff:fe33:1738 > ff02::1:ff02:30: ICMP6, neighbor solicitation, who has 2001:503:a83e::2:30, length 32
14:49:26.473683 IP6 fe80::20f:eaff:fe33:1738 > ff02::1:ff02:30: ICMP6, neighbor solicitation, who has 2001:503:231d::2:30, length 32
14:49:26.516992 IP 153.19.48.3.1088 > 234.8.7.1.1088: UDP, length 64
14:49:26.663274 IPX 00000000.00:04:76:eb:a1:94.0455 > 00000000.ff:ff:ff:ff:ff:ff.0455: ipx-netbios 50
14:49:26.817896 IP 153.19.49.25.123 > 224.0.1.1.123: NTPv3, Broadcast, length 48
14:49:26.835630 IP6 fe80::20f:eaff:fe33:1738 > ff02::1:ff00:1: ICMP6, neighbor solicitation, who has 2001:dc7:1000::1, length 32
14:49:27.016893 IP 153.19.48.3.1088 > 234.8.7.1.1088: UDP, length 64
14:49:27.102810 arp who-has 153.19.53.190 (00:11:85:07:af:00) tell 153.19.53.182
14:49:27.141809 (NOV-ETHII) IPX 00000000.00:00:74:d4:03:c5.4100 > 00000000.ff:ff:ff:ff:ff:ff.0452: ipx-sap-nearest-req 0004
14:49:27.473489 IP6 fe80::20f:eaff:fe33:1738 > ff02::1:ff02:30: ICMP6, neighbor solicitation, who has 2001:503:231d::2:30, length 32
14:49:27.516886 IP 153.19.48.3.1088 > 234.8.7.1.1088: UDP, length 64
14:49:27.538285 IPX 00000000.00:04:76:eb:a1:94.0455 > 00000000.ff:ff:ff:ff:ff:ff.0455: ipx-netbios 50
14:49:27.584001 IP6 fe80::20f:eaff:fe33:1738 > ff02::1:ff01:2: ICMP6, neighbor solicitation, who has 2001:660:3005:1::1:2, length 32
14:49:27.633393 arp who-has 153.19.48.254 (00:11:85:07:af:00) tell 153.19.48.127
14:49:27.835438 IP6 fe80::20f:eaff:fe33:1738 > ff02::1:ff00:1: ICMP6, neighbor solicitation, who has 2001:dc7:1000::1, length 32
14:49:28.002581 IP 153.19.49.203.427 > 224.0.1.35.427: UDP, length 34
14:49:28.002971 IP 153.19.49.203.427 > 224.0.1.22.427: UDP, length 30
14:49:28.016930 IP 153.19.48.3.1088 > 234.8.7.1.1088: UDP, length 64
14:49:28.078746 arp who-has 153.19.53.187 tell 153.19.53.170
14:49:28.132452 IP6 fe80::20f:eaff:fe33:1738 > ff02::1:ff53:1: ICMP6, neighbor solicitation, who has 2001:7b8:3:1f:0:2:53:1, length 32
14:49:28.147353 (NOV-ETHII) IPX 00000000.00:00:74:d4:03:c5.4100 > 00000000.ff:ff:ff:ff:ff:ff.0452: ipx-sap-nearest-req 0004
14:49:28.262158 arp who-has 153.19.53.159 tell 153.19.48.254
14:49:28.262609 IP 153.19.53.190 > 153.19.53.159: ICMP host 153.19.53.200 unreachable, length 36
14:49:28.414845 IPX 00000000.00:04:76:eb:a1:94.0455 > 00000000.ff:ff:ff:ff:ff:ff.0455: ipx-netbios 50
14:49:28.473335 IP6 fe80::20f:eaff:fe33:1738 > ff02::1:ff02:30: ICMP6, neighbor solicitation, who has 2001:503:231d::2:30, length 32
14:49:28.517020 IP 153.19.48.3.1088 > 234.8.7.1.1088: UDP, length 64
14:49:28.583316 IP6 fe80::20f:eaff:fe33:1738 > ff02::1:ff01:2: ICMP6, neighbor solicitation, who has 2001:660:3005:1::1:2, length 32
14:49:28.645734 arp who-has 153.19.49.208 tell 153.19.48.254
14:49:28.835288 IP6 fe80::20f:eaff:fe33:1738 > ff02::1:ff00:1: ICMP6, neighbor solicitation, who has 2001:dc7:1000::1, length 32
14:49:29.016942 IP 153.19.48.3.1088 > 234.8.7.1.1088: UDP, length 64
14:49:29.132242 IP6 fe80::20f:eaff:fe33:1738 > ff02::1:ff53:1: ICMP6, neighbor solicitation, who has 2001:7b8:3:1f:0:2:53:1, length 32
14:49:29.152989 IPX 00000000.00:00:74:d4:03:c5.4100 > 00000000.ff:ff:ff:ff:ff:ff.0452: ipx-sap-nearest-req 0004
14:49:29.513250 IP 153.19.48.3.1066 > 255.255.255.255.5200: UDP, length 21
14:49:29.516913 IP 153.19.48.3.1088 > 234.8.7.1.1088: UDP, length 64
14:49:29.583169 IP6 fe80::20f:eaff:fe33:1738 > ff02::1:ff01:2: ICMP6, neighbor solicitation, who has 2001:660:3005:1::1:2, length 32
14:49:30.016958 IP 153.19.48.3.1088 > 234.8.7.1.1088: UDP, length 64
14:49:30.132093 IP6 fe80::20f:eaff:fe33:1738 > ff02::1:ff53:1: ICMP6, neighbor solicitation, who has 2001:7b8:3:1f:0:2:53:1, length 32
14:49:30.158432 IPX 00000000.00:00:74:d4:03:c5.4100 > 00000000.ff:ff:ff:ff:ff:ff.0452: ipx-sap-nearest-req 0004
14:49:30.372210 arp who-has 153.19.50.126 tell 153.19.50.107
14:49:30.382576 IP 153.19.49.228.138 > 153.19.49.255.138: NBT UDP PACKET(138)
14:49:30.382578 IP 153.19.49.228.137 > 153.19.49.255.137: NBT UDP PACKET(137): QUERY; REQUEST; BROADCAST
14:49:30.384031 IP 153.19.49.193.137 > 153.19.49.255.137: NBT UDP PACKET(137): QUERY; REQUEST; BROADCAST
14:49:30.516954 IP 153.19.48.3.1088 > 234.8.7.1.1088: UDP, length 64
14:49:31.016989 IP 153.19.48.3.1088 > 234.8.7.1.1088: UDP, length 64
14:49:31.132393 IP 153.19.49.228.137 > 153.19.49.255.137: NBT UDP PACKET(137): QUERY; REQUEST; BROADCAST
14:49:31.163948 (NOV-ETHII) IPX 00000000.00:00:74:d4:03:c5.4100 > 00000000.ff:ff:ff:ff:ff:ff.0452: ipx-sap-nearest-req 0004
14:49:31.359964 arp who-has 153.19.53.141 tell 153.19.48.254
14:49:31.433729 IP 153.19.53.19.631 > 153.19.53.255.631: UDP, length 131
14:49:31.516999 IP 153.19.48.3.1088 > 234.8.7.1.1088: UDP, length 64
14:49:31.675165 arp who-has 153.19.53.113 tell 153.19.48.254
14:49:31.763638 arp who-has 153.19.53.190 tell 153.19.53.157
14:49:31.882379 IP 153.19.49.228.137 > 153.19.49.255.137: NBT UDP PACKET(137): QUERY; REQUEST; BROADCAST
14:49:32.016980 IP 153.19.48.3.1088 > 234.8.7.1.1088: UDP, length 64
14:49:32.042023 IP 153.19.49.45.1024 > 239.255.255.250.1900: UDP, length 332
14:49:32.133847 IP6 fe80::20f:eaff:fe33:1738 > ff02::1:ff53:1: ICMP6, neighbor solicitation, who has 2001:7b8:3:1f:0:2:53:1, length 32
14:49:32.169605 (NOV-ETHII) IPX 00000000.00:00:74:d4:03:c5.4100 > 00000000.ff:ff:ff:ff:ff:ff.0452: ipx-sap-nearest-req 0004
14:49:32.517005 IP 153.19.48.3.1088 > 234.8.7.1.1088: UDP, length 64
14:49:32.604347 IP6 fe80::20f:eaff:fe33:1738 > ff02::1:ff00:140: ICMP6, neighbor solicitation, who has 2001:dc0:1:0:4777::140, length 32
14:49:32.633181 IP 153.19.49.228.138 > 153.19.49.255.138: NBT UDP PACKET(138)
14:49:32.633183 IP 153.19.49.228.137 > 153.19.49.255.137: NBT UDP PACKET(137): QUERY; REQUEST; BROADCAST
14:49:33.016963 IP 153.19.48.3.1088 > 234.8.7.1.1088: UDP, length 64
14:49:33.133641 IP6 fe80::20f:eaff:fe33:1738 > ff02::1:ff53:1: ICMP6, neighbor solicitation, who has 2001:7b8:3:1f:0:2:53:1, length 32
14:49:33.175034 IPX 00000000.00:00:74:d4:03:c5.4100 > 00000000.ff:ff:ff:ff:ff:ff.0452: ipx-sap-nearest-req 0004
14:49:33.382424 IP 153.19.49.228.137 > 153.19.49.255.137: NBT UDP PACKET(137): QUERY; REQUEST; BROADCAST
14:49:33.517015 IP 153.19.48.3.1088 > 234.8.7.1.1088: UDP, length 64
14:49:33.603569 IP6 fe80::20f:eaff:fe33:1738 > ff02::1:ff00:140: ICMP6, neighbor solicitation, who has 2001:dc0:1:0:4777::140, length 32
14:49:34.017002 IP 153.19.48.3.1088 > 234.8.7.1.1088: UDP, length 64
14:49:34.132484 IP 153.19.49.228.137 > 153.19.49.255.137: NBT UDP PACKET(137): QUERY; REQUEST; BROADCAST
14:49:34.133489 IP6 fe80::20f:eaff:fe33:1738 > ff02::1:ff53:1: ICMP6, neighbor solicitation, who has 2001:7b8:3:1f:0:2:53:1, length 32
14:49:34.134553 IP6 fe80::20f:eaff:fe33:1738 > ff02::1:ff53:2: ICMP6, neighbor solicitation, who has 2001:7b8:3:1f:0:2:53:2, length 32
14:49:34.213871 arp reply 153.19.49.25 is-at 00:03:ba:18:6f:d8
14:49:34.515427 IP 153.19.48.3.1066 > 255.255.255.255.5200: UDP, length 21
14:49:34.516951 IP 153.19.48.3.1088 > 234.8.7.1.1088: UDP, length 64
14:49:34.603420 IP6 fe80::20f:eaff:fe33:1738 > ff02::1:ff00:140: ICMP6, neighbor solicitation, who has 2001:dc0:1:0:4777::140, length 32
14:49:34.604477 IP6 fe80::20f:eaff:fe33:1738 > ff02::1:ff00:10: ICMP6, neighbor solicitation, who has 2001:13c7:7002:3000::10, length 32
14:49:34.738522 arp who-has 153.19.50.126 (00:11:85:07:af:00) tell 153.19.50.118
14:49:34.776056 IP 153.19.53.136.32772 > 224.0.0.35.45566: UDP, length 100
14:49:35.016999 IP 153.19.48.3.1088 > 234.8.7.1.1088: UDP, length 64
14:49:35.134341 IP6 fe80::20f:eaff:fe33:1738 > ff02::1:ff53:2: ICMP6, neighbor solicitation, who has 2001:7b8:3:1f:0:2:53:2, length 32
14:49:35.517005 IP 153.19.48.3.1088 > 234.8.7.1.1088: UDP, length 64
14:49:35.604269 IP6 fe80::20f:eaff:fe33:1738 > ff02::1:ff00:10: ICMP6, neighbor solicitation, who has 2001:13c7:7002:3000::10, length 32
14:49:35.633590 arp who-has 153.19.53.126 tell 153.19.53.105
14:49:35.906790 IP6 fe80::20f:eaff:fe33:1738 > ff02::1:ff19:ea45: ICMP6, neighbor solicitation, who has 2a01:e0b:1:83:2e0:f4ff:fe19:ea45, length 32
14:49:36.017028 IP 153.19.48.3.1088 > 234.8.7.1.1088: UDP, length 64
14:49:36.117523 IP 172.20.0.17.138 > 172.20.0.255.138: NBT UDP PACKET(138)
14:49:36.134190 IP6 fe80::20f:eaff:fe33:1738 > ff02::1:ff53:2: ICMP6, neighbor solicitation, who has 2001:7b8:3:1f:0:2:53:2, length 32
14:49:36.135986 IP 153.19.53.136.32773 > 224.0.0.35.45566: UDP, length 101
14:49:36.517068 IP 153.19.48.3.1088 > 234.8.7.1.1088: UDP, length 64
14:49:36.604120 IP6 fe80::20f:eaff:fe33:1738 > ff02::1:ff00:10: ICMP6, neighbor solicitation, who has 2001:13c7:7002:3000::10, length 32
14:49:36.691143 IP6 fe80::20f:eaff:fe33:1738 > ff02::1:ff53:1: ICMP6, neighbor solicitation, who has 2001:7b8:3:1f:0:2:53:1, length 32
14:49:36.812807 IPX 00000000.00:1e:8c:68:6b:c4.0553 > 00000000.ff:ff:ff:ff:ff:ff.0553: ipx-nwlink-dgm 187
14:49:36.828269 IPX 00000000.00:1e:8c:68:6b:c4.0455 > 00000000.ff:ff:ff:ff:ff:ff.0455: ipx-netbios 50
14:49:36.906071 IP6 fe80::20f:eaff:fe33:1738 > ff02::1:ff19:ea45: ICMP6, neighbor solicitation, who has 2a01:e0b:1:83:2e0:f4ff:fe19:ea45, length 32
14:49:37.017037 IP 153.19.48.3.1088 > 234.8.7.1.1088: UDP, length 64
14:49:37.145871 arp who-has 153.19.49.202 tell 153.19.48.254
14:49:37.360043 arp who-has 153.19.48.254 (00:11:85:07:af:00) tell 153.19.48.126
14:49:37.517061 IP 153.19.48.3.1088 > 234.8.7.1.1088: UDP, length 64
14:49:37.690955 IP6 fe80::20f:eaff:fe33:1738 > ff02::1:ff53:1: ICMP6, neighbor solicitation, who has 2001:7b8:3:1f:0:2:53:1, length 32
14:49:37.703292 IPX 00000000.00:1e:8c:68:6b:c4.0455 > 00000000.ff:ff:ff:ff:ff:ff.0455: ipx-netbios 50
14:49:37.905922 IP6 fe80::20f:eaff:fe33:1738 > ff02::1:ff19:ea45: ICMP6, neighbor solicitation, who has 2a01:e0b:1:83:2e0:f4ff:fe19:ea45, length 32
14:49:38.017072 IP 153.19.48.3.1088 > 234.8.7.1.1088: UDP, length 64
14:49:38.079062 arp who-has 153.19.53.187 tell 153.19.53.170
14:49:38.137435 IP 153.19.49.5.138 > 153.19.49.63.138: NBT UDP PACKET(138)
14:49:38.207586 arp who-has 153.19.49.25 (ff:ff:ff:ff:ff:ff) tell 153.19.49.25
14:49:38.517129 IP 153.19.48.3.1088 > 234.8.7.1.1088: UDP, length 64
14:49:38.578321 IPX 00000000.00:1e:8c:68:6b:c4.0455 > 00000000.ff:ff:ff:ff:ff:ff.0455: ipx-netbios 50
14:49:38.690805 IP6 fe80::20f:eaff:fe33:1738 > ff02::1:ff53:1: ICMP6, neighbor solicitation, who has 2001:7b8:3:1f:0:2:53:1, length 32
14:49:38.691891 IP6 fe80::20f:eaff:fe33:1738 > ff02::1:ff53:2: ICMP6, neighbor solicitation, who has 2001:7b8:3:1f:0:2:53:2, length 32
14:49:39.017083 IP 153.19.48.3.1088 > 234.8.7.1.1088: UDP, length 64
14:49:39.453405 IPX 00000000.00:1e:8c:68:6b:c4.0455 > 00000000.ff:ff:ff:ff:ff:ff.0455: ipx-netbios 153
>>> IPX transport Data: (34 bytes)
[000] 00 0B 4B 42 20 20 20 20  20 20 20 20 20 20 20 20  \000\013KB             
[010] 20 20 4B 41 53 4B 20 20  20 20 20 20 20 20 20 20    KASK           
[020] 20 1E                                              \036 
[|SMB]

14:49:39.453773 IP 153.19.53.48.138 > 153.19.53.63.138: NBT UDP PACKET(138)
14:49:39.512472 AT 255.0.15.6 > 0.0.6:  at-#6 25
14:49:39.514436 IP 153.19.48.3.1066 > 255.255.255.255.5200: UDP, length 21
14:49:39.517064 IP 153.19.48.3.1088 > 234.8.7.1.1088: UDP, length 64
14:49:39.691654 IP6 fe80::20f:eaff:fe33:1738 > ff02::1:ff53:2: ICMP6, neighbor solicitation, who has 2001:7b8:3:1f:0:2:53:2, length 32
14:49:39.793177 IP 153.19.49.5.137 > 153.19.49.63.137: NBT UDP PACKET(137): QUERY; REQUEST; BROADCAST
14:49:39.793286 arp who-has 153.19.49.5 tell 153.19.49.17
14:49:39.796640 arp who-has 153.19.49.17 tell 153.19.49.5
14:49:40.017097 IP 153.19.48.3.1088 > 234.8.7.1.1088: UDP, length 64
14:49:40.517142 IP 153.19.48.3.1088 > 234.8.7.1.1088: UDP, length 64
14:49:40.691508 IP6 fe80::20f:eaff:fe33:1738 > ff02::1:ff53:2: ICMP6, neighbor solicitation, who has 2001:7b8:3:1f:0:2:53:2, length 32
14:49:41.017106 IP 153.19.48.3.1088 > 234.8.7.1.1088: UDP, length 64
14:49:41.307725 arp who-has 153.19.48.254 (00:11:85:07:af:00) tell 153.19.48.131
14:49:41.517100 IP 153.19.48.3.1088 > 234.8.7.1.1088: UDP, length 64
14:49:41.682830 IP 153.19.49.193.137 > 153.19.49.255.137: NBT UDP PACKET(137): QUERY; REQUEST; BROADCAST
14:49:41.742451 IP6 fe80::20f:eaff:fe33:1738 > ff02::1:ff53:1: ICMP6, neighbor solicitation, who has 2001:7b8:3:1f:0:2:53:1, length 32
14:49:42.017121 IP 153.19.48.3.1088 > 234.8.7.1.1088: UDP, length 64
14:49:42.065358 arp who-has 153.19.53.190 (00:11:85:07:af:00) tell 153.19.53.182
14:49:42.428969 IP 153.19.49.193.137 > 153.19.49.255.137: NBT UDP PACKET(137): QUERY; REQUEST; BROADCAST
14:49:42.518057 IP 153.19.48.3.1088 > 234.8.7.1.1088: UDP, length 64
14:49:42.543044 arp who-has 153.19.48.130 tell 153.19.48.254
14:49:42.595927 arp who-has 153.19.48.254 (00:11:85:07:af:00) tell 153.19.48.127
14:49:42.645942 IP 153.19.53.136.32773 > 224.0.0.35.45566: UDP, length 101
14:49:42.742198 IP6 fe80::20f:eaff:fe33:1738 > ff02::1:ff53:1: ICMP6, neighbor solicitation, who has 2001:7b8:3:1f:0:2:53:1, length 32
14:49:42.828309 arp who-has 153.19.48.8 tell 153.19.48.254
14:49:43.021063 IP 153.19.48.3.1088 > 234.8.7.1.1088: UDP, length 64
14:49:43.044374 arp who-has 153.19.53.200 tell 153.19.48.254
14:49:43.056188 arp who-has 153.19.48.30 tell 153.19.48.254
14:49:43.120309 arp who-has 153.19.50.81 tell 153.19.48.254
14:49:43.178945 IP 153.19.49.193.137 > 153.19.49.255.137: NBT UDP PACKET(137): QUERY; REQUEST; BROADCAST
14:49:43.521719 IP 153.19.48.3.1088 > 234.8.7.1.1088: UDP, length 64
14:49:43.742048 IP6 fe80::20f:eaff:fe33:1738 > ff02::1:ff53:1: ICMP6, neighbor solicitation, who has 2001:7b8:3:1f:0:2:53:1, length 32
14:49:44.021058 IP 153.19.48.3.1088 > 234.8.7.1.1088: UDP, length 64
14:49:44.143364 arp who-has 153.19.53.6 tell 153.19.48.254
14:49:44.145320 arp who-has 153.19.53.62 tell 153.19.53.6
14:49:44.420296 arp who-has 153.19.53.158 tell 153.19.48.254
14:49:44.465617 IP 153.19.53.136.32772 > 224.0.0.35.45566: UDP, length 100
14:49:44.511842 IP 153.19.48.3.1066 > 255.255.255.255.5200: UDP, length 21
14:49:44.521335 IP 153.19.48.3.1088 > 234.8.7.1.1088: UDP, length 64
14:49:44.895416 arp who-has 153.19.48.107 tell 153.19.48.254
14:49:44.985968 00:1b:3f:e0:b5:ed > 01:80:c2:00:00:0e, ethertype Unknown (0x88cc), length 171: 
	0x0000:  0207 0400 1b3f e0b5 c004 0307 3139 0602  .....?......19..
	0x0010:  0078 0802 3139 0a0c 6f6b 6f31 3531 2d7a  .x..19..oko151-z
	0x0020:  6f72 7a61 0c56 5072 6f43 7572 7665 204a  orza.VProCurve.J
	0x0030:  3439 3030 4220 5377 6974 6368 2032 3632  4900B.Switch.262
	0x0040:  362c 2072 6576 6973 696f 6e20            6,.revision.
14:49:45.021071 IP 153.19.48.3.1088 > 234.8.7.1.1088: UDP, length 64
14:49:45.320658 IP6 fe80::6169:a19e:f835:443.546 > ff02::1:2.547: dhcp6 solicit
14:49:45.521518 IP 153.19.48.3.1088 > 234.8.7.1.1088: UDP, length 64
14:49:45.743795 IP6 fe80::20f:eaff:fe33:1738 > ff02::1:ff53:1: ICMP6, neighbor solicitation, who has 2001:7b8:3:1f:0:2:53:1, length 32
14:49:45.808544 arp who-has 153.19.48.120 tell 153.19.48.254
14:49:46.021089 IP 153.19.48.3.1088 > 234.8.7.1.1088: UDP, length 64
14:49:46.052041 arp who-has 153.19.53.140 tell 153.19.48.254
14:49:46.058837 arp who-has 153.19.53.48 tell 153.19.48.254
14:49:46.222348 IP 153.19.49.48.1900 > 239.255.255.250.1900: UDP, length 249
14:49:46.222458 IP 153.19.49.48.1900 > 239.255.255.250.1900: UDP, length 249
14:49:46.222605 IP 153.19.49.48.1900 > 239.255.255.250.1900: UDP, length 246
14:49:46.222665 IP 153.19.49.48.1900 > 239.255.255.250.1900: UDP, length 246
14:49:46.222823 IP 153.19.49.48.1900 > 239.255.255.250.1900: UDP, length 253
14:49:46.222883 IP 153.19.49.48.1900 > 239.255.255.250.1900: UDP, length 253
14:49:46.464944 arp who-has 153.19.49.28 tell 153.19.48.254
14:49:46.521135 IP 153.19.48.3.1088 > 234.8.7.1.1088: UDP, length 64
14:49:46.743598 IP6 fe80::20f:eaff:fe33:1738 > ff02::1:ff53:1: ICMP6, neighbor solicitation, who has 2001:7b8:3:1f:0:2:53:1, length 32
14:49:46.955510 arp who-has 153.19.48.1 tell 153.19.48.151
14:49:47.021104 IP 153.19.48.3.1088 > 234.8.7.1.1088: UDP, length 64
14:49:47.521128 IP 153.19.48.3.1088 > 234.8.7.1.1088: UDP, length 64
14:49:47.621952 arp who-has 153.19.49.48 (00:02:d1:05:6f:c2) tell 153.19.49.48
14:49:47.743451 IP6 fe80::20f:eaff:fe33:1738 > ff02::1:ff53:1: ICMP6, neighbor solicitation, who has 2001:7b8:3:1f:0:2:53:1, length 32
14:49:48.021114 IP 153.19.48.3.1088 > 234.8.7.1.1088: UDP, length 64
14:49:48.263051 arp who-has 153.19.53.200 tell 153.19.48.254
14:49:48.468632 IP 153.19.48.167.138 > 153.19.48.255.138: NBT UDP PACKET(138)
14:49:48.488843 IP 153.19.48.167.137 > 153.19.48.255.137: NBT UDP PACKET(137): RELEASE; REQUEST; BROADCAST
14:49:48.521770 IP 153.19.48.3.1088 > 234.8.7.1.1088: UDP, length 64
14:49:48.647112 arp who-has 153.19.49.208 tell 153.19.48.254
14:49:48.925290 arp who-has 192.168.0.212 tell 192.168.0.1
14:49:48.931000 IP 192.168.0.212.137 > 192.168.0.255.137: NBT UDP PACKET(137): QUERY; REQUEST; BROADCAST
14:49:48.933045 arp who-has 192.168.0.212 (00:80:77:8b:97:6d) tell 192.168.0.151
14:49:49.000495 arp who-has 153.19.53.176 tell 153.19.48.254
14:49:49.009536 arp who-has 153.19.48.68 tell 153.19.48.254
14:49:49.021140 IP 153.19.48.3.1088 > 234.8.7.1.1088: UDP, length 64
14:49:49.048305 IP 153.19.48.167.137 > 153.19.48.255.137: NBT UDP PACKET(137): RELEASE; REQUEST; BROADCAST
14:49:49.093155 arp who-has 192.168.0.162 tell 192.168.0.1
14:49:49.160929 arp who-has 153.19.48.254 tell 153.19.48.60
14:49:49.514462 IP 153.19.48.3.1066 > 255.255.255.255.5200: UDP, length 21
14:49:49.521092 IP 153.19.48.3.1088 > 234.8.7.1.1088: UDP, length 64
14:49:49.695500 IP 153.19.48.167.137 > 153.19.48.255.137: NBT UDP PACKET(137): RELEASE; REQUEST; BROADCAST
14:49:49.695664 IP 153.19.48.167.137 > 153.19.48.255.137: NBT UDP PACKET(137): RELEASE; REQUEST; BROADCAST
14:49:49.695796 IP 153.19.48.167.137 > 153.19.48.255.137: NBT UDP PACKET(137): RELEASE; REQUEST; BROADCAST
14:49:49.695928 IP 153.19.48.167.137 > 153.19.48.255.137: NBT UDP PACKET(137): RELEASE; REQUEST; BROADCAST
14:49:49.696055 IP 153.19.48.167.137 > 153.19.48.255.137: NBT UDP PACKET(137): RELEASE; REQUEST; BROADCAST
14:49:49.745213 IP6 fe80::20f:eaff:fe33:1738 > ff02::1:ff53:1: ICMP6, neighbor solicitation, who has 2001:7b8:3:1f:0:2:53:1, length 32
14:49:50.021189 IP 153.19.48.3.1088 > 234.8.7.1.1088: UDP, length 64
14:49:50.164353 IP 153.19.53.230.137 > 153.19.53.255.137: NBT UDP PACKET(137): QUERY; REQUEST; BROADCAST
14:49:50.204066 IP6 fe80::20f:eaff:fe33:1738 > ff02::1:ff00:13: ICMP6, neighbor solicitation, who has 2001:4f8:0:2::13, length 32
14:49:50.521211 IP 153.19.48.3.1088 > 234.8.7.1.1088: UDP, length 64
14:49:50.744997 IP6 fe80::20f:eaff:fe33:1738 > ff02::1:ff53:1: ICMP6, neighbor solicitation, who has 2001:7b8:3:1f:0:2:53:1, length 32
14:49:50.773199 IP 153.19.53.105.138 > 153.19.53.127.138: NBT UDP PACKET(138)
14:49:50.914294 IP 153.19.53.230.137 > 153.19.53.255.137: NBT UDP PACKET(137): QUERY; REQUEST; BROADCAST
14:49:51.021196 IP 153.19.48.3.1088 > 234.8.7.1.1088: UDP, length 64
14:49:51.202931 IP6 fe80::20f:eaff:fe33:1738 > ff02::1:ff00:13: ICMP6, neighbor solicitation, who has 2001:4f8:0:2::13, length 32
14:49:51.375307 IP6 fe80::20f:eaff:fe33:1738 > ff02::1:ff00:10: ICMP6, neighbor solicitation, who has 2001:608:6:6::10, length 32
14:49:51.521301 IP 153.19.48.3.1088 > 234.8.7.1.1088: UDP, length 64
14:49:51.664325 IP 153.19.53.230.137 > 153.19.53.255.137: NBT UDP PACKET(137): QUERY; REQUEST; BROADCAST
14:49:51.744846 IP6 fe80::20f:eaff:fe33:1738 > ff02::1:ff53:1: ICMP6, neighbor solicitation, who has 2001:7b8:3:1f:0:2:53:1, length 32
14:49:52.021183 IP 153.19.48.3.1088 > 234.8.7.1.1088: UDP, length 64
14:49:52.202786 IP6 fe80::20f:eaff:fe33:1738 > ff02::1:ff00:13: ICMP6, neighbor solicitation, who has 2001:4f8:0:2::13, length 32
14:49:52.204855 IP6 fe80::20f:eaff:fe33:1738 > ff02::1:ff00:1: ICMP6, neighbor solicitation, who has 2001:500:83::1, length 32
14:49:52.322569 arp who-has 153.19.48.254 (00:11:85:07:af:00) tell 153.19.48.126
14:49:52.374750 IP6 fe80::20f:eaff:fe33:1738 > ff02::1:ff00:10: ICMP6, neighbor solicitation, who has 2001:608:6:6::10, length 32
14:49:52.521615 IP 153.19.48.3.1088 > 234.8.7.1.1088: UDP, length 64
14:49:52.738070 arp who-has 153.19.50.126 (00:11:85:07:af:00) tell 153.19.50.118
14:49:53.021242 IP 153.19.48.3.1088 > 234.8.7.1.1088: UDP, length 64
14:49:53.044986 arp who-has 153.19.53.200 tell 153.19.48.254
14:49:53.045260 IP 153.19.53.136.32773 > 224.0.0.35.45566: UDP, length 101
14:49:53.060198 arp who-has 153.19.48.41 tell 153.19.48.254
14:49:53.204634 IP6 fe80::20f:eaff:fe33:1738 > ff02::1:ff00:1: ICMP6, neighbor solicitation, who has 2001:500:83::1, length 32
14:49:53.374600 IP6 fe80::20f:eaff:fe33:1738 > ff02::1:ff00:10: ICMP6, neighbor solicitation, who has 2001:608:6:6::10, length 32
14:49:53.375653 IP6 fe80::20f:eaff:fe33:1738 > ff02::1:ff00:53: ICMP6, neighbor solicitation, who has 2001:628:453:4905::53, length 32
14:49:53.505599 IPX 00000000.00:40:af:7d:6f:6a.0452 > 00000000.ff:ff:ff:ff:ff:ff.0452: ipx-sap-resp 0414 'RDP_C20522-W95_PEER_PRINTER[|ipx 64]
14:49:53.521297 IP 153.19.48.3.1088 > 234.8.7.1.1088: UDP, length 64
14:49:53.713341 IPX 00000000.00:40:af:7d:6f:6a.0452 > 00000000.ff:ff:ff:ff:ff:ff.0452: ipx-sap-resp 0414 'RDP_C20522[|ipx 64]
14:49:53.746585 IP6 fe80::20f:eaff:fe33:1738 > ff02::1:ff53:1: ICMP6, neighbor solicitation, who has 2001:7b8:3:1f:0:2:53:1, length 32
14:49:53.904959 IP6 fe80::7561:762:b2a0:9d6f.51268 > ff02::1:3.5355: UDP, length 22
14:49:53.905111 IP 153.19.49.26.58571 > 224.0.0.252.5355: UDP, length 22
14:49:53.905704 IPX 00000000.00:40:af:7d:6f:6a.0452 > 00000000.ff:ff:ff:ff:ff:ff.0452: ipx-sap-resp 0414 'RDP_C20522-HTML[|ipx 64]
14:49:53.942766 arp who-has 153.19.49.202 tell 153.19.48.254
14:49:54.004484 IP6 fe80::7561:762:b2a0:9d6f.51268 > ff02::1:3.5355: UDP, length 22
14:49:54.004531 IP 153.19.49.26.58571 > 224.0.0.252.5355: UDP, length 22
14:49:54.011251 arp who-has 153.19.53.218 tell 153.19.48.254
14:49:54.021260 IP 153.19.48.3.1088 > 234.8.7.1.1088: UDP, length 64
14:49:54.204485 IP6 fe80::20f:eaff:fe33:1738 > ff02::1:ff00:1: ICMP6, neighbor solicitation, who has 2001:500:83::1, length 32
14:49:54.204731 IP 153.19.49.26.137 > 153.19.49.63.137: NBT UDP PACKET(137): QUERY; REQUEST; BROADCAST
14:49:54.375455 IP6 fe80::20f:eaff:fe33:1738 > ff02::1:ff00:53: ICMP6, neighbor solicitation, who has 2001:628:453:4905::53, length 32
14:49:54.512907 IP 153.19.48.3.1066 > 255.255.255.255.5200: UDP, length 21
14:49:54.521341 IP 153.19.48.3.1088 > 234.8.7.1.1088: UDP, length 64
14:49:54.665109 IP 153.19.53.136.32772 > 224.0.0.35.45566: UDP, length 100
14:49:54.746397 IP6 fe80::20f:eaff:fe33:1738 > ff02::1:ff53:1: ICMP6, neighbor solicitation, who has 2001:7b8:3:1f:0:2:53:1, length 32
14:49:54.865219 IP 192.168.0.1.67 > 255.255.255.255.68: BOOTP/DHCP, Reply, length 305
14:49:54.954499 IP 153.19.49.26.137 > 153.19.49.63.137: NBT UDP PACKET(137): QUERY; REQUEST; BROADCAST
14:49:55.021207 IP 153.19.48.3.1088 > 234.8.7.1.1088: UDP, length 64
14:49:55.375306 IP6 fe80::20f:eaff:fe33:1738 > ff02::1:ff00:53: ICMP6, neighbor solicitation, who has 2001:628:453:4905::53, length 32
14:49:55.493978 arp who-has 153.19.53.126 tell 153.19.53.164
14:49:55.521230 IP 153.19.48.3.1088 > 234.8.7.1.1088: UDP, length 64
14:49:55.538175 IPX 00000000.00:04:76:eb:a1:94.0455 > 00000000.ff:ff:ff:ff:ff:ff.0455: ipx-netbios 50
14:49:55.650800 arp who-has 153.19.48.72 tell 153.19.48.254
14:49:55.704549 IP 153.19.49.26.137 > 153.19.49.63.137: NBT UDP PACKET(137): QUERY; REQUEST; BROADCAST
14:49:55.746246 IP6 fe80::20f:eaff:fe33:1738 > ff02::1:ff53:1: ICMP6, neighbor solicitation, who has 2001:7b8:3:1f:0:2:53:1, length 32
14:49:55.804650 arp reply 153.19.49.25 is-at 00:03:ba:18:6f:d8
14:49:56.021256 IP 153.19.48.3.1088 > 234.8.7.1.1088: UDP, length 64
14:49:56.171376 arp who-has 153.19.49.25 tell 153.19.49.17
14:49:56.270275 arp who-has 153.19.48.254 (00:11:85:07:af:00) tell 153.19.48.131
14:49:56.413183 IPX 00000000.00:04:76:eb:a1:94.0455 > 00000000.ff:ff:ff:ff:ff:ff.0455: ipx-netbios 50
14:49:56.470647 IP6 fe80::7561:762:b2a0:9d6f.54971 > ff02::1:3.5355: UDP, length 22
14:49:56.470802 IP 153.19.49.26.52995 > 224.0.0.252.5355: UDP, length 22

