17:38:54.210646 IP 91.197.13.71.8074 > 192.168.1.100.36897: Flags [P.], seq 3069068876:3069068903, ack 3697058355, win 548, length 27
17:38:54.210686 IP 192.168.1.100.36897 > 91.197.13.71.8074: Flags [.], ack 27, win 445, length 0
17:38:54.299710 IP 192.168.1.100.44958 > 192.168.1.254.53: 33209+ AAAA? api.gadu-gadu.pl. (34)
17:38:54.301521 IP 192.168.1.254.53 > 192.168.1.100.44958: 33209 0/1/0 (79)
17:38:54.308888 IP 192.168.1.100.56136 > 192.168.1.254.53: 7410+ AAAA? api.gadu-gadu.pl. (34)
17:38:54.310760 IP 192.168.1.254.53 > 192.168.1.100.56136: 7410 0/1/0 (79)
17:38:54.311513 IP 192.168.1.100.43106 > 192.168.1.254.53: 61250+ A? api.gadu-gadu.pl. (34)
17:38:54.313006 IP 192.168.1.254.53 > 192.168.1.100.43106: 61250 2/2/0 A[|domain]
17:38:54.379817 IP 192.168.1.100.60632 > 91.197.13.248.80: Flags [S], seq 145433597, win 5840, options [mss 1460,sackOK,TS val 113198251 ecr 0,nop,wscale 6], length 0
17:38:54.397277 IP 91.197.13.248.80 > 192.168.1.100.60632: Flags [S.], seq 1019828729, ack 145433598, win 5840, options [mss 1460,nop,nop,sackOK,nop,wscale 4], length 0
17:38:54.397331 IP 192.168.1.100.60632 > 91.197.13.248.80: Flags [.], ack 1, win 92, length 0
17:38:54.397561 IP 192.168.1.100.60632 > 91.197.13.248.80: Flags [P.], seq 1:167, ack 1, win 92, length 166
17:38:54.413750 IP 91.197.13.248.80 > 192.168.1.100.60632: Flags [.], ack 167, win 432, length 0
17:38:54.437747 IP 91.197.13.248.80 > 192.168.1.100.60632: Flags [P.], seq 1:693, ack 167, win 432, length 692
17:38:54.437782 IP 192.168.1.100.60632 > 91.197.13.248.80: Flags [.], ack 693, win 113, length 0
17:38:54.438401 IP 91.197.13.248.80 > 192.168.1.100.60632: Flags [F.], seq 693, ack 167, win 432, length 0
17:38:54.438837 IP 192.168.1.100.60632 > 91.197.13.248.80: Flags [F.], seq 167, ack 694, win 113, length 0
17:38:54.459132 IP 91.197.13.248.80 > 192.168.1.100.60632: Flags [.], ack 168, win 432, length 0
17:38:54.495244 IP 192.168.1.100.56371 > 92.123.69.195.80: Flags [F.], seq 3543844682, ack 1856932144, win 119, options [nop,nop,TS val 113198280 ecr 2088946261], length 0
17:38:54.534327 IP 92.123.69.195.80 > 192.168.1.100.56371: Flags [.], ack 1, win 3216, options [nop,nop,TS val 2088953698 ecr 113198280], length 0
17:38:57.734101 IP 192.168.1.100.58372 > 69.63.178.116.80: Flags [F.], seq 3664459519, ack 17500200, win 5840, length 0
17:38:57.743030 IP 192.168.1.100.58892 > 192.168.1.254.53: 21664+ AAAA? www.szybowce.com. (34)
17:38:57.998341 IP 69.63.178.116.80 > 192.168.1.100.58372: Flags [.], ack 1, win 10220, length 0
17:38:58.320725 IP 91.197.13.71.8074 > 192.168.1.100.36897: Flags [P.], seq 27:69, ack 1, win 548, length 42
17:38:58.320760 IP 192.168.1.100.36897 > 91.197.13.71.8074: Flags [.], ack 69, win 445, length 0
17:38:58.432595 IP 192.168.1.100.49476 > 192.168.1.254.53: 35776+ AAAA? api.gadu-gadu.pl. (34)
17:38:58.434410 IP 192.168.1.254.53 > 192.168.1.100.49476: 35776 0/1/0 (79)
17:38:58.435877 IP 192.168.1.100.57655 > 192.168.1.254.53: 54591+ AAAA? api.gadu-gadu.pl. (34)
17:38:58.437714 IP 192.168.1.254.53 > 192.168.1.100.57655: 54591 0/1/0 (79)
17:38:58.439662 IP 192.168.1.100.54572 > 192.168.1.254.53: 21317+ A? api.gadu-gadu.pl. (34)
17:38:58.441162 IP 192.168.1.254.53 > 192.168.1.100.54572: 21317 2/2/0 A[|domain]
17:38:58.557360 IP 192.168.1.100.60633 > 91.197.13.248.80: Flags [S], seq 207576524, win 5840, options [mss 1460,sackOK,TS val 113199295 ecr 0,nop,wscale 6], length 0
17:38:58.581783 IP 91.197.13.248.80 > 192.168.1.100.60633: Flags [S.], seq 1022923750, ack 207576525, win 5840, options [mss 1460,nop,nop,sackOK,nop,wscale 4], length 0
17:38:58.581837 IP 192.168.1.100.60633 > 91.197.13.248.80: Flags [.], ack 1, win 92, length 0
17:38:58.582978 IP 192.168.1.100.60633 > 91.197.13.248.80: Flags [P.], seq 1:167, ack 1, win 92, length 166
17:38:58.599560 IP 91.197.13.248.80 > 192.168.1.100.60633: Flags [.], ack 167, win 432, length 0
17:38:58.640914 IP 91.197.13.248.80 > 192.168.1.100.60633: Flags [P.], seq 1:693, ack 167, win 432, length 692
17:38:58.640988 IP 192.168.1.100.60633 > 91.197.13.248.80: Flags [.], ack 693, win 113, length 0
17:38:58.657259 IP 91.197.13.248.80 > 192.168.1.100.60633: Flags [F.], seq 693, ack 167, win 432, length 0
17:38:58.668806 IP 192.168.1.100.60633 > 91.197.13.248.80: Flags [F.], seq 167, ack 694, win 113, length 0
17:38:58.683834 IP 91.197.13.248.80 > 192.168.1.100.60633: Flags [.], ack 168, win 432, length 0
17:39:00.238874 IP 69.63.178.116.80 > 192.168.1.100.58372: Flags [P.], seq 186:211, ack 1, win 10220, length 25
17:39:00.238910 IP 192.168.1.100.58372 > 69.63.178.116.80: Flags [R], seq 3664459520, win 0, length 0
17:39:00.243615 IP 69.63.178.116.80 > 192.168.1.100.58372: Flags [P.], seq 1:186, ack 1, win 10220, length 185
17:39:00.243653 IP 192.168.1.100.58372 > 69.63.178.116.80: Flags [R], seq 3664459520, win 0, length 0
17:39:00.244270 IP 69.63.178.116.80 > 192.168.1.100.58372: Flags [F.], seq 211, ack 1, win 10220, length 0
17:39:00.244284 IP 192.168.1.100.58372 > 69.63.178.116.80: Flags [R], seq 3664459520, win 0, length 0
17:39:01.009283 IP 192.168.1.100.47147 > 192.168.1.254.53: 26296+ AAAA? www.erg.abdn.ac.uk. (36)
17:39:01.011095 IP 192.168.1.254.53 > 192.168.1.100.47147: 26296 2/3/1 CNAME[|domain]
17:39:01.012673 IP 192.168.1.100.36576 > 192.168.1.254.53: 18721+ A? www.erg.abdn.ac.uk. (36)
17:39:01.014523 IP 192.168.1.254.53 > 192.168.1.100.36576: 18721 2/3/1 CNAME[|domain]
17:39:02.753177 IP 192.168.1.100.58892 > 192.168.1.254.53: 21664+ AAAA? www.szybowce.com. (34)
17:39:07.758332 IP 192.168.1.100.36464 > 192.168.1.254.53: 30750+ AAAA? www.szybowce.com. (34)
17:39:09.870944 IP 192.168.1.100.58388 > 69.63.178.116.80: Flags [S], seq 396887796, win 5840, options [mss 1460,sackOK,TS val 113202124 ecr 0,nop,wscale 6], length 0
17:39:10.088176 IP 69.63.178.116.80 > 192.168.1.100.58388: Flags [S.], seq 1537610039, ack 396887797, win 5840, options [mss 1460], length 0
17:39:10.088228 IP 192.168.1.100.58388 > 69.63.178.116.80: Flags [.], ack 1, win 5840, length 0
17:39:10.088423 IP 192.168.1.100.58388 > 69.63.178.116.80: Flags [.], seq 1:1461, ack 1, win 5840, length 1460
17:39:10.088436 IP 192.168.1.100.58388 > 69.63.178.116.80: Flags [P.], seq 1461:1775, ack 1, win 5840, length 314
17:39:10.302958 IP 69.63.178.116.80 > 192.168.1.100.58388: Flags [.], ack 1461, win 8760, length 0
17:39:10.307089 IP 69.63.178.116.80 > 192.168.1.100.58388: Flags [.], ack 1775, win 10220, length 0
17:39:10.307127 IP 69.63.178.116.80 > 192.168.1.100.58388: Flags [P.], seq 186:210, ack 1775, win 10220, length 24
17:39:10.307146 IP 192.168.1.100.58388 > 69.63.178.116.80: Flags [.], ack 1, win 5840, length 0
17:39:10.308349 IP 69.63.178.116.80 > 192.168.1.100.58388: Flags [P.], seq 1:186, ack 1775, win 10220, length 185
17:39:10.308371 IP 192.168.1.100.58388 > 69.63.178.116.80: Flags [.], ack 210, win 6432, length 0
17:39:10.308615 IP 192.168.1.100.58388 > 69.63.178.116.80: Flags [F.], seq 1775, ack 210, win 6432, length 0
17:39:10.309167 IP 69.63.178.116.80 > 192.168.1.100.58388: Flags [F.], seq 210, ack 1775, win 10220, length 0
17:39:10.309190 IP 192.168.1.100.58388 > 69.63.178.116.80: Flags [.], ack 211, win 6432, length 0
17:39:10.523525 IP 69.63.178.116.80 > 192.168.1.100.58388: Flags [.], ack 1776, win 10220, length 0
17:39:11.105053 IP 92.123.69.176.80 > 192.168.1.100.38147: Flags [F.], seq 1870731827, ack 3540154311, win 3216, options [nop,nop,TS val 2456178478 ecr 113183980], length 0
17:39:11.105106 IP 92.123.69.176.80 > 192.168.1.100.38151: Flags [F.], seq 1873066506, ack 3544626843, win 3216, options [nop,nop,TS val 2456178483 ecr 113183980], length 0
17:39:11.142788 IP 192.168.1.100.38147 > 92.123.69.176.80: Flags [.], ack 1, win 182, options [nop,nop,TS val 113202442 ecr 2456178478], length 0
17:39:11.142802 IP 192.168.1.100.38151 > 92.123.69.176.80: Flags [.], ack 1, win 135, options [nop,nop,TS val 113202442 ecr 2456178483], length 0
17:39:12.761813 IP 192.168.1.100.36464 > 192.168.1.254.53: 30750+ AAAA? www.szybowce.com. (34)
17:39:17.765842 IP 192.168.1.100.44746 > 192.168.1.254.53: 32708+ A? www.szybowce.com. (34)
17:39:17.774523 IP 192.168.1.254.53 > 192.168.1.100.44746: 32708 1/2/2 A[|domain]
17:39:17.774867 IP 192.168.1.100.56884 > 85.232.234.98.80: Flags [S], seq 515198073, win 5840, options [mss 1460,sackOK,TS val 113204100 ecr 0,nop,wscale 6], length 0
17:39:17.799751 IP 85.232.234.98.80 > 192.168.1.100.56884: Flags [S.], seq 840373352, ack 515198074, win 5792, options [mss 1460,sackOK,TS val 133037594 ecr 113204100,nop,wscale 6], length 0
17:39:17.799821 IP 192.168.1.100.56884 > 85.232.234.98.80: Flags [.], ack 1, win 92, options [nop,nop,TS val 113204106 ecr 133037594], length 0
17:39:17.800068 IP 192.168.1.100.56884 > 85.232.234.98.80: Flags [P.], seq 1:578, ack 1, win 92, options [nop,nop,TS val 113204106 ecr 133037594], length 577
17:39:17.831049 IP 85.232.234.98.80 > 192.168.1.100.56884: Flags [.], ack 578, win 109, options [nop,nop,TS val 133037600 ecr 113204106], length 0
17:39:19.212705 IP 85.232.234.98.80 > 192.168.1.100.56884: Flags [P.], seq 1:498, ack 578, win 109, options [nop,nop,TS val 133037946 ecr 113204106], length 497
17:39:19.212754 IP 192.168.1.100.56884 > 85.232.234.98.80: Flags [.], ack 498, win 108, options [nop,nop,TS val 113204459 ecr 133037946], length 0
17:39:19.219408 IP 85.232.234.98.80 > 192.168.1.100.56884: Flags [P.], seq 498:687, ack 578, win 109, options [nop,nop,TS val 133037946 ecr 113204106], length 189
17:39:19.219448 IP 192.168.1.100.56884 > 85.232.234.98.80: Flags [.], ack 687, win 125, options [nop,nop,TS val 113204461 ecr 133037946], length 0
17:39:19.242373 IP 85.232.234.98.80 > 192.168.1.100.56884: Flags [P.], seq 687:1427, ack 578, win 109, options [nop,nop,TS val 133037953 ecr 113204459], length 740
17:39:19.242420 IP 192.168.1.100.56884 > 85.232.234.98.80: Flags [.], ack 1427, win 148, options [nop,nop,TS val 113204466 ecr 133037953], length 0
17:39:19.242431 IP 85.232.234.98.80 > 192.168.1.100.56884: Flags [P.], seq 1474:1750, ack 578, win 109, options [nop,nop,TS val 133037954 ecr 113204461], length 276
17:39:19.242447 IP 192.168.1.100.56884 > 85.232.234.98.80: Flags [.], ack 1427, win 148, options [nop,nop,TS val 113204466 ecr 133037953,nop,nop,sack 1 {1474:1750}], length 0
17:39:19.247035 IP 85.232.234.98.80 > 192.168.1.100.56884: Flags [P.], seq 1427:1474, ack 578, win 109, options [nop,nop,TS val 133037953 ecr 113204459], length 47
17:39:19.247079 IP 192.168.1.100.56884 > 85.232.234.98.80: Flags [.], ack 1750, win 148, options [nop,nop,TS val 113204468 ecr 133037953], length 0
17:39:19.279004 IP 192.168.1.100.56885 > 85.232.234.98.80: Flags [S], seq 544545141, win 5840, options [mss 1460,sackOK,TS val 113204476 ecr 0,nop,wscale 6], length 0
17:39:19.279079 IP 192.168.1.100.56886 > 85.232.234.98.80: Flags [S], seq 531747098, win 5840, options [mss 1460,sackOK,TS val 113204476 ecr 0,nop,wscale 6], length 0
17:39:19.304599 IP 85.232.234.98.80 > 192.168.1.100.56886: Flags [S.], seq 849752804, ack 531747099, win 5792, options [mss 1460,sackOK,TS val 133037970 ecr 113204476,nop,wscale 6], length 0
17:39:19.304651 IP 192.168.1.100.56886 > 85.232.234.98.80: Flags [.], ack 1, win 92, options [nop,nop,TS val 113204482 ecr 133037970], length 0
17:39:19.304871 IP 192.168.1.100.56886 > 85.232.234.98.80: Flags [P.], seq 1:599, ack 1, win 92, options [nop,nop,TS val 113204482 ecr 133037970], length 598
17:39:19.307477 IP 85.232.234.98.80 > 192.168.1.100.56885: Flags [S.], seq 865014820, ack 544545142, win 5792, options [mss 1460,sackOK,TS val 133037969 ecr 113204476,nop,wscale 6], length 0
17:39:19.307537 IP 192.168.1.100.56885 > 85.232.234.98.80: Flags [.], ack 1, win 92, options [nop,nop,TS val 113204483 ecr 133037969], length 0
17:39:19.309320 IP 192.168.1.100.56885 > 85.232.234.98.80: Flags [P.], seq 1:582, ack 1, win 92, options [nop,nop,TS val 113204483 ecr 133037969], length 581
17:39:19.335531 IP 85.232.234.98.80 > 192.168.1.100.56886: Flags [.], ack 599, win 110, options [nop,nop,TS val 133037977 ecr 113204482], length 0
17:39:19.339840 IP 85.232.234.98.80 > 192.168.1.100.56886: Flags [.], seq 1:1449, ack 599, win 110, options [nop,nop,TS val 133037977 ecr 113204482], length 1448
17:39:19.339875 IP 192.168.1.100.56886 > 85.232.234.98.80: Flags [.], ack 1449, win 137, options [nop,nop,TS val 113204491 ecr 133037977], length 0
17:39:19.340034 IP 85.232.234.98.80 > 192.168.1.100.56886: Flags [.], seq 1449:2897, ack 599, win 110, options [nop,nop,TS val 133037977 ecr 113204482], length 1448
17:39:19.340046 IP 192.168.1.100.56886 > 85.232.234.98.80: Flags [.], ack 2897, win 182, options [nop,nop,TS val 113204491 ecr 133037977], length 0
17:39:19.345300 IP 85.232.234.98.80 > 192.168.1.100.56885: Flags [.], seq 1:1449, ack 582, win 109, options [nop,nop,TS val 133037978 ecr 113204483], length 1448
17:39:19.345359 IP 192.168.1.100.56885 > 85.232.234.98.80: Flags [.], ack 1449, win 137, options [nop,nop,TS val 113204492 ecr 133037978], length 0
17:39:19.346237 IP 85.232.234.98.80 > 192.168.1.100.56885: Flags [.], seq 1449:2897, ack 582, win 109, options [nop,nop,TS val 133037978 ecr 113204483], length 1448
17:39:19.346256 IP 192.168.1.100.56885 > 85.232.234.98.80: Flags [.], ack 2897, win 182, options [nop,nop,TS val 113204492 ecr 133037978], length 0
17:39:19.346473 IP 85.232.234.98.80 > 192.168.1.100.56885: Flags [.], ack 582, win 109, options [nop,nop,TS val 133037978 ecr 113204483], length 0
17:39:19.346484 IP 192.168.1.100.56885 > 85.232.234.98.80: Flags [.], ack 2897, win 182, options [nop,nop,TS val 113204492 ecr 133037978], length 0
17:39:19.370800 IP 85.232.234.98.80 > 192.168.1.100.56886: Flags [.], seq 2897:4345, ack 599, win 110, options [nop,nop,TS val 133037985 ecr 113204491], length 1448
17:39:19.370846 IP 192.168.1.100.56886 > 85.232.234.98.80: Flags [.], ack 4345, win 227, options [nop,nop,TS val 113204499 ecr 133037985], length 0
17:39:19.370855 IP 85.232.234.98.80 > 192.168.1.100.56886: Flags [P.], seq 4345:4510, ack 599, win 110, options [nop,nop,TS val 133037985 ecr 113204491], length 165
17:39:19.370866 IP 192.168.1.100.56886 > 85.232.234.98.80: Flags [.], ack 4510, win 273, options [nop,nop,TS val 113204499 ecr 133037985], length 0
17:39:19.376717 IP 85.232.234.98.80 > 192.168.1.100.56885: Flags [P.], seq 2897:4284, ack 582, win 109, options [nop,nop,TS val 133037986 ecr 113204492], length 1387
17:39:19.376767 IP 192.168.1.100.56885 > 85.232.234.98.80: Flags [.], ack 4284, win 227, options [nop,nop,TS val 113204500 ecr 133037986], length 0
17:39:19.391880 IP 192.168.1.100.56886 > 85.232.234.98.80: Flags [P.], seq 599:1210, ack 4510, win 273, options [nop,nop,TS val 113204504 ecr 133037985], length 611
17:39:19.426125 IP 85.232.234.98.80 > 192.168.1.100.56886: Flags [.], seq 4510:5958, ack 1210, win 129, options [nop,nop,TS val 133037998 ecr 113204504], length 1448
17:39:19.432420 IP 85.232.234.98.80 > 192.168.1.100.56886: Flags [.], seq 5958:7406, ack 1210, win 129, options [nop,nop,TS val 133037998 ecr 113204504], length 1448
17:39:19.432464 IP 192.168.1.100.56886 > 85.232.234.98.80: Flags [.], ack 7406, win 363, options [nop,nop,TS val 113204514 ecr 133037998], length 0
17:39:19.437882 IP 85.232.234.98.80 > 192.168.1.100.56886: Flags [.], seq 7406:8854, ack 1210, win 129, options [nop,nop,TS val 133037998 ecr 113204504], length 1448
17:39:19.440228 IP 85.232.234.98.80 > 192.168.1.100.56886: Flags [.], seq 8854:10302, ack 1210, win 129, options [nop,nop,TS val 133037998 ecr 113204504], length 1448
17:39:19.440259 IP 192.168.1.100.56886 > 85.232.234.98.80: Flags [.], ack 10302, win 454, options [nop,nop,TS val 113204516 ecr 133037998], length 0
17:39:19.447798 IP 85.232.234.98.80 > 192.168.1.100.56886: Flags [.], seq 10302:11750, ack 1210, win 129, options [nop,nop,TS val 133037998 ecr 113204504], length 1448
17:39:19.466047 IP 85.232.234.98.80 > 192.168.1.100.56886: Flags [.], seq 11750:13198, ack 1210, win 129, options [nop,nop,TS val 133038008 ecr 113204514], length 1448
17:39:19.466089 IP 192.168.1.100.56886 > 85.232.234.98.80: Flags [.], ack 13198, win 544, options [nop,nop,TS val 113204522 ecr 133037998], length 0
17:39:19.467594 IP 85.232.234.98.80 > 192.168.1.100.56886: Flags [.], seq 13198:14646, ack 1210, win 129, options [nop,nop,TS val 133038008 ecr 113204514], length 1448
17:39:19.468539 IP 85.232.234.98.80 > 192.168.1.100.56886: Flags [.], seq 14646:16094, ack 1210, win 129, options [nop,nop,TS val 133038008 ecr 113204514], length 1448
17:39:19.468566 IP 192.168.1.100.56886 > 85.232.234.98.80: Flags [.], ack 16094, win 635, options [nop,nop,TS val 113204523 ecr 133038008], length 0
17:39:19.472096 IP 85.232.234.98.80 > 192.168.1.100.56886: Flags [P.], seq 16094:17250, ack 1210, win 129, options [nop,nop,TS val 133038009 ecr 113204516], length 1156
17:39:19.510778 IP 192.168.1.100.56886 > 85.232.234.98.80: Flags [.], ack 17250, win 680, options [nop,nop,TS val 113204534 ecr 133038009], length 0
17:39:19.519287 IP 85.232.234.98.80 > 192.168.1.100.56884: Flags [P.], seq 1750:1779, ack 578, win 109, options [nop,nop,TS val 133038022 ecr 113204468], length 29
17:39:19.519316 IP 192.168.1.100.56884 > 85.232.234.98.80: Flags [.], ack 1779, win 148, options [nop,nop,TS val 113204536 ecr 133038022], length 0
17:39:19.535183 IP 85.232.234.98.80 > 192.168.1.100.56884: Flags [P.], seq 1779:1791, ack 578, win 109, options [nop,nop,TS val 133038026 ecr 113204468], length 12
17:39:19.535223 IP 192.168.1.100.56884 > 85.232.234.98.80: Flags [.], ack 1791, win 148, options [nop,nop,TS val 113204540 ecr 133038026], length 0
17:39:19.540607 IP 85.232.234.98.80 > 192.168.1.100.56884: Flags [P.], seq 1791:1829, ack 578, win 109, options [nop,nop,TS val 133038026 ecr 113204468], length 38
17:39:19.540647 IP 192.168.1.100.56884 > 85.232.234.98.80: Flags [.], ack 1829, win 148, options [nop,nop,TS val 113204541 ecr 133038026], length 0
17:39:19.552212 IP 85.232.234.98.80 > 192.168.1.100.56884: Flags [.], seq 1829:3277, ack 578, win 109, options [nop,nop,TS val 133038029 ecr 113204536], length 1448
17:39:19.552253 IP 192.168.1.100.56884 > 85.232.234.98.80: Flags [.], ack 3277, win 194, options [nop,nop,TS val 113204544 ecr 133038029], length 0
17:39:19.559653 IP 192.168.1.100.56885 > 85.232.234.98.80: Flags [P.], seq 582:1179, ack 4284, win 227, options [nop,nop,TS val 113204546 ecr 133037986], length 597
17:39:19.560270 IP 85.232.234.98.80 > 192.168.1.100.56884: Flags [.], seq 3277:4725, ack 578, win 109, options [nop,nop,TS val 133038029 ecr 113204536], length 1448
17:39:19.560298 IP 192.168.1.100.56884 > 85.232.234.98.80: Flags [.], ack 4725, win 239, options [nop,nop,TS val 113204546 ecr 133038029], length 0
17:39:19.568369 IP 85.232.234.98.80 > 192.168.1.100.56884: Flags [.], seq 4725:6173, ack 578, win 109, options [nop,nop,TS val 133038033 ecr 113204540], length 1448
17:39:19.568415 IP 192.168.1.100.56884 > 85.232.234.98.80: Flags [.], ack 6173, win 284, options [nop,nop,TS val 113204548 ecr 133038033], length 0
17:39:19.569076 IP 85.232.234.98.80 > 192.168.1.100.56884: Flags [.], seq 7621:9069, ack 578, win 109, options [nop,nop,TS val 133038035 ecr 113204541], length 1448
17:39:19.569091 IP 192.168.1.100.56884 > 85.232.234.98.80: Flags [.], ack 6173, win 284, options [nop,nop,TS val 113204548 ecr 133038033,nop,nop,sack 1 {7621:9069}], length 0
17:39:19.569758 IP 85.232.234.98.80 > 192.168.1.100.56884: Flags [.], seq 6173:7621, ack 578, win 109, options [nop,nop,TS val 133038035 ecr 113204541], length 1448
17:39:19.569775 IP 192.168.1.100.56884 > 85.232.234.98.80: Flags [.], ack 9069, win 329, options [nop,nop,TS val 113204548 ecr 133038035], length 0
17:39:19.575751 IP 85.232.234.98.80 > 192.168.1.100.56884: Flags [P.], seq 9069:10517, ack 578, win 109, options [nop,nop,TS val 133038035 ecr 113204541], length 1448
17:39:19.575790 IP 192.168.1.100.56884 > 85.232.234.98.80: Flags [.], ack 10517, win 375, options [nop,nop,TS val 113204550 ecr 133038035], length 0
17:39:19.599691 IP 85.232.234.98.80 > 192.168.1.100.56884: Flags [.], seq 10517:11965, ack 578, win 109, options [nop,nop,TS val 133038040 ecr 113204546], length 1448
17:39:19.599735 IP 192.168.1.100.56884 > 85.232.234.98.80: Flags [.], ack 11965, win 420, options [nop,nop,TS val 113204556 ecr 133038040], length 0
17:39:19.600836 IP 85.232.234.98.80 > 192.168.1.100.56884: Flags [.], seq 11965:13413, ack 578, win 109, options [nop,nop,TS val 133038040 ecr 113204546], length 1448
17:39:19.600849 IP 192.168.1.100.56884 > 85.232.234.98.80: Flags [.], ack 13413, win 465, options [nop,nop,TS val 113204556 ecr 133038040], length 0
17:39:19.601937 IP 85.232.234.98.80 > 192.168.1.100.56884: Flags [.], seq 13413:14861, ack 578, win 109, options [nop,nop,TS val 133038040 ecr 113204546], length 1448
17:39:19.601950 IP 192.168.1.100.56884 > 85.232.234.98.80: Flags [.], ack 14861, win 510, options [nop,nop,TS val 113204556 ecr 133038040], length 0
17:39:19.601968 IP 85.232.234.98.80 > 192.168.1.100.56885: Flags [P.], seq 4284:4621, ack 1179, win 128, options [nop,nop,TS val 133038040 ecr 113204546], length 337
17:39:19.601989 IP 192.168.1.100.56885 > 85.232.234.98.80: Flags [.], ack 4621, win 273, options [nop,nop,TS val 113204556 ecr 133038040], length 0
17:39:19.609839 IP 85.232.234.98.80 > 192.168.1.100.56884: Flags [.], seq 14861:16309, ack 578, win 109, options [nop,nop,TS val 133038042 ecr 113204548], length 1448
17:39:19.609893 IP 192.168.1.100.56884 > 85.232.234.98.80: Flags [.], ack 16309, win 556, options [nop,nop,TS val 113204558 ecr 133038042], length 0
17:39:19.610966 IP 85.232.234.98.80 > 192.168.1.100.56884: Flags [.], seq 16309:17757, ack 578, win 109, options [nop,nop,TS val 133038042 ecr 113204548], length 1448
17:39:19.610983 IP 192.168.1.100.56884 > 85.232.234.98.80: Flags [.], ack 17757, win 601, options [nop,nop,TS val 113204559 ecr 133038042], length 0
17:39:19.614119 IP 85.232.234.98.80 > 192.168.1.100.56884: Flags [P.], seq 17757:18467, ack 578, win 109, options [nop,nop,TS val 133038042 ecr 113204548], length 710
17:39:19.614152 IP 192.168.1.100.56884 > 85.232.234.98.80: Flags [.], ack 18467, win 646, options [nop,nop,TS val 113204559 ecr 133038042], length 0
17:39:19.666818 IP 192.168.1.100.43655 > 192.168.1.254.53: 39760+ AAAA? www.google-analytics.com. (42)
17:39:19.668330 IP 192.168.1.254.53 > 192.168.1.100.43655: 39760 1/1/0 (136)
17:39:19.670487 IP 85.232.234.98.80 > 192.168.1.100.56884: Flags [P.], seq 18467:18472, ack 578, win 109, options [nop,nop,TS val 133038060 ecr 113204559], length 5
17:39:19.670520 IP 192.168.1.100.56884 > 85.232.234.98.80: Flags [.], ack 18472, win 646, options [nop,nop,TS val 113204573 ecr 133038060], length 0
17:39:19.677405 IP 192.168.1.100.54033 > 192.168.1.254.53: 33741+ A? www.google-analytics.com. (42)
17:39:19.678954 IP 192.168.1.254.53 > 192.168.1.100.54033: 33741 4/4/0[|domain]
17:39:19.762544 IP 192.168.1.100.56886 > 85.232.234.98.80: Flags [F.], seq 1210, ack 17250, win 680, options [nop,nop,TS val 113204596 ecr 133038009], length 0
17:39:19.762717 IP 192.168.1.100.43790 > 74.125.79.101.80: Flags [S], seq 540299508, win 5840, options [mss 1460,sackOK,TS val 113204596 ecr 0,nop,wscale 6], length 0
17:39:19.791087 IP 85.232.234.98.80 > 192.168.1.100.56886: Flags [F.], seq 17250, ack 1211, win 129, options [nop,nop,TS val 133038090 ecr 113204596], length 0
17:39:19.791132 IP 192.168.1.100.56886 > 85.232.234.98.80: Flags [.], ack 17251, win 680, options [nop,nop,TS val 113204604 ecr 133038090], length 0
17:39:19.824172 IP 74.125.79.101.80 > 192.168.1.100.43790: Flags [S.], seq 1039779751, ack 540299509, win 5672, options [mss 1430,sackOK,TS val 3607032531 ecr 113204596,nop,wscale 6], length 0
17:39:19.824455 IP 192.168.1.100.43790 > 74.125.79.101.80: Flags [.], ack 1, win 92, options [nop,nop,TS val 113204612 ecr 3607032531], length 0
17:39:19.824925 IP 192.168.1.100.43790 > 74.125.79.101.80: Flags [P.], seq 1:908, ack 1, win 92, options [nop,nop,TS val 113204612 ecr 3607032531], length 907
17:39:19.887046 IP 74.125.79.101.80 > 192.168.1.100.43790: Flags [P.], seq 315:350, ack 908, win 117, options [nop,nop,TS val 3607032596 ecr 113204612], length 35
17:39:19.887098 IP 192.168.1.100.43790 > 74.125.79.101.80: Flags [.], ack 1, win 92, options [nop,nop,TS val 113204628 ecr 3607032531,nop,nop,sack 1 {315:350}], length 0
17:39:19.889846 IP 74.125.79.101.80 > 192.168.1.100.43790: Flags [.], ack 908, win 117, options [nop,nop,TS val 3607032595 ecr 113204612], length 0
17:39:19.890167 IP 74.125.79.101.80 > 192.168.1.100.43790: Flags [P.], seq 1:315, ack 908, win 117, options [nop,nop,TS val 3607032596 ecr 113204612], length 314
17:39:19.890193 IP 192.168.1.100.43790 > 74.125.79.101.80: Flags [.], ack 350, win 108, options [nop,nop,TS val 113204628 ecr 3607032596], length 0
17:39:19.903888 IP 192.168.1.100.41289 > 192.168.1.254.53: 45645+ AAAA? www.airitalypolska.com.pl. (43)
17:39:19.904393 IP 192.168.1.100.41677 > 192.168.1.254.53: 23922+ AAAA? www.newsportal.one.pl. (39)
17:39:19.915425 IP 192.168.1.100.56885 > 85.232.234.98.80: Flags [P.], seq 1179:1755, ack 4621, win 273, options [nop,nop,TS val 113204635 ecr 133038040], length 576
17:39:19.942807 IP 192.168.1.254.53 > 192.168.1.100.41289: 45645 1/1/0 (108)
17:39:19.943052 IP 192.168.1.100.39685 > 192.168.1.254.53: 1942+ A? www.airitalypolska.com.pl. (43)
17:39:19.974975 IP 192.168.1.254.53 > 192.168.1.100.39685: 1942 2/2/2[|domain]
17:39:19.987353 IP 85.232.234.98.80 > 192.168.1.100.56885: Flags [.], ack 1755, win 146, options [nop,nop,TS val 133038139 ecr 113204635], length 0
17:39:20.070789 IP 192.168.1.254.53 > 192.168.1.100.41677: 23922 1/1/0 (115)
17:39:20.071023 IP 192.168.1.100.59035 > 192.168.1.254.53: 39593+ A? www.newsportal.one.pl. (39)
17:39:20.133970 IP 192.168.1.254.53 > 192.168.1.100.59035: 39593 2/5/1[|domain]
17:39:21.392202 IP 85.232.234.98.80 > 192.168.1.100.56885: Flags [P.], seq 4621:5259, ack 1755, win 146, options [nop,nop,TS val 133038490 ecr 113204635], length 638
17:39:21.392264 IP 192.168.1.100.56885 > 85.232.234.98.80: Flags [.], ack 5259, win 318, options [nop,nop,TS val 113205004 ecr 133038490], length 0
17:39:21.392271 IP 85.232.234.98.80 > 192.168.1.100.56885: Flags [P.], seq 5542:5561, ack 1755, win 146, options [nop,nop,TS val 133038490 ecr 113204635], length 19
17:39:21.392284 IP 192.168.1.100.56885 > 85.232.234.98.80: Flags [.], ack 5259, win 318, options [nop,nop,TS val 113205004 ecr 133038490,nop,nop,sack 1 {5542:5561}], length 0
17:39:21.392289 IP 85.232.234.98.80 > 192.168.1.100.56885: Flags [P.], seq 5259:5542, ack 1755, win 146, options [nop,nop,TS val 133038490 ecr 113204635], length 283
17:39:21.392302 IP 192.168.1.100.56885 > 85.232.234.98.80: Flags [.], ack 5561, win 363, options [nop,nop,TS val 113205004 ecr 133038490], length 0
17:39:21.425604 IP 85.232.234.98.80 > 192.168.1.100.56885: Flags [.], seq 5561:7009, ack 1755, win 146, options [nop,nop,TS val 133038498 ecr 113205004], length 1448
17:39:21.425650 IP 192.168.1.100.56885 > 85.232.234.98.80: Flags [.], ack 7009, win 408, options [nop,nop,TS val 113205012 ecr 133038498], length 0
17:39:21.430436 IP 85.232.234.98.80 > 192.168.1.100.56885: Flags [.], seq 7009:8457, ack 1755, win 146, options [nop,nop,TS val 133038498 ecr 113205004], length 1448
17:39:21.430471 IP 192.168.1.100.56885 > 85.232.234.98.80: Flags [.], ack 8457, win 454, options [nop,nop,TS val 113205013 ecr 133038498], length 0
17:39:21.430705 IP 85.232.234.98.80 > 192.168.1.100.56885: Flags [.], seq 8457:9905, ack 1755, win 146, options [nop,nop,TS val 133038498 ecr 113205004], length 1448
17:39:21.430713 IP 192.168.1.100.56885 > 85.232.234.98.80: Flags [.], ack 9905, win 499, options [nop,nop,TS val 113205013 ecr 133038498], length 0
17:39:21.430829 IP 85.232.234.98.80 > 192.168.1.100.56885: Flags [.], seq 9905:11353, ack 1755, win 146, options [nop,nop,TS val 133038498 ecr 113205004], length 1448
17:39:21.430839 IP 192.168.1.100.56885 > 85.232.234.98.80: Flags [.], ack 11353, win 544, options [nop,nop,TS val 113205014 ecr 133038498], length 0
17:39:21.433815 IP 85.232.234.98.80 > 192.168.1.100.56885: Flags [.], seq 11353:12801, ack 1755, win 146, options [nop,nop,TS val 133038498 ecr 113205004], length 1448
17:39:21.433853 IP 192.168.1.100.56885 > 85.232.234.98.80: Flags [.], ack 12801, win 589, options [nop,nop,TS val 113205014 ecr 133038498], length 0
17:39:21.466573 IP 85.232.234.98.80 > 192.168.1.100.56885: Flags [.], seq 12801:14249, ack 1755, win 146, options [nop,nop,TS val 133038506 ecr 113205012], length 1448
17:39:21.466623 IP 192.168.1.100.56885 > 85.232.234.98.80: Flags [.], ack 14249, win 635, options [nop,nop,TS val 113205022 ecr 133038506], length 0
17:39:21.497326 IP 85.232.234.98.80 > 192.168.1.100.56885: Flags [.], seq 14249:15697, ack 1755, win 146, options [nop,nop,TS val 133038508 ecr 113205013], length 1448
17:39:21.497383 IP 192.168.1.100.56885 > 85.232.234.98.80: Flags [.], ack 15697, win 680, options [nop,nop,TS val 113205030 ecr 133038508], length 0
17:39:21.498437 IP 85.232.234.98.80 > 192.168.1.100.56885: Flags [.], seq 15697:17145, ack 1755, win 146, options [nop,nop,TS val 133038508 ecr 113205013], length 1448
17:39:21.498451 IP 192.168.1.100.56885 > 85.232.234.98.80: Flags [.], ack 17145, win 725, options [nop,nop,TS val 113205030 ecr 133038508], length 0
17:39:21.500028 IP 85.232.234.98.80 > 192.168.1.100.56885: Flags [.], seq 18593:20041, ack 1755, win 146, options [nop,nop,TS val 133038508 ecr 113205014], length 1448
17:39:21.500064 IP 192.168.1.100.56885 > 85.232.234.98.80: Flags [.], ack 17145, win 725, options [nop,nop,TS val 113205031 ecr 133038508,nop,nop,sack 1 {18593:20041}], length 0
17:39:21.501298 IP 85.232.234.98.80 > 192.168.1.100.56885: Flags [.], seq 17145:18593, ack 1755, win 146, options [nop,nop,TS val 133038508 ecr 113205013], length 1448
17:39:21.501320 IP 192.168.1.100.56885 > 85.232.234.98.80: Flags [.], ack 20041, win 770, options [nop,nop,TS val 113205031 ecr 133038508], length 0
17:39:21.504320 IP 85.232.234.98.80 > 192.168.1.100.56885: Flags [.], seq 20041:21489, ack 1755, win 146, options [nop,nop,TS val 133038508 ecr 113205014], length 1448
17:39:21.504355 IP 192.168.1.100.56885 > 85.232.234.98.80: Flags [.], ack 21489, win 816, options [nop,nop,TS val 113205032 ecr 133038508], length 0
17:39:21.514904 IP 85.232.234.98.80 > 192.168.1.100.56885: Flags [P.], seq 21489:22937, ack 1755, win 146, options [nop,nop,TS val 133038508 ecr 113205014], length 1448
17:39:21.514956 IP 192.168.1.100.56885 > 85.232.234.98.80: Flags [.], ack 22937, win 861, options [nop,nop,TS val 113205035 ecr 133038508], length 0
17:39:21.519835 IP 85.232.234.98.80 > 192.168.1.100.56885: Flags [P.], seq 22937:22994, ack 1755, win 146, options [nop,nop,TS val 133038508 ecr 113205014], length 57
17:39:21.519887 IP 192.168.1.100.56885 > 85.232.234.98.80: Flags [.], ack 22994, win 861, options [nop,nop,TS val 113205036 ecr 133038508], length 0
17:39:21.520748 IP 85.232.234.98.80 > 192.168.1.100.56885: Flags [.], seq 22994:24442, ack 1755, win 146, options [nop,nop,TS val 133038516 ecr 113205022], length 1448
17:39:21.520757 IP 192.168.1.100.56885 > 85.232.234.98.80: Flags [.], ack 24442, win 906, options [nop,nop,TS val 113205036 ecr 133038516], length 0
17:39:21.528269 IP 85.232.234.98.80 > 192.168.1.100.56885: Flags [.], seq 24442:25890, ack 1755, win 146, options [nop,nop,TS val 133038516 ecr 113205022], length 1448
17:39:21.528320 IP 192.168.1.100.56885 > 85.232.234.98.80: Flags [.], ack 25890, win 951, options [nop,nop,TS val 113205038 ecr 133038516], length 0
17:39:21.536892 IP 85.232.234.98.80 > 192.168.1.100.56885: Flags [.], seq 27338:28786, ack 1755, win 146, options [nop,nop,TS val 133038516 ecr 113205022], length 1448
17:39:21.536953 IP 192.168.1.100.56885 > 85.232.234.98.80: Flags [.], ack 25890, win 951, options [nop,nop,TS val 113205040 ecr 133038516,nop,nop,sack 1 {27338:28786}], length 0
17:39:21.546498 IP 85.232.234.98.80 > 192.168.1.100.56885: Flags [.], seq 30234:31682, ack 1755, win 146, options [nop,nop,TS val 133038525 ecr 113205031], length 1448
17:39:21.546543 IP 192.168.1.100.56885 > 85.232.234.98.80: Flags [.], ack 25890, win 951, options [nop,nop,TS val 113205042 ecr 133038516,nop,nop,sack 2 {30234:31682}{27338:28786}], length 0
17:39:21.548477 IP 85.232.234.98.80 > 192.168.1.100.56885: Flags [.], seq 28786:30234, ack 1755, win 146, options [nop,nop,TS val 133038525 ecr 113205031], length 1448
17:39:21.548493 IP 192.168.1.100.56885 > 85.232.234.98.80: Flags [.], ack 25890, win 951, options [nop,nop,TS val 113205043 ecr 133038516,nop,nop,sack 1 {27338:31682}], length 0
17:39:21.550992 IP 85.232.234.98.80 > 192.168.1.100.56885: Flags [.], seq 31682:33130, ack 1755, win 146, options [nop,nop,TS val 133038525 ecr 113205031], length 1448
17:39:21.551020 IP 192.168.1.100.56885 > 85.232.234.98.80: Flags [.], ack 25890, win 951, options [nop,nop,TS val 113205044 ecr 133038516,nop,nop,sack 1 {27338:33130}], length 0
17:39:21.551966 IP 85.232.234.98.80 > 192.168.1.100.56885: Flags [.], seq 33130:34578, ack 1755, win 146, options [nop,nop,TS val 133038528 ecr 113205035], length 1448
17:39:21.551975 IP 192.168.1.100.56885 > 85.232.234.98.80: Flags [.], ack 25890, win 951, options [nop,nop,TS val 113205044 ecr 133038516,nop,nop,sack 1 {27338:34578}], length 0
17:39:21.552979 IP 85.232.234.98.80 > 192.168.1.100.56885: Flags [.], seq 34578:36026, ack 1755, win 146, options [nop,nop,TS val 133038528 ecr 113205035], length 1448
17:39:21.552988 IP 192.168.1.100.56885 > 85.232.234.98.80: Flags [.], ack 25890, win 951, options [nop,nop,TS val 113205044 ecr 133038516,nop,nop,sack 1 {27338:36026}], length 0
17:39:21.554277 IP 85.232.234.98.80 > 192.168.1.100.56885: Flags [.], seq 36026:37474, ack 1755, win 146, options [nop,nop,TS val 133038528 ecr 113205035], length 1448
17:39:21.554290 IP 192.168.1.100.56885 > 85.232.234.98.80: Flags [.], ack 25890, win 951, options [nop,nop,TS val 113205044 ecr 133038516,nop,nop,sack 1 {27338:37474}], length 0
17:39:21.555130 IP 85.232.234.98.80 > 192.168.1.100.56885: Flags [.], seq 37474:38922, ack 1755, win 146, options [nop,nop,TS val 133038528 ecr 113205035], length 1448
17:39:21.555139 IP 192.168.1.100.56885 > 85.232.234.98.80: Flags [.], ack 25890, win 951, options [nop,nop,TS val 113205045 ecr 133038516,nop,nop,sack 1 {27338:38922}], length 0
17:39:21.556385 IP 85.232.234.98.80 > 192.168.1.100.56885: Flags [.], seq 38922:40370, ack 1755, win 146, options [nop,nop,TS val 133038528 ecr 113205035], length 1448
17:39:21.556397 IP 192.168.1.100.56885 > 85.232.234.98.80: Flags [.], ack 25890, win 951, options [nop,nop,TS val 113205045 ecr 133038516,nop,nop,sack 1 {27338:40370}], length 0
17:39:21.559091 IP 85.232.234.98.80 > 192.168.1.100.56885: Flags [.], seq 40370:41818, ack 1755, win 146, options [nop,nop,TS val 133038528 ecr 113205035], length 1448
17:39:21.559124 IP 192.168.1.100.56885 > 85.232.234.98.80: Flags [.], ack 25890, win 951, options [nop,nop,TS val 113205046 ecr 133038516,nop,nop,sack 1 {27338:41818}], length 0
17:39:21.561970 IP 85.232.234.98.80 > 192.168.1.100.56885: Flags [.], seq 41818:43266, ack 1755, win 146, options [nop,nop,TS val 133038532 ecr 113205038], length 1448
17:39:21.562013 IP 192.168.1.100.56885 > 85.232.234.98.80: Flags [.], ack 25890, win 951, options [nop,nop,TS val 113205046 ecr 133038516,nop,nop,sack 1 {27338:43266}], length 0
17:39:21.566134 IP 85.232.234.98.80 > 192.168.1.100.56885: Flags [.], seq 44714:46162, ack 1755, win 146, options [nop,nop,TS val 133038532 ecr 113205038], length 1448
17:39:21.566170 IP 192.168.1.100.56885 > 85.232.234.98.80: Flags [.], ack 25890, win 951, options [nop,nop,TS val 113205047 ecr 133038516,nop,nop,sack 2 {44714:46162}{27338:43266}], length 0
17:39:21.566242 IP 85.232.234.98.80 > 192.168.1.100.56885: Flags [.], seq 43266:44714, ack 1755, win 146, options [nop,nop,TS val 133038532 ecr 113205038], length 1448
17:39:21.566251 IP 192.168.1.100.56885 > 85.232.234.98.80: Flags [.], ack 25890, win 951, options [nop,nop,TS val 113205047 ecr 133038516,nop,nop,sack 1 {27338:46162}], length 0
17:39:21.566366 IP 85.232.234.98.80 > 192.168.1.100.56885: Flags [.], seq 46162:47610, ack 1755, win 146, options [nop,nop,TS val 133038532 ecr 113205038], length 1448
17:39:21.566374 IP 192.168.1.100.56885 > 85.232.234.98.80: Flags [.], ack 25890, win 951, options [nop,nop,TS val 113205047 ecr 133038516,nop,nop,sack 1 {27338:47610}], length 0
17:39:21.576055 IP 85.232.234.98.80 > 192.168.1.100.56885: Flags [.], seq 47610:49058, ack 1755, win 146, options [nop,nop,TS val 133038532 ecr 113205038], length 1448
17:39:21.576101 IP 192.168.1.100.56885 > 85.232.234.98.80: Flags [.], ack 25890, win 951, options [nop,nop,TS val 113205050 ecr 133038516,nop,nop,sack 1 {27338:49058}], length 0
17:39:21.598564 IP 85.232.234.98.80 > 192.168.1.100.56885: Flags [P.], seq 49058:49972, ack 1755, win 146, options [nop,nop,TS val 133038532 ecr 113205038], length 914
17:39:21.598624 IP 192.168.1.100.56885 > 85.232.234.98.80: Flags [.], ack 25890, win 951, options [nop,nop,TS val 113205055 ecr 133038516,nop,nop,sack 1 {27338:49972}], length 0
17:39:21.600309 IP 85.232.234.98.80 > 192.168.1.100.56885: Flags [.], seq 25890:27338, ack 1755, win 146, options [nop,nop,TS val 133038536 ecr 113205042], length 1448
17:39:21.600354 IP 192.168.1.100.56885 > 85.232.234.98.80: Flags [.], ack 49972, win 655, options [nop,nop,TS val 113205056 ecr 133038536], length 0
17:39:21.601204 IP 85.232.234.98.80 > 192.168.1.100.56885: Flags [.], seq 43266:44714, ack 1755, win 146, options [nop,nop,TS val 133038542 ecr 113205047], length 1448
17:39:21.601215 IP 192.168.1.100.56885 > 85.232.234.98.80: Flags [.], ack 49972, win 655, options [nop,nop,TS val 113205056 ecr 133038536,nop,nop,sack 1 {43266:44714}], length 0
17:39:22.912157 IP 192.168.1.100.56884 > 85.232.234.98.80: Flags [P.], seq 578:1184, ack 18472, win 646, options [nop,nop,TS val 113205384 ecr 133038060], length 606
17:39:22.943904 IP 85.232.234.98.80 > 192.168.1.100.56884: Flags [.], ack 1184, win 128, options [nop,nop,TS val 133038878 ecr 113205384], length 0
17:39:23.443666 IP 85.232.234.98.80 > 192.168.1.100.56884: Flags [.], seq 18472:19920, ack 1184, win 128, options [nop,nop,TS val 133039003 ecr 113205384], length 1448
17:39:23.443715 IP 192.168.1.100.56884 > 85.232.234.98.80: Flags [.], ack 19920, win 691, options [nop,nop,TS val 113205517 ecr 133039003], length 0
17:39:23.446430 IP 85.232.234.98.80 > 192.168.1.100.56884: Flags [.], seq 19920:21368, ack 1184, win 128, options [nop,nop,TS val 133039003 ecr 113205384], length 1448
17:39:23.446476 IP 192.168.1.100.56884 > 85.232.234.98.80: Flags [.], ack 21368, win 737, options [nop,nop,TS val 113205517 ecr 133039003], length 0
17:39:23.448822 IP 85.232.234.98.80 > 192.168.1.100.56884: Flags [.], seq 21368:22816, ack 1184, win 128, options [nop,nop,TS val 133039003 ecr 113205384], length 1448
17:39:23.448873 IP 192.168.1.100.56884 > 85.232.234.98.80: Flags [.], ack 22816, win 782, options [nop,nop,TS val 113205518 ecr 133039003], length 0
17:39:23.485167 IP 85.232.234.98.80 > 192.168.1.100.56884: Flags [.], seq 22816:24264, ack 1184, win 128, options [nop,nop,TS val 133039010 ecr 113205517], length 1448
17:39:23.485218 IP 192.168.1.100.56884 > 85.232.234.98.80: Flags [.], ack 24264, win 827, options [nop,nop,TS val 113205527 ecr 133039010], length 0
17:39:23.487495 IP 85.232.234.98.80 > 192.168.1.100.56884: Flags [.], seq 24264:25712, ack 1184, win 128, options [nop,nop,TS val 133039010 ecr 113205517], length 1448
17:39:23.487518 IP 192.168.1.100.56884 > 85.232.234.98.80: Flags [.], ack 25712, win 872, options [nop,nop,TS val 113205528 ecr 133039010], length 0
17:39:23.491786 IP 85.232.234.98.80 > 192.168.1.100.56884: Flags [.], seq 25712:27160, ack 1184, win 128, options [nop,nop,TS val 133039011 ecr 113205517], length 1448
17:39:23.491823 IP 192.168.1.100.56884 > 85.232.234.98.80: Flags [.], ack 27160, win 918, options [nop,nop,TS val 113205529 ecr 133039011], length 0
