16:05:29.223183 IP 192.168.1.100.58683 > 192.168.1.254.53: 49649+ AAAA? onet.pl. (25)
16:05:29.367180 IP 192.168.1.254.53 > 192.168.1.100.58683: 49649 0/1/0 (65)
16:05:29.367363 IP 192.168.1.100.49035 > 192.168.1.254.53: 12694+ AAAA? onet.pl. (25)
16:05:29.369453 IP 192.168.1.254.53 > 192.168.1.100.49035: 12694 0/1/0 (65)
16:05:29.369513 IP 192.168.1.100.47905 > 192.168.1.254.53: 24833+ A? onet.pl. (25)
16:05:29.389389 IP 192.168.1.254.53 > 192.168.1.100.47905: 24833 1/5/6 A 213.180.146.27 (258)
16:05:29.389718 IP 192.168.1.100.41904 > 213.180.146.27.80: Flags [S], seq 2438796016, win 5840, options [mss 1460,sackOK,TS val 111797003 ecr 0,nop,wscale 6], length 0
16:05:29.424643 IP 213.180.146.27.80 > 192.168.1.100.41904: Flags [S.], seq 605405512, ack 2438796017, win 5792, options [mss 1460,nop,nop,TS val 3698784835 ecr 111797003,nop,wscale 5], length 0
16:05:29.424713 IP 192.168.1.100.41904 > 213.180.146.27.80: Flags [.], ack 1, win 92, options [nop,nop,TS val 111797012 ecr 3698784835], length 0
16:05:29.425177 IP 192.168.1.100.41904 > 213.180.146.27.80: Flags [P.], seq 1:1103, ack 1, win 92, options [nop,nop,TS val 111797012 ecr 3698784835], length 1102
16:05:29.468309 IP 213.180.146.27.80 > 192.168.1.100.41904: Flags [.], ack 1103, win 250, options [nop,nop,TS val 3698784844 ecr 111797012], length 0
16:05:29.468599 IP 213.180.146.27.80 > 192.168.1.100.41904: Flags [P.], seq 1:440, ack 1103, win 250, options [nop,nop,TS val 3698784845 ecr 111797012], length 439
16:05:29.468620 IP 192.168.1.100.41904 > 213.180.146.27.80: Flags [.], ack 440, win 108, options [nop,nop,TS val 111797023 ecr 3698784845], length 0
16:05:29.479512 IP 192.168.1.100.48504 > 192.168.1.254.53: 3060+ AAAA? www.onet.pl. (29)
16:05:29.507071 IP 192.168.1.254.53 > 192.168.1.100.48504: 3060 0/1/0 (69)
16:05:29.507289 IP 192.168.1.100.44089 > 192.168.1.254.53: 846+ AAAA? www.onet.pl. (29)
16:05:29.509349 IP 192.168.1.254.53 > 192.168.1.100.44089: 846 0/1/0 (69)
16:05:29.509444 IP 192.168.1.100.56467 > 192.168.1.254.53: 50169+ A? www.onet.pl. (29)
16:05:29.570118 IP 192.168.1.254.53 > 192.168.1.100.56467: 50169 1/5/6 A 213.180.146.27 (262)
16:05:29.570512 IP 192.168.1.100.41905 > 213.180.146.27.80: Flags [S], seq 2443847700, win 5840, options [mss 1460,sackOK,TS val 111797048 ecr 0,nop,wscale 6], length 0
16:05:29.611552 IP 213.180.146.27.80 > 192.168.1.100.41905: Flags [S.], seq 3540280692, ack 2443847701, win 5792, options [mss 1460,nop,nop,TS val 3673532770 ecr 111797048,nop,wscale 5], length 0
16:05:29.611606 IP 192.168.1.100.41905 > 213.180.146.27.80: Flags [.], ack 1, win 92, options [nop,nop,TS val 111797059 ecr 3673532770], length 0
16:05:29.611850 IP 192.168.1.100.41905 > 213.180.146.27.80: Flags [P.], seq 1:1165, ack 1, win 92, options [nop,nop,TS val 111797059 ecr 3673532770], length 1164
16:05:29.666895 IP 213.180.146.27.80 > 192.168.1.100.41905: Flags [.], seq 1:1449, ack 1165, win 254, options [nop,nop,TS val 3673532782 ecr 111797059], length 1448
16:05:29.666952 IP 192.168.1.100.41905 > 213.180.146.27.80: Flags [.], ack 1449, win 137, options [nop,nop,TS val 111797073 ecr 3673532782], length 0
16:05:29.666960 IP 213.180.146.27.80 > 192.168.1.100.41905: Flags [.], ack 1165, win 254, options [nop,nop,TS val 3673532782 ecr 111797059], length 0
16:05:29.666969 IP 192.168.1.100.41905 > 213.180.146.27.80: Flags [.], ack 1449, win 137, options [nop,nop,TS val 111797073 ecr 3673532782], length 0
16:05:29.669971 IP 213.180.146.27.80 > 192.168.1.100.41905: Flags [.], seq 1449:2897, ack 1165, win 254, options [nop,nop,TS val 3673532782 ecr 111797059], length 1448
16:05:29.670006 IP 192.168.1.100.41905 > 213.180.146.27.80: Flags [.], ack 2897, win 182, options [nop,nop,TS val 111797073 ecr 3673532782], length 0
16:05:29.707966 IP 213.180.146.27.80 > 192.168.1.100.41905: Flags [.], seq 2897:4345, ack 1165, win 254, options [nop,nop,TS val 3673532793 ecr 111797073], length 1448
16:05:29.708019 IP 192.168.1.100.41905 > 213.180.146.27.80: Flags [.], ack 4345, win 227, options [nop,nop,TS val 111797083 ecr 3673532793], length 0
16:05:29.708998 IP 213.180.146.27.80 > 192.168.1.100.41905: Flags [.], seq 4345:5793, ack 1165, win 254, options [nop,nop,TS val 3673532793 ecr 111797073], length 1448
16:05:29.709013 IP 192.168.1.100.41905 > 213.180.146.27.80: Flags [.], ack 5793, win 273, options [nop,nop,TS val 111797083 ecr 3673532793], length 0
16:05:29.710238 IP 213.180.146.27.80 > 192.168.1.100.41905: Flags [.], seq 5793:7241, ack 1165, win 254, options [nop,nop,TS val 3673532793 ecr 111797073], length 1448
16:05:29.710258 IP 192.168.1.100.41905 > 213.180.146.27.80: Flags [.], ack 7241, win 318, options [nop,nop,TS val 111797083 ecr 3673532793], length 0
16:05:29.710914 IP 213.180.146.27.80 > 192.168.1.100.41905: Flags [.], seq 7241:8689, ack 1165, win 254, options [nop,nop,TS val 3673532794 ecr 111797073], length 1448
16:05:29.710933 IP 192.168.1.100.41905 > 213.180.146.27.80: Flags [.], ack 8689, win 363, options [nop,nop,TS val 111797084 ecr 3673532794], length 0
16:05:29.726323 IP 192.168.1.100.41906 > 213.180.146.27.80: Flags [S], seq 2449380889, win 5840, options [mss 1460,sackOK,TS val 111797087 ecr 0,nop,wscale 6], length 0
16:05:29.743095 IP 213.180.146.27.80 > 192.168.1.100.41905: Flags [.], seq 8689:10137, ack 1165, win 254, options [nop,nop,TS val 3673532802 ecr 111797083], length 1448
16:05:29.743142 IP 192.168.1.100.41905 > 213.180.146.27.80: Flags [.], ack 10137, win 408, options [nop,nop,TS val 111797092 ecr 3673532802], length 0
16:05:29.744445 IP 213.180.146.27.80 > 192.168.1.100.41905: Flags [P.], seq 10137:11585, ack 1165, win 254, options [nop,nop,TS val 3673532802 ecr 111797083], length 1448
16:05:29.744481 IP 192.168.1.100.41905 > 213.180.146.27.80: Flags [.], ack 11585, win 454, options [nop,nop,TS val 111797092 ecr 3673532802], length 0
16:05:29.747993 IP 213.180.146.27.80 > 192.168.1.100.41905: Flags [.], seq 13033:14481, ack 1165, win 254, options [nop,nop,TS val 3673532802 ecr 111797083], length 1448
16:05:29.748036 IP 192.168.1.100.41905 > 213.180.146.27.80: Flags [.], ack 11585, win 454, options [nop,nop,TS val 111797093 ecr 3673532802], length 0
16:05:29.749156 IP 213.180.146.27.80 > 192.168.1.100.41905: Flags [.], seq 17377:18825, ack 1165, win 254, options [nop,nop,TS val 3673532803 ecr 111797084], length 1448
16:05:29.749178 IP 192.168.1.100.41905 > 213.180.146.27.80: Flags [.], ack 11585, win 454, options [nop,nop,TS val 111797093 ecr 3673532802], length 0
16:05:29.750022 IP 213.180.146.27.80 > 192.168.1.100.41905: Flags [P.], seq 18825:20273, ack 1165, win 254, options [nop,nop,TS val 3673532803 ecr 111797084], length 1448
16:05:29.750038 IP 192.168.1.100.41905 > 213.180.146.27.80: Flags [.], ack 11585, win 454, options [nop,nop,TS val 111797093 ecr 3673532802], length 0
16:05:29.753767 IP 213.180.146.27.80 > 192.168.1.100.41905: Flags [.], seq 11585:13033, ack 1165, win 254, options [nop,nop,TS val 3673532802 ecr 111797083], length 1448
16:05:29.753821 IP 192.168.1.100.41905 > 213.180.146.27.80: Flags [.], ack 14481, win 499, options [nop,nop,TS val 111797094 ecr 3673532802], length 0
16:05:29.754012 IP 213.180.146.27.80 > 192.168.1.100.41905: Flags [.], seq 14481:15929, ack 1165, win 254, options [nop,nop,TS val 3673532802 ecr 111797083], length 1448
16:05:29.754025 IP 192.168.1.100.41905 > 213.180.146.27.80: Flags [.], ack 15929, win 544, options [nop,nop,TS val 111797094 ecr 3673532802], length 0
16:05:29.754132 IP 213.180.146.27.80 > 192.168.1.100.41905: Flags [.], seq 15929:17377, ack 1165, win 254, options [nop,nop,TS val 3673532802 ecr 111797083], length 1448
16:05:29.754156 IP 192.168.1.100.41905 > 213.180.146.27.80: Flags [.], ack 20273, win 589, options [nop,nop,TS val 111797094 ecr 3673532802], length 0
16:05:29.762031 IP 213.180.146.27.80 > 192.168.1.100.41906: Flags [S.], seq 2013183107, ack 2449380890, win 5792, options [mss 1460,nop,nop,TS val 3263492003 ecr 111797087,nop,wscale 5], length 0
16:05:29.762082 IP 192.168.1.100.41906 > 213.180.146.27.80: Flags [.], ack 1, win 92, options [nop,nop,TS val 111797096 ecr 3263492003], length 0
16:05:29.765907 IP 192.168.1.100.41906 > 213.180.146.27.80: Flags [P.], seq 1:1217, ack 1, win 92, options [nop,nop,TS val 111797097 ecr 3263492003], length 1216
16:05:29.766898 IP 192.168.1.100.47720 > 192.168.1.254.53: 748+ AAAA? lib.onet.pl. (29)
16:05:29.779200 IP 192.168.1.100.55394 > 192.168.1.254.53: 59379+ AAAA? reklama.onet.pl. (33)
16:05:29.786840 IP 192.168.1.254.53 > 192.168.1.100.47720: 748 1/1/0 CNAME[|domain]
16:05:29.787030 IP 192.168.1.100.52703 > 192.168.1.254.53: 55393+ A? lib.onet.pl. (29)
16:05:29.789590 IP 213.180.146.27.80 > 192.168.1.100.41905: Flags [.], seq 20273:21721, ack 1165, win 254, options [nop,nop,TS val 3673532812 ecr 111797092], length 1448
16:05:29.789625 IP 192.168.1.100.41905 > 213.180.146.27.80: Flags [.], ack 21721, win 635, options [nop,nop,TS val 111797103 ecr 3673532812], length 0
16:05:29.789698 IP 213.180.146.27.80 > 192.168.1.100.41905: Flags [.], seq 21721:23169, ack 1165, win 254, options [nop,nop,TS val 3673532812 ecr 111797092], length 1448
16:05:29.789707 IP 192.168.1.100.41905 > 213.180.146.27.80: Flags [.], ack 23169, win 680, options [nop,nop,TS val 111797103 ecr 3673532812], length 0
16:05:29.792219 IP 213.180.146.27.80 > 192.168.1.100.41905: Flags [P.], seq 23169:24028, ack 1165, win 254, options [nop,nop,TS val 3673532812 ecr 111797092], length 859
16:05:29.792284 IP 192.168.1.100.41905 > 213.180.146.27.80: Flags [.], ack 24028, win 725, options [nop,nop,TS val 111797104 ecr 3673532812], length 0
16:05:29.798937 IP 192.168.1.254.53 > 192.168.1.100.52703: 55393 2/5/6 CNAME[|domain]
16:05:29.803969 IP 213.180.146.27.80 > 192.168.1.100.41906: Flags [.], ack 1217, win 257, options [nop,nop,TS val 3263492013 ecr 111797097], length 0
16:05:29.806179 IP 213.180.146.27.80 > 192.168.1.100.41906: Flags [.], seq 1:1449, ack 1217, win 257, options [nop,nop,TS val 3263492013 ecr 111797097], length 1448
16:05:29.806221 IP 192.168.1.100.41906 > 213.180.146.27.80: Flags [.], ack 1449, win 137, options [nop,nop,TS val 111797107 ecr 3263492013], length 0
16:05:29.808035 IP 213.180.146.27.80 > 192.168.1.100.41906: Flags [.], seq 1449:2897, ack 1217, win 257, options [nop,nop,TS val 3263492013 ecr 111797097], length 1448
16:05:29.808068 IP 192.168.1.100.41906 > 213.180.146.27.80: Flags [.], ack 2897, win 182, options [nop,nop,TS val 111797108 ecr 3263492013], length 0
16:05:29.813313 IP 192.168.1.100.50566 > 213.180.146.122.80: Flags [S], seq 2458835869, win 5840, options [mss 1460,sackOK,TS val 111797109 ecr 0,nop,wscale 6], length 0
16:05:29.836393 IP 213.180.146.27.80 > 192.168.1.100.41906: Flags [.], seq 2897:4345, ack 1217, win 257, options [nop,nop,TS val 3263492022 ecr 111797107], length 1448
16:05:29.836558 IP 192.168.1.100.41906 > 213.180.146.27.80: Flags [.], ack 4345, win 227, options [nop,nop,TS val 111797115 ecr 3263492022], length 0
16:05:29.837263 IP 213.180.146.27.80 > 192.168.1.100.41906: Flags [.], seq 4345:5793, ack 1217, win 257, options [nop,nop,TS val 3263492022 ecr 111797107], length 1448
16:05:29.837282 IP 192.168.1.100.41906 > 213.180.146.27.80: Flags [.], ack 5793, win 273, options [nop,nop,TS val 111797115 ecr 3263492022], length 0
16:05:29.841625 IP 213.180.146.27.80 > 192.168.1.100.41906: Flags [.], seq 5793:7241, ack 1217, win 257, options [nop,nop,TS val 3263492023 ecr 111797108], length 1448
16:05:29.841668 IP 192.168.1.100.41906 > 213.180.146.27.80: Flags [.], ack 7241, win 318, options [nop,nop,TS val 111797116 ecr 3263492023], length 0
16:05:29.841872 IP 213.180.146.27.80 > 192.168.1.100.41906: Flags [.], seq 7241:8689, ack 1217, win 257, options [nop,nop,TS val 3263492023 ecr 111797108], length 1448
16:05:29.841891 IP 192.168.1.100.41906 > 213.180.146.27.80: Flags [.], ack 8689, win 363, options [nop,nop,TS val 111797116 ecr 3263492023], length 0
16:05:29.850666 IP 213.180.146.122.80 > 192.168.1.100.50566: Flags [S.], seq 1925400313, ack 2458835870, win 5792, options [mss 1460,nop,nop,TS val 2143823806 ecr 111797109,nop,wscale 5], length 0
16:05:29.850769 IP 192.168.1.100.50566 > 213.180.146.122.80: Flags [.], ack 1, win 92, options [nop,nop,TS val 111797118 ecr 2143823806], length 0
16:05:29.854884 IP 192.168.1.100.50566 > 213.180.146.122.80: Flags [P.], seq 1:1118, ack 1, win 92, options [nop,nop,TS val 111797120 ecr 2143823806], length 1117
16:05:29.876192 IP 213.180.146.27.80 > 192.168.1.100.41906: Flags [.], seq 8689:10137, ack 1217, win 257, options [nop,nop,TS val 3263492030 ecr 111797115], length 1448
16:05:29.876233 IP 192.168.1.100.41906 > 213.180.146.27.80: Flags [.], ack 10137, win 408, options [nop,nop,TS val 111797125 ecr 3263492030], length 0
16:05:29.878545 IP 213.180.146.27.80 > 192.168.1.100.41906: Flags [P.], seq 10137:10790, ack 1217, win 257, options [nop,nop,TS val 3263492030 ecr 111797115], length 653
16:05:29.878563 IP 192.168.1.100.41906 > 213.180.146.27.80: Flags [.], ack 10790, win 454, options [nop,nop,TS val 111797125 ecr 3263492030], length 0
16:05:29.896065 IP 213.180.146.122.80 > 192.168.1.100.50566: Flags [.], ack 1118, win 251, options [nop,nop,TS val 2143823817 ecr 111797120], length 0
16:05:29.902060 IP 192.168.1.254.53 > 192.168.1.100.55394: 59379 1/1/0 CNAME[|domain]
16:05:29.904759 IP 192.168.1.100.49706 > 192.168.1.254.53: 58241+ A? reklama.onet.pl. (33)
16:05:29.912771 IP 213.180.146.122.80 > 192.168.1.100.50566: Flags [P.], seq 1:890, ack 1118, win 251, options [nop,nop,TS val 2143823817 ecr 111797120], length 889
16:05:29.912811 IP 192.168.1.100.50566 > 213.180.146.122.80: Flags [.], ack 890, win 120, options [nop,nop,TS val 111797134 ecr 2143823817], length 0
16:05:29.987286 IP 192.168.1.254.53 > 192.168.1.100.49706: 58241 2/2/0 CNAME[|domain]
16:05:29.988351 IP 192.168.1.100.46714 > 213.180.130.200.80: Flags [S], seq 2450968204, win 5840, options [mss 1460,sackOK,TS val 111797153 ecr 0,nop,wscale 6], length 0
16:05:29.988408 IP 192.168.1.100.46715 > 213.180.130.200.80: Flags [S], seq 2457928360, win 5840, options [mss 1460,sackOK,TS val 111797153 ecr 0,nop,wscale 6], length 0
16:05:30.025787 IP 213.180.130.200.80 > 192.168.1.100.46714: Flags [S.], seq 3428566622, ack 2450968205, win 5792, options [mss 1460,nop,nop,TS val 1670497887 ecr 111797153,nop,wscale 4], length 0
16:05:30.025858 IP 192.168.1.100.46714 > 213.180.130.200.80: Flags [.], ack 1, win 92, options [nop,nop,TS val 111797162 ecr 1670497887], length 0
16:05:30.025865 IP 213.180.130.200.80 > 192.168.1.100.46715: Flags [S.], seq 4284276352, ack 2457928361, win 5792, options [mss 1460,nop,nop,TS val 1428770518 ecr 111797153,nop,wscale 5], length 0
16:05:30.025876 IP 192.168.1.100.46715 > 213.180.130.200.80: Flags [.], ack 1, win 92, options [nop,nop,TS val 111797162 ecr 1428770518], length 0
16:05:30.030905 IP 192.168.1.100.46714 > 213.180.130.200.80: Flags [P.], seq 1:1114, ack 1, win 92, options [nop,nop,TS val 111797164 ecr 1670497887], length 1113
16:05:30.030930 IP 192.168.1.100.46715 > 213.180.130.200.80: Flags [P.], seq 1:1099, ack 1, win 92, options [nop,nop,TS val 111797164 ecr 1428770518], length 1098
16:05:30.066430 IP 213.180.130.200.80 > 192.168.1.100.46714: Flags [.], ack 1114, win 502, options [nop,nop,TS val 1670497899 ecr 111797164], length 0
16:05:30.066605 IP 213.180.130.200.80 > 192.168.1.100.46714: Flags [P.], seq 1449:1535, ack 1114, win 502, options [nop,nop,TS val 1670497899 ecr 111797164], length 86
16:05:30.066644 IP 192.168.1.100.46714 > 213.180.130.200.80: Flags [.], ack 1, win 92, options [nop,nop,TS val 111797172 ecr 1670497899], length 0
16:05:30.070208 IP 192.168.1.100.41905 > 213.180.146.27.80: Flags [P.], seq 1165:2319, ack 24028, win 725, options [nop,nop,TS val 111797173 ecr 3673532812], length 1154
16:05:30.073422 IP 213.180.130.200.80 > 192.168.1.100.46714: Flags [.], seq 1:1449, ack 1114, win 502, options [nop,nop,TS val 1670497899 ecr 111797164], length 1448
16:05:30.073467 IP 192.168.1.100.46714 > 213.180.130.200.80: Flags [.], ack 1535, win 137, options [nop,nop,TS val 111797174 ecr 1670497899], length 0
16:05:30.073703 IP 213.180.130.200.80 > 192.168.1.100.46715: Flags [.], ack 1099, win 250, options [nop,nop,TS val 1428770530 ecr 111797164], length 0
16:05:30.078356 IP 213.180.130.200.80 > 192.168.1.100.46715: Flags [P.], seq 1:454, ack 1099, win 250, options [nop,nop,TS val 1428770530 ecr 111797164], length 453
16:05:30.078392 IP 192.168.1.100.46715 > 213.180.130.200.80: Flags [.], ack 454, win 108, options [nop,nop,TS val 111797175 ecr 1428770530], length 0
16:05:30.079520 IP 213.180.130.200.80 > 192.168.1.100.46715: Flags [P.], seq 454:1369, ack 1099, win 250, options [nop,nop,TS val 1428770530 ecr 111797164], length 915
16:05:30.079551 IP 192.168.1.100.46715 > 213.180.130.200.80: Flags [.], ack 1369, win 137, options [nop,nop,TS val 111797176 ecr 1428770530], length 0
16:05:30.112895 IP 213.180.146.27.80 > 192.168.1.100.41905: Flags [.], seq 24028:25476, ack 2319, win 327, options [nop,nop,TS val 3673532895 ecr 111797173], length 1448
16:05:30.112981 IP 192.168.1.100.41905 > 213.180.146.27.80: Flags [.], ack 25476, win 770, options [nop,nop,TS val 111797184 ecr 3673532895], length 0
16:05:30.116354 IP 213.180.146.27.80 > 192.168.1.100.41905: Flags [.], seq 25476:26924, ack 2319, win 327, options [nop,nop,TS val 3673532895 ecr 111797173], length 1448
16:05:30.116421 IP 192.168.1.100.41905 > 213.180.146.27.80: Flags [.], ack 26924, win 816, options [nop,nop,TS val 111797185 ecr 3673532895], length 0
16:05:30.117869 IP 213.180.146.27.80 > 192.168.1.100.41905: Flags [P.], seq 26924:28138, ack 2319, win 327, options [nop,nop,TS val 3673532895 ecr 111797173], length 1214
16:05:30.117891 IP 192.168.1.100.41905 > 213.180.146.27.80: Flags [.], ack 28138, win 861, options [nop,nop,TS val 111797185 ecr 3673532895], length 0
16:05:30.151811 IP 213.180.146.27.80 > 192.168.1.100.41905: Flags [.], seq 28138:29586, ack 2319, win 327, options [nop,nop,TS val 3673532904 ecr 111797184], length 1448
16:05:30.151846 IP 192.168.1.100.41905 > 213.180.146.27.80: Flags [.], ack 29586, win 906, options [nop,nop,TS val 111797194 ecr 3673532904], length 0
16:05:30.153635 IP 213.180.146.27.80 > 192.168.1.100.41905: Flags [.], seq 29586:31034, ack 2319, win 327, options [nop,nop,TS val 3673532905 ecr 111797185], length 1448
16:05:30.153663 IP 192.168.1.100.41905 > 213.180.146.27.80: Flags [.], ack 31034, win 951, options [nop,nop,TS val 111797194 ecr 3673532905], length 0
16:05:30.154893 IP 213.180.146.27.80 > 192.168.1.100.41905: Flags [.], seq 31034:32482, ack 2319, win 327, options [nop,nop,TS val 3673532905 ecr 111797185], length 1448
16:05:30.154927 IP 192.168.1.100.41905 > 213.180.146.27.80: Flags [.], ack 32482, win 981, options [nop,nop,TS val 111797195 ecr 3673532905], length 0
16:05:30.155328 IP 213.180.146.27.80 > 192.168.1.100.41905: Flags [.], seq 32482:33930, ack 2319, win 327, options [nop,nop,TS val 3673532906 ecr 111797185], length 1448
16:05:30.155338 IP 192.168.1.100.41905 > 213.180.146.27.80: Flags [.], ack 33930, win 1002, options [nop,nop,TS val 111797195 ecr 3673532906], length 0
16:05:30.157145 IP 213.180.146.27.80 > 192.168.1.100.41905: Flags [.], seq 33930:35378, ack 2319, win 327, options [nop,nop,TS val 3673532906 ecr 111797185], length 1448
16:05:30.157180 IP 192.168.1.100.41905 > 213.180.146.27.80: Flags [.], ack 35378, win 1002, options [nop,nop,TS val 111797195 ecr 3673532906], length 0
16:05:30.181265 IP 213.180.146.27.80 > 192.168.1.100.41905: Flags [.], seq 35378:36826, ack 2319, win 327, options [nop,nop,TS val 3673532912 ecr 111797194], length 1448
16:05:30.181309 IP 192.168.1.100.41905 > 213.180.146.27.80: Flags [.], ack 36826, win 1002, options [nop,nop,TS val 111797201 ecr 3673532912], length 0
16:05:30.185415 IP 213.180.146.27.80 > 192.168.1.100.41905: Flags [.], seq 36826:38274, ack 2319, win 327, options [nop,nop,TS val 3673532912 ecr 111797194], length 1448
16:05:30.185448 IP 192.168.1.100.41905 > 213.180.146.27.80: Flags [.], ack 38274, win 1002, options [nop,nop,TS val 111797202 ecr 3673532912], length 0
16:05:30.187992 IP 213.180.146.27.80 > 192.168.1.100.41905: Flags [.], seq 38274:39722, ack 2319, win 327, options [nop,nop,TS val 3673532914 ecr 111797194], length 1448
16:05:30.188029 IP 192.168.1.100.41905 > 213.180.146.27.80: Flags [.], ack 39722, win 981, options [nop,nop,TS val 111797203 ecr 3673532914], length 0
16:05:30.188945 IP 213.180.146.27.80 > 192.168.1.100.41905: Flags [.], seq 42618:44066, ack 2319, win 327, options [nop,nop,TS val 3673532914 ecr 111797195], length 1448
16:05:30.188977 IP 192.168.1.100.41905 > 213.180.146.27.80: Flags [.], ack 39722, win 981, options [nop,nop,TS val 111797203 ecr 3673532914], length 0
16:05:30.190147 IP 213.180.146.27.80 > 192.168.1.100.41905: Flags [.], seq 44066:45514, ack 2319, win 327, options [nop,nop,TS val 3673532914 ecr 111797195], length 1448
16:05:30.190175 IP 192.168.1.100.41905 > 213.180.146.27.80: Flags [.], ack 39722, win 981, options [nop,nop,TS val 111797203 ecr 3673532914], length 0
16:05:30.191002 IP 213.180.146.27.80 > 192.168.1.100.41905: Flags [.], seq 45514:46962, ack 2319, win 327, options [nop,nop,TS val 3673532914 ecr 111797195], length 1448
16:05:30.191028 IP 192.168.1.100.41905 > 213.180.146.27.80: Flags [.], ack 39722, win 981, options [nop,nop,TS val 111797204 ecr 3673532914], length 0
16:05:30.192192 IP 213.180.146.27.80 > 192.168.1.100.41905: Flags [.], seq 46962:48410, ack 2319, win 327, options [nop,nop,TS val 3673532914 ecr 111797195], length 1448
16:05:30.192224 IP 192.168.1.100.41905 > 213.180.146.27.80: Flags [.], ack 39722, win 981, options [nop,nop,TS val 111797204 ecr 3673532914], length 0
16:05:30.193078 IP 213.180.146.27.80 > 192.168.1.100.41905: Flags [.], seq 39722:41170, ack 2319, win 327, options [nop,nop,TS val 3673532914 ecr 111797194], length 1448
16:05:30.193117 IP 192.168.1.100.41905 > 213.180.146.27.80: Flags [.], ack 41170, win 959, options [nop,nop,TS val 111797204 ecr 3673532914], length 0
16:05:30.193945 IP 213.180.146.27.80 > 192.168.1.100.41905: Flags [.], seq 41170:42618, ack 2319, win 327, options [nop,nop,TS val 3673532914 ecr 111797195], length 1448
16:05:30.193970 IP 192.168.1.100.41905 > 213.180.146.27.80: Flags [.], ack 48410, win 894, options [nop,nop,TS val 111797204 ecr 3673532914], length 0
16:05:30.194969 IP 213.180.146.27.80 > 192.168.1.100.41905: Flags [.], seq 48410:49858, ack 2319, win 327, options [nop,nop,TS val 3673532914 ecr 111797195], length 1448
16:05:30.194998 IP 192.168.1.100.41905 > 213.180.146.27.80: Flags [.], ack 49858, win 872, options [nop,nop,TS val 111797205 ecr 3673532914], length 0
16:05:30.220630 IP 213.180.146.27.80 > 192.168.1.100.41905: Flags [.], seq 49858:51306, ack 2319, win 327, options [nop,nop,TS val 3673532922 ecr 111797201], length 1448
16:05:30.220672 IP 192.168.1.100.41905 > 213.180.146.27.80: Flags [.], ack 51306, win 1002, options [nop,nop,TS val 111797211 ecr 3673532922], length 0
16:05:30.222626 IP 213.180.146.27.80 > 192.168.1.100.41905: Flags [P.], seq 51306:52593, ack 2319, win 327, options [nop,nop,TS val 3673532922 ecr 111797201], length 1287
16:05:30.222632 IP 192.168.1.100.41905 > 213.180.146.27.80: Flags [.], ack 52593, win 982, options [nop,nop,TS val 111797211 ecr 3673532922], length 0
16:05:30.228711 IP 192.168.1.100.41906 > 213.180.146.27.80: Flags [P.], seq 1217:2409, ack 10790, win 454, options [nop,nop,TS val 111797213 ecr 3263492030], length 1192
16:05:30.243001 IP 192.168.1.100.41905 > 213.180.146.27.80: Flags [P.], seq 2319:3508, ack 52593, win 1002, options [nop,nop,TS val 111797217 ecr 3673532922], length 1189
16:05:30.268109 IP 213.180.146.27.80 > 192.168.1.100.41906: Flags [.], seq 10790:12238, ack 2409, win 333, options [nop,nop,TS val 3263492131 ecr 111797213], length 1448
16:05:30.268321 IP 192.168.1.100.41906 > 213.180.146.27.80: Flags [.], ack 12238, win 499, options [nop,nop,TS val 111797223 ecr 3263492131], length 0
16:05:30.269002 IP 213.180.146.27.80 > 192.168.1.100.41906: Flags [P.], seq 13686:15013, ack 2409, win 333, options [nop,nop,TS val 3263492131 ecr 111797213], length 1327
16:05:30.269035 IP 192.168.1.100.41906 > 213.180.146.27.80: Flags [.], ack 12238, win 499, options [nop,nop,TS val 111797223 ecr 3263492131], length 0
16:05:30.269952 IP 213.180.146.27.80 > 192.168.1.100.41906: Flags [.], seq 12238:13686, ack 2409, win 333, options [nop,nop,TS val 3263492131 ecr 111797213], length 1448
16:05:30.269982 IP 192.168.1.100.41906 > 213.180.146.27.80: Flags [.], ack 15013, win 544, options [nop,nop,TS val 111797223 ecr 3263492131], length 0
16:05:30.276213 IP 213.180.146.27.80 > 192.168.1.100.41905: Flags [.], seq 54041:55489, ack 3508, win 401, options [nop,nop,TS val 3673532936 ecr 111797217], length 1448
16:05:30.276332 IP 192.168.1.100.41905 > 213.180.146.27.80: Flags [.], ack 52593, win 1002, options [nop,nop,TS val 111797225 ecr 3673532922], length 0
16:05:30.277243 IP 213.180.146.27.80 > 192.168.1.100.41905: Flags [.], seq 52593:54041, ack 3508, win 401, options [nop,nop,TS val 3673532936 ecr 111797217], length 1448
16:05:30.277272 IP 192.168.1.100.41905 > 213.180.146.27.80: Flags [.], ack 55489, win 981, options [nop,nop,TS val 111797225 ecr 3673532936], length 0
16:05:30.279204 IP 213.180.146.27.80 > 192.168.1.100.41905: Flags [P.], seq 55489:56816, ack 3508, win 401, options [nop,nop,TS val 3673532936 ecr 111797217], length 1327
16:05:30.279236 IP 192.168.1.100.41905 > 213.180.146.27.80: Flags [.], ack 56816, win 961, options [nop,nop,TS val 111797226 ecr 3673532936], length 0
16:05:30.279324 IP 213.180.146.27.80 > 192.168.1.100.41905: Flags [.], seq 56816:58264, ack 3508, win 401, options [nop,nop,TS val 3673532936 ecr 111797217], length 1448
16:05:30.279331 IP 192.168.1.100.41905 > 213.180.146.27.80: Flags [.], ack 58264, win 939, options [nop,nop,TS val 111797226 ecr 3673532936], length 0
16:05:30.279837 IP 192.168.1.100.54208 > 192.168.1.254.53: 25552+ AAAA? onet.hit.gemius.pl. (36)
16:05:30.280113 IP 213.180.146.27.80 > 192.168.1.100.41905: Flags [.], seq 58264:59712, ack 3508, win 401, options [nop,nop,TS val 3673532936 ecr 111797217], length 1448
16:05:30.280135 IP 192.168.1.100.41905 > 213.180.146.27.80: Flags [.], ack 59712, win 1002, options [nop,nop,TS val 111797226 ecr 3673532936], length 0
16:05:30.282444 IP 213.180.146.27.80 > 192.168.1.100.41905: Flags [P.], seq 59712:60912, ack 3508, win 401, options [nop,nop,TS val 3673532936 ecr 111797217], length 1200
16:05:30.282484 IP 192.168.1.100.41905 > 213.180.146.27.80: Flags [.], ack 60912, win 984, options [nop,nop,TS val 111797226 ecr 3673532936], length 0
16:05:30.282565 IP 213.180.146.27.80 > 192.168.1.100.41905: Flags [.], seq 60912:62360, ack 3508, win 401, options [nop,nop,TS val 3673532936 ecr 111797217], length 1448
16:05:30.282572 IP 192.168.1.100.41905 > 213.180.146.27.80: Flags [.], ack 62360, win 962, options [nop,nop,TS val 111797226 ecr 3673532936], length 0
16:05:30.284061 IP 213.180.146.27.80 > 192.168.1.100.41905: Flags [.], seq 62360:63808, ack 3508, win 401, options [nop,nop,TS val 3673532936 ecr 111797217], length 1448
16:05:30.284096 IP 192.168.1.100.41905 > 213.180.146.27.80: Flags [.], ack 63808, win 940, options [nop,nop,TS val 111797227 ecr 3673532936], length 0
16:05:30.284144 IP 213.180.146.27.80 > 192.168.1.100.41905: Flags [P.], seq 63808:65008, ack 3508, win 401, options [nop,nop,TS val 3673532936 ecr 111797217], length 1200
16:05:30.284151 IP 192.168.1.100.41905 > 213.180.146.27.80: Flags [.], ack 65008, win 922, options [nop,nop,TS val 111797227 ecr 3673532936], length 0
16:05:30.295575 IP 213.180.146.27.80 > 192.168.1.100.41906: Flags [.], seq 16461:17909, ack 2409, win 333, options [nop,nop,TS val 3263492138 ecr 111797223], length 1448
16:05:30.295622 IP 192.168.1.100.41906 > 213.180.146.27.80: Flags [.], ack 15013, win 544, options [nop,nop,TS val 111797230 ecr 3263492131], length 0
16:05:30.297059 IP 213.180.146.27.80 > 192.168.1.100.41906: Flags [.], seq 15013:16461, ack 2409, win 333, options [nop,nop,TS val 3263492138 ecr 111797223], length 1448
16:05:30.297103 IP 192.168.1.100.41906 > 213.180.146.27.80: Flags [.], ack 17909, win 589, options [nop,nop,TS val 111797230 ecr 3263492138], length 0
16:05:30.298270 IP 213.180.146.27.80 > 192.168.1.100.41906: Flags [.], seq 17909:19357, ack 2409, win 333, options [nop,nop,TS val 3263492138 ecr 111797223], length 1448
16:05:30.298301 IP 192.168.1.100.41906 > 213.180.146.27.80: Flags [.], ack 19357, win 635, options [nop,nop,TS val 111797230 ecr 3263492138], length 0
16:05:30.299482 IP 213.180.146.27.80 > 192.168.1.100.41906: Flags [.], seq 19357:20805, ack 2409, win 333, options [nop,nop,TS val 3263492138 ecr 111797223], length 1448
16:05:30.299514 IP 192.168.1.100.41906 > 213.180.146.27.80: Flags [.], ack 20805, win 680, options [nop,nop,TS val 111797231 ecr 3263492138], length 0
16:05:30.299813 IP 192.168.1.254.53 > 192.168.1.100.54208: 25552 0/1/0 (88)
16:05:30.300335 IP 213.180.146.27.80 > 192.168.1.100.41906: Flags [.], seq 20805:22253, ack 2409, win 333, options [nop,nop,TS val 3263492138 ecr 111797223], length 1448
16:05:30.300354 IP 192.168.1.100.41906 > 213.180.146.27.80: Flags [.], ack 22253, win 725, options [nop,nop,TS val 111797231 ecr 3263492138], length 0
16:05:30.304228 IP 213.180.146.27.80 > 192.168.1.100.41905: Flags [.], seq 65008:66456, ack 3508, win 401, options [nop,nop,TS val 3673532943 ecr 111797225], length 1448
16:05:30.304264 IP 192.168.1.100.41905 > 213.180.146.27.80: Flags [.], ack 66456, win 1002, options [nop,nop,TS val 111797232 ecr 3673532943], length 0
16:05:30.305289 IP 213.180.146.27.80 > 192.168.1.100.41905: Flags [.], seq 66456:67904, ack 3508, win 401, options [nop,nop,TS val 3673532943 ecr 111797225], length 1448
16:05:30.305304 IP 192.168.1.100.41905 > 213.180.146.27.80: Flags [.], ack 67904, win 981, options [nop,nop,TS val 111797232 ecr 3673532943], length 0
16:05:30.306394 IP 192.168.1.100.39728 > 192.168.1.254.53: 23767+ AAAA? onet.hit.gemius.pl. (36)
16:05:30.306603 IP 213.180.146.27.80 > 192.168.1.100.41905: Flags [.], seq 67904:69352, ack 3508, win 401, options [nop,nop,TS val 3673532943 ecr 111797225], length 1448
16:05:30.306629 IP 192.168.1.100.41905 > 213.180.146.27.80: Flags [.], ack 69352, win 1002, options [nop,nop,TS val 111797232 ecr 3673532943], length 0
16:05:30.308899 IP 192.168.1.254.53 > 192.168.1.100.39728: 23767 0/1/0 (88)
16:05:30.310012 IP 213.180.146.27.80 > 192.168.1.100.41905: Flags [.], seq 72248:73696, ack 3508, win 401, options [nop,nop,TS val 3673532944 ecr 111797226], length 1448
16:05:30.310051 IP 192.168.1.100.41905 > 213.180.146.27.80: Flags [.], ack 69352, win 1002, options [nop,nop,TS val 111797233 ecr 3673532943], length 0
16:05:30.310887 IP 213.180.146.27.80 > 192.168.1.100.41905: Flags [.], seq 69352:70800, ack 3508, win 401, options [nop,nop,TS val 3673532944 ecr 111797226], length 1448
16:05:30.310915 IP 192.168.1.100.41905 > 213.180.146.27.80: Flags [.], ack 70800, win 981, options [nop,nop,TS val 111797234 ecr 3673532944], length 0
16:05:30.311929 IP 213.180.146.27.80 > 192.168.1.100.41905: Flags [.], seq 70800:72248, ack 3508, win 401, options [nop,nop,TS val 3673532944 ecr 111797226], length 1448
16:05:30.311961 IP 192.168.1.100.41905 > 213.180.146.27.80: Flags [.], ack 73696, win 959, options [nop,nop,TS val 111797234 ecr 3673532944], length 0
16:05:30.312777 IP 213.180.146.27.80 > 192.168.1.100.41905: Flags [.], seq 73696:75144, ack 3508, win 401, options [nop,nop,TS val 3673532944 ecr 111797226], length 1448
16:05:30.312793 IP 192.168.1.100.41905 > 213.180.146.27.80: Flags [.], ack 75144, win 937, options [nop,nop,TS val 111797234 ecr 3673532944], length 0
16:05:30.313824 IP 213.180.146.27.80 > 192.168.1.100.41905: Flags [.], seq 75144:76592, ack 3508, win 401, options [nop,nop,TS val 3673532945 ecr 111797226], length 1448
16:05:30.313847 IP 192.168.1.100.41905 > 213.180.146.27.80: Flags [.], ack 76592, win 916, options [nop,nop,TS val 111797234 ecr 3673532945], length 0
16:05:30.315891 IP 192.168.1.100.35555 > 192.168.1.254.53: 65315+ A? onet.hit.gemius.pl. (36)
16:05:30.317895 IP 213.180.146.27.80 > 192.168.1.100.41905: Flags [.], seq 76592:78040, ack 3508, win 401, options [nop,nop,TS val 3673532945 ecr 111797226], length 1448
16:05:30.317946 IP 192.168.1.100.41905 > 213.180.146.27.80: Flags [.], ack 78040, win 1002, options [nop,nop,TS val 111797235 ecr 3673532945], length 0
16:05:30.317997 IP 213.180.146.27.80 > 192.168.1.100.41905: Flags [.], seq 78040:79488, ack 3508, win 401, options [nop,nop,TS val 3673532945 ecr 111797226], length 1448
16:05:30.318004 IP 192.168.1.100.41905 > 213.180.146.27.80: Flags [.], ack 79488, win 981, options [nop,nop,TS val 111797235 ecr 3673532945], length 0
16:05:30.318120 IP 213.180.146.27.80 > 192.168.1.100.41905: Flags [.], seq 79488:80936, ack 3508, win 401, options [nop,nop,TS val 3673532945 ecr 111797226], length 1448
16:05:30.318128 IP 192.168.1.100.41905 > 213.180.146.27.80: Flags [.], ack 80936, win 959, options [nop,nop,TS val 111797235 ecr 3673532945], length 0
16:05:30.318402 IP 213.180.146.27.80 > 192.168.1.100.41905: Flags [.], seq 83832:85280, ack 3508, win 401, options [nop,nop,TS val 3673532945 ecr 111797227], length 1448
16:05:30.318415 IP 192.168.1.100.41905 > 213.180.146.27.80: Flags [.], ack 80936, win 959, options [nop,nop,TS val 111797235 ecr 3673532945], length 0
16:05:30.320355 IP 213.180.146.27.80 > 192.168.1.100.41905: Flags [.], seq 80936:82384, ack 3508, win 401, options [nop,nop,TS val 3673532945 ecr 111797226], length 1448
16:05:30.320395 IP 192.168.1.100.41905 > 213.180.146.27.80: Flags [.], ack 82384, win 937, options [nop,nop,TS val 111797236 ecr 3673532945], length 0
16:05:30.320460 IP 213.180.146.27.80 > 192.168.1.100.41905: Flags [.], seq 82384:83832, ack 3508, win 401, options [nop,nop,TS val 3673532945 ecr 111797226], length 1448
16:05:30.320470 IP 192.168.1.100.41905 > 213.180.146.27.80: Flags [.], ack 85280, win 894, options [nop,nop,TS val 111797236 ecr 3673532945], length 0
16:05:30.320489 IP 213.180.146.27.80 > 192.168.1.100.41905: Flags [P.], seq 85280:85558, ack 3508, win 401, options [nop,nop,TS val 3673532945 ecr 111797227], length 278
16:05:30.320496 IP 192.168.1.100.41905 > 213.180.146.27.80: Flags [.], ack 85558, win 890, options [nop,nop,TS val 111797236 ecr 3673532945], length 0
16:05:30.323690 IP 192.168.1.100.57939 > 192.168.1.254.53: 56684+ AAAA? csr.onet.pl. (29)
16:05:30.331878 IP 192.168.1.254.53 > 192.168.1.100.35555: 65315 4/2/2 A[|domain]
16:05:30.334819 IP 192.168.1.100.60521 > 213.180.131.183.80: Flags [S], seq 2455918612, win 5840, options [mss 1460,sackOK,TS val 111797240 ecr 0,nop,wscale 6], length 0
16:05:30.334927 IP 213.180.146.27.80 > 192.168.1.100.41906: Flags [.], seq 22253:23701, ack 2409, win 333, options [nop,nop,TS val 3263492145 ecr 111797230], length 1448
16:05:30.334948 IP 192.168.1.100.41906 > 213.180.146.27.80: Flags [.], ack 23701, win 770, options [nop,nop,TS val 111797240 ecr 3263492145], length 0
16:05:30.343157 IP 213.180.146.27.80 > 192.168.1.100.41906: Flags [.], seq 23701:25149, ack 2409, win 333, options [nop,nop,TS val 3263492146 ecr 111797230], length 1448
16:05:30.343200 IP 192.168.1.100.41906 > 213.180.146.27.80: Flags [.], ack 25149, win 816, options [nop,nop,TS val 111797242 ecr 3263492146], length 0
16:05:30.345164 IP 213.180.146.27.80 > 192.168.1.100.41906: Flags [.], seq 25149:26597, ack 2409, win 333, options [nop,nop,TS val 3263492146 ecr 111797230], length 1448
16:05:30.345199 IP 192.168.1.100.41906 > 213.180.146.27.80: Flags [.], ack 26597, win 861, options [nop,nop,TS val 111797242 ecr 3263492146], length 0
16:05:30.352350 IP 213.180.146.27.80 > 192.168.1.100.41906: Flags [.], seq 26597:28045, ack 2409, win 333, options [nop,nop,TS val 3263492146 ecr 111797230], length 1448
16:05:30.352384 IP 192.168.1.100.41906 > 213.180.146.27.80: Flags [.], ack 28045, win 906, options [nop,nop,TS val 111797244 ecr 3263492146], length 0
16:05:30.358109 IP 213.180.146.27.80 > 192.168.1.100.41906: Flags [.], seq 28045:29493, ack 2409, win 333, options [nop,nop,TS val 3263492146 ecr 111797230], length 1448
16:05:30.358146 IP 192.168.1.100.41906 > 213.180.146.27.80: Flags [.], ack 29493, win 951, options [nop,nop,TS val 111797245 ecr 3263492146], length 0
16:05:30.364593 IP 192.168.1.254.53 > 192.168.1.100.57939: 56684 1/1/0 CNAME[|domain]
16:05:30.364796 IP 192.168.1.100.37265 > 192.168.1.254.53: 41158+ A? csr.onet.pl. (29)
16:05:30.366496 IP 213.180.146.27.80 > 192.168.1.100.41906: Flags [.], seq 29493:30941, ack 2409, win 333, options [nop,nop,TS val 3263492146 ecr 111797231], length 1448
16:05:30.366516 IP 192.168.1.100.41906 > 213.180.146.27.80: Flags [.], ack 30941, win 997, options [nop,nop,TS val 111797247 ecr 3263492146], length 0
16:05:30.375007 IP 213.180.131.183.80 > 192.168.1.100.60521: Flags [S.], seq 3351193955, ack 2455918613, win 65535, options [mss 1460,nop,wscale 3,sackOK,TS val 1476666520 ecr 111797240], length 0
16:05:30.375069 IP 192.168.1.100.60521 > 213.180.131.183.80: Flags [.], ack 1, win 92, options [nop,nop,TS val 111797250 ecr 1476666520], length 0
16:05:30.376795 IP 213.180.146.27.80 > 192.168.1.100.41906: Flags [.], seq 30941:32389, ack 2409, win 333, options [nop,nop,TS val 3263492146 ecr 111797231], length 1448
16:05:30.376831 IP 192.168.1.100.41906 > 213.180.146.27.80: Flags [.], ack 32389, win 1002, options [nop,nop,TS val 111797250 ecr 3263492146], length 0
16:05:30.377448 IP 192.168.1.100.60521 > 213.180.131.183.80: Flags [P.], seq 1:674, ack 1, win 92, options [nop,nop,TS val 111797250 ecr 1476666520], length 673
16:05:30.388934 IP 192.168.1.254.53 > 192.168.1.100.37265: 41158 2/5/6 CNAME[|domain]
16:05:30.389238 IP 192.168.1.100.51394 > 213.180.146.120.80: Flags [S], seq 2461945014, win 5840, options [mss 1460,sackOK,TS val 111797253 ecr 0,nop,wscale 6], length 0
16:05:30.391647 IP 213.180.146.27.80 > 192.168.1.100.41906: Flags [.], seq 32389:33837, ack 2409, win 333, options [nop,nop,TS val 3263492146 ecr 111797231], length 1448
16:05:30.391669 IP 192.168.1.100.41906 > 213.180.146.27.80: Flags [.], ack 33837, win 1002, options [nop,nop,TS val 111797254 ecr 3263492146], length 0
16:05:30.402767 IP 213.180.146.27.80 > 192.168.1.100.41906: Flags [.], seq 33837:35285, ack 2409, win 333, options [nop,nop,TS val 3263492146 ecr 111797231], length 1448
16:05:30.402799 IP 192.168.1.100.41906 > 213.180.146.27.80: Flags [.], ack 35285, win 1002, options [nop,nop,TS val 111797257 ecr 3263492146], length 0
16:05:30.408019 IP 213.180.146.27.80 > 192.168.1.100.41906: Flags [.], seq 35285:36733, ack 2409, win 333, options [nop,nop,TS val 3263492155 ecr 111797240], length 1448
16:05:30.408054 IP 192.168.1.100.41906 > 213.180.146.27.80: Flags [.], ack 36733, win 1002, options [nop,nop,TS val 111797258 ecr 3263492155], length 0
16:05:30.414061 IP 213.180.131.183.80 > 192.168.1.100.60521: Flags [P.], seq 1:597, ack 674, win 8326, options [nop,nop,TS val 1476666562 ecr 111797250], length 596
16:05:30.414108 IP 192.168.1.100.60521 > 213.180.131.183.80: Flags [.], ack 597, win 110, options [nop,nop,TS val 111797259 ecr 1476666562], length 0
16:05:30.414352 IP 192.168.1.100.60521 > 213.180.131.183.80: Flags [F.], seq 674, ack 597, win 110, options [nop,nop,TS val 111797259 ecr 1476666562], length 0
16:05:30.416816 IP 213.180.146.27.80 > 192.168.1.100.41906: Flags [.], seq 36733:38181, ack 2409, win 333, options [nop,nop,TS val 3263492155 ecr 111797240], length 1448
16:05:30.416860 IP 192.168.1.100.41906 > 213.180.146.27.80: Flags [.], ack 38181, win 1002, options [nop,nop,TS val 111797260 ecr 3263492155], length 0
16:05:30.416867 IP 213.180.131.183.80 > 192.168.1.100.60521: Flags [F.], seq 597, ack 674, win 8326, options [nop,nop,TS val 1476666562 ecr 111797250], length 0
16:05:30.416881 IP 192.168.1.100.60521 > 213.180.131.183.80: Flags [.], ack 598, win 110, options [nop,nop,TS val 111797260 ecr 1476666562], length 0
